Description,Price/Unit,Unit,Price/Measure,MeasureSuper Facialist for Men Anti-Ageing Day Moisturiser 75ml,11.50,unit,15.34,100ml
Maybelline Dream Urban Cover All-In-One Protective Makeup 100 Warm Ivory,7.00,unit,7.00,ea
Maybelline Tattoo Brow Tint Dark Brown 4.9ml,13.00,unit,13.00,ea
Maybelline Superstay Matte Ink Crayon Lipstick 25 Stay Exceptional,10.00,unit,10.00,ea
Boutique Lip Plumping Hydrating Gloss One Night Only 5ml,4.00,unit,4.00,ea
Boutique Convertible Eye & Cheek Jelly Pink Champagne,4.00,unit,4.00,ea
Maybelline Falsies Volum' Express,9.00,unit,10.00,10ml
So Eco Blush Brush,8.50,unit,8.50,ea
Maybelline Dream Urban Cover All-In-One Protective Makeup 220 Natural Beige,7.00,unit,7.00,ea
Rimmel London Lasting Radiance Foundation Porcelain,7.00,unit,7.00,ea
Herbal Essences bio-renew Hair Mask Argan Oil 250ml,3.00,unit,1.20,100ml
Rimmel London Lasting Matte Foundation 103 True Ivory 30ml,8.00,unit,26.67,100ml
Rimmel London 60 Seconds Super Shine by Rita Ora 498 Rain Rain Go Away 8ml,3.50,unit,43.75,100ml
Maybelline Super Stay Flash Dry 10ml,6.00,unit,6.00,ea
Rimmel London 60 Seconds Super Shine 452 Chin Up Buttercup 8ml,3.50,unit,43.75,100ml
L'Oreal Paris Preference Permanent Hair Dye Rio Vey Deep Rose Gold Brown 5.23,6.00,unit,6.00,ea
Elegant Touch Polished Nails Garnet 308,6.50,unit,6.50,ea
Real Techniques Finish Blush Brush,10.00,unit,10.00,ea
Garnier Moisture Bomb Night-Time Eye Sheet Mask Deep Sea Water & Hyaluronic Acid 6g,2.00,unit,33.33,100g
Olay Eyes Deep Hydrating Eye Gel 15ml,25.00,unit,166.67,100ml
Sanctuary Spa Mum to Be Pamper Jar,14.00,unit,14.00,ea
Intimately Beckham Men Natural Spray 75ml,15.00,unit,20.00,100ml
Collection Fast Stroke Defining Lash Mascara 1 Black 9ml,3.00,unit,3.33,10ml
Weleda Almond Soothing Cleansing Lotion 75ml,10.50,unit,14.00,100ml
Max Factor Rise & Shine Mascara Black 12ml,13.00,unit,108.33,100ml
Garnier Pure Active Tea Tree & Salicylic Acid Sheet Mask 23g,2.00,unit,2.00,ea
Rimmel London Stay Matte Liquid Lip Colour 220 Fatal Kiss 5.5ml,6.50,unit,118.18,100ml
Maybelline Superstay Matte Ink 80 Ruler 5ml,7.00,unit,14.00,10ml
Maybelline Superstay 7 Days City Nudes Nail Color 892 Dusted Pearl 49g,4.50,unit,4.50,ea
Boutique Moisturising Lip Burnt Orange,3.00,unit,3.00,ea
Rimmel London Scandal'Eyes Waterproof Kohl Kajal Eye Liner 003 Brown 1.3g,4.00,unit,4.00,ea
Collection Primed & Ready Make-up Fixing Spray 100ml,6.00,unit,6.00,100ml
Rimmel London Fix & Protect SPF 25 UV Shield Makeup Primer 30ml,7.00,unit,23.33,100ml
Garnier Olia Permanent No Ammonia Hair Dye Super Light Blonde 110,6.00,unit,6.00,ea
Bleach London Reincarnation Mask 200ml,6.00,unit,6.00,ea
King C Gillette Double Edge Safety Razor Blades Refills x10,5.00,unit,50p,bld
Collection Extreme 24 Hour Felt Tip Liner 1 Black,3.00,unit,20.00,10ml
Boutique Contouring Brush,4.00,unit,4.00,ea
Rimmel London Wonder'Ink Liquid Eyeliner Black 6.3g,5.00,unit,5.00,ea
Boutique Illuminating Strobing Powder 9g,5.00,unit,5.56,10g
Boutique Nail Polish Knitwear Greige 10ml,3.00,unit,3.00,ea
L'Oreal Paris Preference Permanent Hair Dye Oslo Viking light Ash Blonde 9.1,8.00,unit,8.00,ea
Clairol Natural Instincts Semi-Permanent Hair Dye Dark Red 4RR,5.50,unit,5.50,ea
Boutique Metallic Eye Cream Copper Rose 10ml,4.00,unit,4.00,ea
Boutique Colour Correction Palette 7.2g,5.00,unit,2.78,10g
Natura Siberica Moisturizing Cleansing Milk Dry and Sensitive Skin 200ml,4.50,unit,2.25,100ml
L'Oreal Paris Color Riche Lipstick 646 Eva,8.00,unit,8.00,ea
Rimmel London Lasting Finish 1000 Kisses Stay on Lip Colouring Pencil 047 Cappuccino 1.2g,4.00,unit,4.00,ea
King of Shaves Refill Advanced Shave Oil 25ml,3.00,unit,12.00,100ml
Boutique Nail Polish Pale Pink,3.00,unit,3.00,ea
Weleda Almond Soothing Facial Oil 50ml,17.95,unit,35.90,100ml
Maybelline Brow Satin Dark Blond,5.00,unit,5.00,ea
Collection Eyes Uncovered Shadow Palette Bare Rose 8.8g,4.00,unit,4.00,ea
"A'kin Certified Rosehip Oil, Organic 20ml",18.00,unit,90.00,100ml
Cutex Spot-On Jelly Nail Polish Remover 109ml,4.00,unit,4.00,ea
Hyke Ceramic Mug Set,5.00,unit,5.00,ea
Dirty Works Cooling Gel Scrub 400ml,3.50,unit,87p,100ml
Habitat Soap Collection 6x80g,10.00,unit,2.08,100g
Rimmel Ultimate Kohl Kajal Eyeliner Black 2.3g,4.00,unit,4.00,ea
Tweezerman Slant Tweezer Pretty In Pink,22.00,unit,22.00,ea
Max Factor Brow Revival 002 Soft Brown 4.5ml,8.00,unit,8.00,ea
Urban Veda Rose + Botanics Reviving Body Lotion 250ml,13.00,unit,5.20,100ml
Barry M Molten Metal Nail Paint - Black Diamond,3.00,unit,3.00,10ml
Gillette Gift Set Fusion Razor & Travel Cap & Shaving Gel 75ml,7.50,unit,7.50,ea
Yes To Tomatoes Clear Skin Detoxifying Charcoal Peel-Off Mask 10ml,2.75,unit,2.75,100ml
L'Oreal Paris True Match Foundation 8.N Cappuccino 30ml,10.00,unit,10.00,ea
Jasper Conran Gift Woman,18.00,unit,60.00,100ml
Collection Glam Crystals Glitter Eyeshadow Palette 6g,4.00,unit,6.66,10g
Collection Bronze Glow Mosaic Powder 2 Radiant 15g,3.00,unit,20.00,100g
Rimmel London 60 Seconds Super Shine 320 Rapid Ruby 8ml,3.50,unit,3.50,ea
Barry M Classic Nail Paint - Masquerade,2.00,unit,2.00,ea
Elegant Touch Professional Nail Clipper,9.00,unit,9.00,ea
Rimmel London Lasting Finish 1000 Kisses Lip Liner 011 Spice 1.2g,4.00,unit,4.00,ea
Collection Extreme 24 Hour Felt Tip Liner 5 Brown,3.00,unit,200.00,100ml
Eylure Volume No 101 3 Pairs Multi Pack,15.00,unit,15.00,ea
Rimmel London Lasting Matte Concealer 005 Porcelain 7ml,6.50,unit,92.86,100ml
Collection Lengthening Waterproof Mascara Ultra Black 17 8ml,4.00,unit,4.00,ea
Maybelline The Nudes Eyeshadow 9.6g,12.00,unit,1.64,10g
Sally Hansen Nail Rehab,10.00,unit,10.00,ea
Boutique Matte Setting Spray 100ml,5.00,unit,50p,10ml
Happy Naturals Nourishing Argan Oil & Shea Bath Regime,7.00,unit,7.00,ea
Elegant Touch Professional 2 Nail Files,8.00,unit,8.00,ea
Maybelline Superstay Matte Ink Crayon Lipstick 15 Lead The Way,10.00,unit,7.14,10g
Hask Monoi Coconut Oil Nourishing Deep Conditioner 50ml,2.00,unit,4.00,100g
Barry M Thats How I Roll Waterproof Mascara 7ml,5.00,unit,7.14,10ml
Grace Cole Sleeping Beauty,10.00,unit,10.00,ea
Elegant Touch Professional Toe Nail Clipper,10.50,unit,10.50,ea
Rimmel London Moisture Renew Lipstick 360 As You Want Victoria 4g,7.00,unit,17.50,10g
Rimmel London Brow This Way Brow Sculpting Kit 003 Dark Brown,5.00,unit,5.00,ea
L'Oreal Paris Men Expert Barber's Essentials Beard Grooming Duo Gift Set,18.00,unit,18.00,ea
Baylis & Harding The Fuzzy Duck Winter Wonderland Luxury Bag Set,15.00,unit,15.00,ea
EcoTools Enhancing Eye Set,6.00,unit,3.00,ea
Collection Fast Stroke Defining Lash Mascara 1 Black 9ml,3.00,unit,3.33,10ml
QVS Essential Grooming Kit,7.00,unit,7.00,ea
Rimmel Maxi Blush Exposed 9g,4.50,unit,4.50,ea
Barry M Molten Nail Paint - Antique Gold 10ml,3.00,unit,3.00,10ml
Boutique Contouring Palette Dark 18g,5.00,unit,2.78,10g
Maybelline Fit Me! Matte & Poreless Powder 350 Caramel 9g,6.00,unit,6.00,ea
Beautopia Flawless Finish Duo,7.00,unit,7.00,ea
Rimmel London Oh My Gloss! Lip Gloss 160 Stay My Rose 6.5ml,4.50,unit,4.50,ea
L'Oreal Paris Life's a Peach Blush Powder,9.00,unit,9.00,ea
Boutique Metallic Eye Cream Champagne 10ml,4.00,unit,4.00,ea
Barry M Bold Waterproof Eyeliner Blk,4.00,unit,4.00,ea
Babyliss 2540U Titanium Pearlescent Straightener,25.00,unit,25.00,ea
Dr.pawpaw Scrub & Nourish,9.00,unit,56.25,100g
Biore Rose Quartz & Charcoal Daily Purifying Face Wash Cleanser for Oily Skin 200ml,5.00,unit,2.50,100ml
Noughty Tough Cookie Strengthening Shampoo 250ml,7.00,unit,2.80,100ml
Maybelline Dream Urban Cover All-In-One Protective Makeup 116 Sesame,7.00,unit,7.00,ea
L'Oreal Paris True Match Foundation 3.N Creamy Beige 30ml,10.00,unit,33.33,100ml
A'kin Colour Protect Conditioner 225ml,12.00,unit,5.33,100ml
Yes To Tomatoes Clear Skin Detoxifying Charcoal 2-in-1 Scrub & Cleanser Stick 70g,6.75,unit,9.25,100g
Maybelline Tattoo Brow Waterproof Gel 06 Deep Brown,9.00,unit,9.00,ea
Boutique Malbec Gel Nail Polish,4.00,unit,4.00,ea
Rimmel London Rita Ora 404  Ora-Ngy Vibe 8ml,3.50,unit,3.50,ea
A'kin Mild & Gentle Shampoo 225ml,12.00,unit,5.33,100ml
Schwarzkopf Live Urban Metallics Permanent Dusty Silver U72,4.80,unit,4.80,ea
Elvive Color Protect Purple Mask 250ml,5.00,unit,2.00,100ml
Eylure Lash Pro Individuals Fine to Full,5.15,unit,5.15,ea
L'Oreal Men Expert Barber Club Natural Look Hair Styling Cream 100ml,4.00,unit,4.00,100ml
Boutique Long Lasting Colour Correction Concealer Salmon 5ml,5.00,unit,10.00,10ml
Collection Fast Stroke Eyeliner Brown 6,3.00,unit,78.95,100ml
Max Factor Miracle Glow Duo Pro Illuminator 20 Medium 11g,11.00,unit,10.00,10g
L'Oreal Paris True Match Foundation 3.C Rose Beige 30ml,10.00,unit,33.33,100ml
Rimmel Stay Satin Liquid Lip Obsession 5.5ml,5.00,unit,5.00,ea
Barry M Thats Swell Lip Plumper 2.5ml,5.00,unit,20.00,10ml
Rimmel Stay Satin Liquid Lip Shoulder Pads 5.5ml,5.00,unit,5.00,ea
Elegant Touch Polish Petrol 24 Pack Nails 10 Sizes,7.50,unit,7.50,ea
Collection Kohl Eyeliner Precision Colour 02 Brown,2.00,unit,200.00,100g
Maybelline New York Forever Strong Super Stay Gel Nail Color 7 Days 76 French Manicure 10ml,3.50,unit,3.50,ea
Jasper Conran Gift Man,18.00,unit,18.00,ea
L'Oreal Paris Magic Retouch Precision Instant Grey Concealer Brush Blonde,6.00,unit,6.00,ea
Max Factor Colour Elixir Lip Liner 2 Pink Petal,6.00,unit,6.00,ea
Olay Regenerist Regenerating UV Lotion Moisturiser SPF 15 75ml,13.50,unit,18.00,100ml
"Rimmel Wonder Swipe 2-in-1 Liner to Shadow, Cool AF 1.7ml",5.00,unit,5.00,ea
Rimmel London Lasting Radiance Foundation Light Porcelain,7.00,unit,7.00,ea
Barry M On Point Waterproof Eyeliner black,4.50,unit,4.50,ea
Max Factor Crme Puff Blush Alluring Rose,8.00,unit,2.66,10g
Real Techniques by Sam & Nic Eye Shade + Blend,9.00,unit,9.00,ea
Collection Eyebrow Definer Lasting Colour 3 Blonde,2.80,unit,2.80,ea
L'Oreal Paris Color Riche Shine Lipstick 658 Blush My Baby,7.00,unit,140.00,100ml
Bulldog Original Shave Essentials,10.00,unit,10.00,ea
Max Factor Masterpiece Kohl Kajal Pencil 003 Beige,8.00,unit,8.00,ea
Hask Keratin Protein 5-in-1 Leave-In Spray 175ml,5.00,unit,2.86,100ml
Olay Regenerist Luminous Skin Tone Perfecting Cream 50ml,30.00,unit,60.00,100ml
Accessorize Lovelily Eau de Parfum Natural Spray 75ml,14.00,unit,18.67,100ml
Super Facialist Rose Hydrate Mini Collection 4 x 20ml,16.00,unit,16.00,ea
Rimmel London Lasting Finish 25HR with Comfort Serum SPF 20 103 True Ivory 30ml,10.00,unit,20.00,100ml
Noughty Tough Cookie Strengthening Conditioner 250ml,7.00,unit,2.80,100ml
Maybelline Brow Fast Sculpt Eyebrow Gel 04 Medium Brown,7.00,unit,7.00,ea
Yes To Coconut & Coffee Scrub & Cleanser,10.00,unit,10.00,100ml
Maybelline The City Mini Palette 430 Downtown Sunrise,8.00,unit,8.00,ea
Barry M Contour Creams Set,7.00,unit,7.00,ea
Collection Glam Crystals Holographic Lip Topper Boo 2 8ml,3.50,unit,43.75,100ml
Ogx Renewing + Argan Oil of Morocco Extra Penetrating Oil 100ml,6.00,unit,6.00,100ml
Elegant Touch Professional Combi Tweezer,13.00,unit,13.00,ea
Weleda Skin Food Moisturiser 30ml,7.95,unit,26.50,100ml
Real Techniques Base Powder Brush,11.00,unit,11.00,ea
Collection Bronze Glow Matt Powder 1 Terracotta 15g,3.00,unit,20.00,100g
Barry M Under the Sea Nail Paint - Pinktail,3.00,unit,3.00,10ml
Natura Siberica Rhodiola Rosea Day Cream 50ml,6.50,unit,13.00,100ml
QVS 2 Cushioned Nail Shapers,3.00,unit,3.00,ea
My Hair Matters Anti-Frizz Dry Shampoo 200ml,2.00,unit,1.00,100ml
Eylure Luxe Lash Solitaire 1ml,10.00,unit,10.00,ea
Scuderia Ferrari Black Eau de Toilette Natural Spray 125ml,20.00,unit,16.00,100ml
Happy Jackson London Face Legend Beard Care Kit,6.50,unit,6.50,ea
Natura Siberica Cleansing Foaming Mousse 170ml,4.50,unit,2.64,100ml
Collection Bronze Glow Mosaic Powder 1 Sunkissed 15g,3.00,unit,20.00,100g
Maybelline Dream Satin Liquid Foundation SPF 13 1 Natural Ivory 30ml,7.00,unit,2.33,10ml
Maybelline Tattoo Brow Micro Pen Tint Medium Brown,10.00,unit,10.00,ea
Urban Veda Turmeric + Botanics Radiance Day Cream 50ml,19.00,unit,38.00,100ml
Technic Wow Factor Remastered Face Palette,4.00,unit,4.00,ea
Bondi Sands Self Tanning Foam Dark 100ml,10.00,unit,6.67,100ml
Yes To Grapefruit Vit C Mud Mask,2.00,unit,2.00,ea
Rimmel London Wonder'full 24 Hour Brow Mascara Dark,8.00,unit,8.00,ea
Gillette Mach3 Turbo 3D Razor Handle +3 Blade Refills Special Starter Pack,16.00,unit,16.00,ea
Rimmel London Rita Ora 324 Fashion Heaven Nail Polish 8ml,3.50,unit,3.50,ea
Barry M Lash Vegas 2 Black Mascara 7ml,5.00,unit,7.14,10ml
Maybelline Color Tattoo 40 Permanent Taupe 24h,6.00,unit,6.00,ea
Maxfactor Liquid Eyeliner Chocolate 6ml,9.00,unit,15.00,10ml
Paul Smith Rose Eau De Parfum 100ml,30.00,unit,30.00,100ml
Collection Pressed Powder 18 Ivory 15g,2.00,unit,11.11,100g
Maybelline Brow Ultra Slim Defining Natural Fuller Looking Brows Eyebrow Pencil 06 Black Brown,8.00,unit,8.00,ea
Maybelline Color Sensational Creamy Matte Lipstick 988 Brown Sugar,5.00,unit,5.00,ea
Garnier Nutrisse Cool Browns Permanent Hair Dye Glacial Brown 5.12,6.00,unit,6.00,ea
Collection Powered by Witch Anti-Fatigue Illuminating Primer 2 25ml,5.00,unit,2.00,10ml
L'Oreal Paris Infallible 24hr Freshwear Liquid Foundation 15 Porcelain,11.00,unit,10.28,100g
"Rimmel Wonder Swipe 2-in-1 Liner to Shadow, 002 Instafamous 1.7ml",5.00,unit,5.00,ea
Real Techniques Miracle Complexion Sponges & Case Gift Set x5,20.00,unit,20.00,ea
Maybelline Brow Ultra Slim Defining Natural Fuller Looking Brows Eyebrow Pencil 02 Soft Brown,8.00,unit,8.00,ea
Gillette Venus Vera Bradley Extra Smooth Razor Blade Refills x4,14.50,unit,3.63,bld
Humble Rose & Frankincense Bath Salts 500g,8.00,unit,8.00,ea
L'Oreal Paris Infallible More Than Concealer 327 Cashmere,10.00,unit,10.00,ea
Ameliorate Transforming Body Lotion Fragrance Free 200ml,22.50,unit,11.25,100ml
L'Oreal Paris True Match The One Concealer 2N Vanilla,6.00,unit,6.00,ea
Baylis & Harding Fuzzy Duck Hamper,20.00,unit,20.00,ea
Maybelline Color Sensational Shaping Lip Liner 90 Brick Red,4.00,unit,4.00,ea
L'Oreal Men Expert 5-Min Mask Multi-Pack with Re-Energising Taurine Gift Set,10.00,unit,10.00,ea
Maybelline Fit Me Matte & Poreless Powder 250 Sun Beige 30ml,6.00,unit,6.00,ea
Beautopia Beauty Bag,9.00,unit,9.00,ea
L'Oreal Paris Casting Creme Gloss Natural Permanent Hair Dye Cool Dark Brown 3102,6.00,unit,6.00,ea
Barry M Brow Wow Pencil Medium/Dark,4.00,unit,4.00,ea
Sensationail Gel Polish Removal Kit,9.00,unit,9.00,ea
Rimmel Stay Satin Liquid Lip Redical 5.5ml,5.00,unit,5.00,ea
Ogx Renewing + Argan Oil of Morocco Penetrating Oil 100ml,6.00,unit,6.00,100ml
Ardell Wispies Cluster 601 Black,5.50,unit,5.50,ea
Byre Skimmed Bodywash 250ml,5.00,unit,2.00,100ml
Collection Speedy Highlighter 01 Pearl Sheen 5g,4.00,unit,80.00,100g
L'Oreal Paris Casting Creme Gloss Natural Permanent Hair Dye Cool Mocha Brown 5102,6.00,unit,6.00,ea
Barry M Kohl Pencil Black,3.00,unit,3.00,ea
Barry M Gelly Nail Paint - Acai Smoothie 10ml,3.00,unit,3.00,10ml
"Max Factor Radiant Lift Foundation, Natural",15.00,unit,50.00,100ml
Maybelline Nude Or Never Gift Set,9.00,unit,9.00,ea
Boutique Convertible Eye & Cheek Jelly Cinnamon,4.00,unit,4.00,ea
Eylure Luxe Lash Cameo 1ml,10.00,unit,10.00,ea
BeautyPro Thermotherapy Warming Silver Foil Mask with Vitamin C & Green Tea 25ml,6.00,unit,6.00,ea
Acnecide Face Wash 5% w/w Gel 50g,10.00,unit,10.00,ea
Elegant Touch Professional Nail Scissors,13.00,unit,13.00,ea
Max Factor Lipfinity Bullet Always Chic,6.00,unit,3.31,10g
Nivea Naturally Good Micellar Water 400ml,6.00,unit,1.50,100ml
L'Oreal Paris True Match Foundation 2.N Vanilla 30ml,7.00,unit,23.33,100ml
Max Factor Lipfinity Evermore Sublime 20,6.00,unit,3.31,10g
Collection Volumising Mascara Ultra Black 17 8ml,4.00,unit,4.00,ea
Bulldog Skincare Energising Sheet Mask 100ml,6.00,unit,6.00,ea
Rimmel London Lasting Matte Foundation Fair Porcelain 30ml,8.00,unit,26.67,100ml
Collection Incredibrow Tinted Brow Mascara Brunette 2 8ml,3.50,unit,3.50,ea
Harry's Starter Shave Set with Shave Gel-Race Car Red,10.00,unit,10.00,ea
Barry M Gloss Me Up Lipgloss Sugar,5.00,unit,5.00,ea
Natura Siberica Enriched Cleansing Tonic Anti-Age Siberian Ginseng & Meadowsweet 200ml,5.00,unit,2.50,100ml
Hask Monoi Coconut Nourishing Shine Hair Oil 59ml,4.00,unit,4.00,ea
Maybelline Brow Satin Natural Looking Eyebrow Pencil Pen + Filling Powder Duo Dark Brown,5.00,unit,5.00,ea
Yes To Tomatoes Charcoal Mud Mask 10ml,2.00,unit,20.00,100ml
L'Oreal Paris Infallible 2 step Lipstick 113 Invincible,10.00,unit,10.00,ea
Maybelline Superstay Matte Ink Crayon Lipstick 30 Seek Adventure,10.00,unit,7.14,10g
Collection Gorgeous Glow 1 Blush Block 10g,4.20,unit,42.00,100g
Max Factor Honey Lacquer Honey Lilac,8.00,unit,21.06,10ml
Elegant Touch Professional Cuticle Nipper,13.00,unit,13.00,ea
Maybelline Color Sensational Shaping Lip Liner 50 Dusty Rose,4.00,unit,4.00,ea
Barry M Flawless Primer Original 30ml,7.00,unit,23.33,100ml
Rimmel London Lasting Finish by Kate Lipstick 45 4g,4.50,unit,4.50,ea
Boutique Smooth Matte Lipstick Silk Rose,3.00,unit,8.57,10g
Sanctuary Spa New Mum Pamper Bag,10.00,unit,10.00,ea
Barry M Under the Sea Nail Paint - Electric Eel,3.00,unit,3.00,ea
Botnico Vida Omega Oil with Bioactive Sacha Inchi 125ml,14.00,unit,11.20,100ml
Nip+Fab Vitamin C Fix Sheet Mask 25ml,7.50,unit,30.00,100ml
Heathcote & Ivory Bath Salts 300g,5.00,unit,1.66,100g
Collection Gorgeous Glow Holographic Highlighter Aurora 2 5g,4.00,unit,4.00,ea
UpCircle Face Scrub Herbal Blend 100ml,13.00,unit,13.00,100ml
"Max Factor Colour Elixir Lip Cushion, 015 Nude Glory, 9ml",10.00,unit,10.00,ea
Clairol Natural Instincts Semi-Permanent Hair Dye Burgundy Black 2RV,5.50,unit,5.50,ea
L'Oreal Paris Preference Permanent Hair Dye Budapest Intense Dark Red P37,6.00,unit,6.00,ea
Rimmel London Sculpting and Highlighting Kit 002 Coral Glow 18.5g,5.00,unit,5.00,ea
Maybelline Lip Liner 630 Velvet Beige,4.00,unit,4.00,ea
Boutique Dusky Rose Gel Nail Polish,4.00,unit,4.00,ea
Collection Kohl Eyeliner Precision Colour 93 White,2.00,unit,200.00,100g
Maybelline Master Prime Primer 30 Green,9.00,unit,9.00,ea
Barry M Gloss Me Up Lipgloss Peekaboo,5.00,unit,5.00,ea
Weleda One-Step Cleanser & Toner 100ml,14.50,unit,14.50,100ml
Elegant Touch Statement French Stiletto Pink 24 Pack Nails 10 Sizes,7.50,unit,7.50,ea
Boutique Moisturising Concealer Wheat,3.00,unit,6.00,10ml
Heathcote & Ivory In The Garden Muscle Soak Bath Salts 200g,5.00,unit,2.50,100g
Boutique Metallic Eye Cream Frosted Peach 10ml,4.00,unit,4.00,ea
L'Oreal Men Expert Barber Club Exfoliating Beard & Face Scrub 100ml,6.00,unit,6.00,100ml
Maybelline Color Tattoo 24HR by Eyestudio Creamy Mattes Gel-Cream Eyeshadow 93 Crme de Nude,6.00,unit,6.00,ea
Collection Volumising Waterproof Mascara Ultra Black 17 8ml,4.00,unit,4.00,ea
Max Factor Brow Revival 005 Black Brown 4.5ml,8.00,unit,8.00,ea
L'Oreal Super Liner GelMatic Ultra Black,5.00,unit,5.00,ea
"Collection Primed & Ready, Powered by Witch Mattifying Pore Minimiser 25ml",5.00,unit,4.00,100ml
Ogx Nourishing+ Coconut Milk Anti-Breakage Serum 100ml,6.00,unit,6.00,100ml
Real Techniques Deep Cleansing Gel 150ml,7.00,unit,7.00,ea
L'Oreal Paris Infallible 24hr Freshwear Liquid Foundation 20 Ivory,11.00,unit,10.28,100g
Boutique Waterproof Brow Pomade Light,4.00,unit,8.00,10g
Maybelline Tattoo Brow Micro Pen Tint Dark Brown,10.00,unit,10.00,ea
Maybelline The City Mini Palette 400 Rooftop Bronzes,8.00,unit,8.00,ea
L'Oreal Paris Unbelieva'brow Long-Lasting Brow Gel 105 Brunette,15.00,unit,15.00,ea
Vintage & Co Vintage Patterns & Petal Top to Toe Kit,12.00,unit,12.00,ea
Rimmel London Lasting Finish 25HR with Comfort Serum SPF 20 303 True Nude 30ml,10.00,unit,33.33,100ml
Philips S1231 Rotary Shaver,40.00,unit,40.00,ea
Barry M Nail Paint - Peel It!,2.00,unit,2.00,ea
L'Oreal Paris Infallible More Than Concealer 326 Vanilla,10.00,unit,10.00,ea
Rimmel London Wonder'full 24 Hour Brow Mascara 001 Light 4.5ml,8.00,unit,66.67,100ml
Garnier Nutrisse Cool Browns Permanent Hair Dye Frozen Brown 3.12,6.00,unit,6.00,ea
Collection Eyebrow Kit Brunette,3.50,unit,70.00,100g
Collection Lengthening Mascara Ultra Black 17 8ml,4.00,unit,4.00,ea
Hugo Boss Christmas Gift Set 50ml,49.00,unit,49.00,ea
Gillette Venus Vera Bradley Extra Smooth Razor Blade Refills x6,21.50,unit,3.58,bld
Just Cavalli Eau de Toilette Natural Spray 30ml,18.00,unit,60.00,100ml
Natura Siberica The Northern Collection Cleansing Micellar Water 200ml,10.00,unit,5.00,100ml
Maybelline Super Stay 24HR Lip Color 265 Always Orchid,10.00,unit,10.00,ea
King C Gillette Mens Double Edge Safety Razor Blades x5,13.50,unit,13.50,ea
Collection Incredibrow Tinted Brow Mascara Blonde 1 8ml,3.50,unit,3.50,ea
Boutique Serum Foundation Amber 30ml,5.00,unit,1.67,10ml
Herbal Essences Hair Oil Blend Argan & Aloe 100ml,3.00,unit,3.00,100ml
L'Oreal Paris Color Riche Matte Addiction Lipstick 430 Mon Jules,6.00,unit,6.00,ea
Tweezerman Slant Tweezer Classic,22.00,unit,22.00,ea
Maybelline Color Sensational Shaping Lip Liner 10 Nude Whisper,4.00,unit,4.00,ea
Max Factor Colour Elixir Lip Liner Red Poppy 10,6.00,unit,6.00,ea
L'Oreal Paris Revitalift Filler Replumping Ampoules 7 x 1.3ml,15.00,unit,44.12,100g
L'Oreal Paris Brow Artist Xpert 108 Warm Brunette,6.00,unit,6.00,ea
A'kin Calming Body Cream 200ml,14.50,unit,7.25,100ml
Pinky Goat Amani Lashes,10.00,unit,10.00,ea
Collection Gorgeous Glow Holographic Highlighter Moondust 1 5g,4.00,unit,4.00,ea
Maybelline Superstay Matte Ink 75 Fighter 5ml,7.00,unit,14.00,10ml
"Max Factor Radiant Lift Foundation, Light Ivory",15.00,unit,50.00,100ml
Real Techniques Flawless Base Set,20.00,unit,20.00,ea
Rimmel London Exaggerate Full Colour Lip Liner 024 Red Diva 0.25g,4.00,unit,4.00,ea
Boutique Nail Polish Summer Violet 10ml,3.00,unit,3.00,ea
L'Oral Paris Super Liner Superstar Eyeliner Black,5.00,unit,5.00,ea
Rimmel London Super Gel Nail Polish Naughty or Nice 12ml,5.00,unit,50.00,10g
Rml Magnfeys Pltte Eye Shdw Woweditn 14g,10.00,unit,100.00,10g
Collection Velvet Kiss Moisturising Lip Cream Hot Cakes 10 5ml,3.00,unit,6.00,10ml
Barry M Lip Scrub Peppermint 25g,5.00,unit,20.00,100g
Natura Siberica Caviar Collagen Night Face Concentrate 30ml,25.00,unit,83.33,100ml
L'Oreal Paris Excellence Ultra Light Permanent Hair Dye Golden Blonde 02,7.00,unit,7.00,ea
Barry M Bold Waterproof Eyeliner Brown,4.00,unit,4.00,ea
Super Facialist Vitamin C+ Brighten Booster 15ml,13.50,unit,67.50,100ml
L'Oreal Paris Rouge Signature Matte Liquid Lipstick 113 I Don't,10.00,unit,10.00,ea
L'Oreal Paris Color Riche Lipstick 297 Red Passion,8.00,unit,166.67,100ml
Rimmel London Oh My Gloss! 330 Snog 6.5ml,4.50,unit,4.50,ea
L'Oreal Paris Lash Architect Mascara 4D Black,11.00,unit,11.00,ea
Boutique Long Lasting Colour Correction Concealer Purple 5ml,5.00,unit,10.00,10ml
Max Factor Lipfinity Bullet So Vivid 45,6.00,unit,3.31,10g
Just Cavalli Eau de Toilette Natural Spray 30ml,18.00,unit,60.00,100ml
Maybelline Lasting Drama Gel Eyeliner 02 Brown,9.00,unit,9.00,ea
Bulldog Sensitive Bamboo Razor,8.00,unit,8.00,ea
Barry M Bold Eyeliner Waterproof Rose Gold,4.00,unit,4.00,ea
Heathcote & Ivory Sweet Pea & Honey Suckle Bathing Flowers 85g,10.00,unit,11.76,100g
Barry m Gelly Nail Paint - Cotton 10ml,3.00,unit,3.00,10ml
Barry M Gelly Nail Paint - Blood Orange 10ml,3.00,unit,3.00,10ml
QVS Nail Technician Pedicure Pack,10.00,unit,10.00,ea
Boutique Serum Foundation Golden Brown,5.00,unit,1.67,10ml
Natura Siberica Caviar Collagen Day Care Face Cream 30ml,23.50,unit,78.33,100ml
Rimmel London Exaggerate Full Colour Lip Liner 064 Obsession 0.25g,4.00,unit,160.00,10g
L'Oreal Paris Superliner Le Khol Eyeliner 111 Urban Grey,4.00,unit,4.00,ea
Urban Veda Sandalwood + Botanics Soothing Day Cream 50ml,19.00,unit,38.00,100ml
Grace Cole Big Top,10.00,unit,10.00,ea
Natura Siberica Snow Cladonia Night Cream 50ml,7.00,unit,14.00,100ml
Boutique Latte Gel Nail Polish,4.00,unit,4.00,ea
Natura Siberica Rhodiola Rosea Face Serum 30ml,9.00,unit,30.00,100ml
Real Techniques Enhanced Eye Set,20.00,unit,20.00,ea
Barry M Under The Sea Jellyfish Nail Paint 10ml,3.00,unit,30.00,100ml
Garnier Fresh-Mix Smoothing Face Sheet Mask Fruit AHA for Fine Lines & Dull Skin 33g,3.00,unit,3.00,ea
Tangle Teezer The Original Mini Detangling Hairbrush Dino Mightly,9.00,unit,9.00,ea
Max Factor Pan Stik Foundation 56 Medium 9g,8.00,unit,8.89,10g
Yes To Coconut 2-Step Lip Kit Pucker Up!,5.00,unit,5.00,ea
L'Oreal Paris Rouge Signature Matte Liquid Lipstick 110 I Empower,10.00,unit,10.00,ea
Pinky Goat Noura Lashes,10.00,unit,10.00,ea
Magnif'Eyes Eye Shadow 12 Palette - Spiced Edition,10.00,unit,10.00,ea
A'kin Calming Hand Cream 75ml,12.00,unit,16.00,100ml
Barry M Matte Topcoat 10ml,2.00,unit,2.00,10ml
Collection Eyebrow Kit Blonde,3.50,unit,70.00,100g
Maybelline Master Prime Primer 10 Clear,9.00,unit,9.00,ea
Barry M Molten Nail Paint - Crystal Blue,3.00,unit,3.00,10ml
Elegant Touch London Core Holographic Silver 24 Nails 12 Sizes,10.00,unit,10.00,ea
Weleda Wild Rose Smoothing Night Cream 30ml,21.00,unit,70.00,100ml
Davidoff Hot Water Eau de Toilette Natural Spray 60ml,18.00,unit,30.00,100ml
Rimmel London Kate 08 Lasting Finish Lipstick 4g,4.50,unit,4.50,ea
Rimmel London Lasting Matte Concealer 015 True Ivory 7ml,6.50,unit,92.86,100ml
Natura Rose Infused Sheet Mask 22ml,5.00,unit,5.00,ea
Max Factor Honey Lacquer Floral Ruby,8.00,unit,21.06,10ml
