Description,Price/Unit,Unit,Price/Measure,MeasureRimmel Hide the Blemish Concealer 001 Ivory 4.5g,5.00,unit,5.00,ea
My Skin Matters Anti-Age Hand Cream Q10 75ml,1.50,unit,2.00,100ml
John Frieda Frizz Ease Miraculous Recovery Sachet 25ml,2.00,unit,8.00,100ml
Boutique Professional Nail Files x2,1.50,unit,1.50,ea
Imperial Leather Foamburst Pampering 200ml,2.00,unit,1.00,100ml
Gillette Venus Snap Embrace Razor,5.00,unit,5.00,ea
My Skin Matters Intensive Body Lotion 400ml,2.00,unit,50p,100ml
John Frieda Frizz Ease Daily Miracle Treatment 200ml,4.00,unit,2.00,100ml
Burt's Bees Beeswax Lip Balm Tube 4.25g,3.50,unit,8.23,10g
L'Oreal Men Expert All-In-One Sensitive Face Cream 75ml,2.50,unit,3.34,100ml
Veet Underarm Wax Strips x16,7.00,unit,44p,ea
Simple Gentle Care Conditioner 400ml,3.00,unit,75p,100ml
Clairol Root Touch Up Hair Dye Black 2,6.50,unit,6.50,ea
Love Beauty And Planet Tropical Hydration Shower Gel,5.00,unit,1.00,100ml
Sainsbury's Make Up Sponge x4,1.50,unit,38p,ea
My Skin Matters On-The-Go Hand Cream 30ml,1.00,unit,3.33,100ml
Head & Shoulders Anti-Dandruff Supreme Moisture Conditioner For Dry Hair 275ml,3.50,unit,1.28,100ml
Beco Foaming Hand Wash Honey Blossom 250ml,3.50,unit,1.40,100ml
Palmolive Naturals Coconut Shower Gel 500ml,1.50,unit,30p,100ml
Pantene Pro-V Colour Protect Conditioner For Coloured Hair 500ml,3.50,unit,70p,100ml
"Sainsbury's Thick Pony Bands, Black x12",1.50,unit,13p,ea
Gillette Venus Comfortglide Spa Breeze Women's Razor,7.00,unit,7.00,ea
"Nice 'n Easy Root Touch Up Hair Dye, Light Golden Brown 6.3",6.50,unit,6.50,ea
Phil Smith Be Gorgeous Wow! Brunette Colour Revive Dry Shampoo 150ml,2.50,unit,1.67,100ml
Lynx Ice Chill Bodyspray 150ml,3.00,unit,2.00,100ml
Wilkinson Sword Quattro For Women Razor,4.00,unit,4.00,ea
Sainsbury's Fresh Faced Detoxifying Facial Scrub 150ml,1.75,unit,1.17,100ml
Rimmel Professional Eyebrow Pencil 001 Dark Brown 1.4g,5.00,unit,5.00,ea
Sainsbury's Finger Nail Clipper,1.50,unit,1.50,ea
L'Oreal Paris Wrinkle Decrease Night Cream 50ml,11.50,unit,23.00,100ml
Vaseline Petroleum Jelly Original 100ml,2.00,unit,2.00,100ml
My Skin Matters Clarifying Facial Wash 150ml,1.50,unit,1.00,100ml
Phil Smith Be Gorgeous Cocolicious Heat Defence Mist 75ml,3.50,unit,4.67,100ml
"Baylis & Harding Elements Oud, Wood & Bergamot Luxury Hand Wash 500ml",3.00,unit,60p,100ml
Aussie Aussome Volume Conditioner 400ml,5.50,unit,1.38,100ml
Olay Complete Care Moisturiser Night Cream 50ml,9.00,unit,18.00,100ml
Garnier Nutrisse Ultra Permanent Hair Dye Iced Coffee Brown 4.15,6.00,unit,6.00,ea
Bulldog Sensitive Aftershave Balm 100ml,3.00,unit,3.00,100ml
Radox Handwash Protect & Replenish 500ml,1.50,unit,30p,100ml
Happy Naturals Everyday Moisture Shampoo Macadamia & Hemp 300ml,2.50,unit,83p,100ml
Rimmel Extra Super Lash Mascara 102 Brown Black 8ml,5.50,unit,5.50,ea
L'Oreal Elnett Precious Argan Oil Hairspray 75ml,2.00,unit,2.66,100ml
Pantene Dry Argan Oil Smooth & Sleek 100ml,7.00,unit,7.00,100ml
Simple Water Boost Micellar Facial Gel Wash 148ml,2.50,unit,1.69,100ml
Lynx Gold Deodorant & Bodyspray Oud Wood & Dark Vanilla 250ml,4.00,unit,1.60,100ml
Phil Smith Be Gorgeous Curly Locks Perfecting Spray 200ml,4.00,unit,2.00,100ml
John Frieda Frizz Ease Heat Defeat Spray 150ml,4.00,unit,2.67,100ml
Simple Cleansing Facial Wipes 2x20pc Bio,3.00,unit,8p,ea
L'Oreal Paris Extraordinary Oil Mask Pot 300ml,3.00,unit,1.00,100ml
Garnier Nutrisse Permanent Hair Dye Deep Reddish Brown 3.6,6.00,unit,6.00,ea
Wilkinson Sword Soap Bowl 125g,2.50,unit,2.00,100g
Pantene 3 Minute Miracle Smooth & Sleek For Frizzy & Dull Hair 200ml,2.50,unit,1.25,100ml
Sainsbury's Accessories Assorted Hair Bands x20,2.00,unit,2.00,ea
Clairol Root Touch Up Hair Dye Medium Blonde 8,6.50,unit,6.50,ea
Garnier Olia Permanent No Ammonia Hair Dye Iced Chocolate Brown 4.15,6.00,unit,6.00,ea
VO5 Extreme Style Matt Fibre 75ml,3.00,unit,4.00,100ml
Olay Total Effects Touch of Sunshine Moisturiser Day Cream 50ml,15.00,unit,30.00,100ml
Gillette Fusion Proglide Flexball Razor,8.00,unit,8.00,ea
Sainsbury's Metal Nail File,1.50,unit,1.50,ea
Head & Shoulders Anti-Dandruff Supreme Smooth Conditioner For Dry Hair 275ml,3.50,unit,1.28,100ml
Head & Shoulders Clinical Solution Scalp Relief Shampoo 130ml,3.50,unit,2.70,100ml
Lynx Excite Body Spray Deodorant 250ml,4.00,unit,1.60,100ml
Garnier Ultimate Blends Argan Oil & Almond Cream Dry Hair Shampoo 360ml,2.00,unit,56p,100ml
Beco Triple Milled Organic Soap Spring Meadows 100g,2.50,unit,2.50,100g
Ogx Brazilian Keratin Smooth Shampoo 385ml,3.50,unit,91p,100ml
Nivea Men Post Shave Balm Protect & Care 100ml,3.00,unit,3.00,100ml
Nivea Men Sensitive Cooling Post Shave Balm with 0% Alcohol 100ml,3.00,unit,3.00,100ml
My Hair Matters Colour Shampoo 400ml,1.50,unit,38p,100ml
My Hair Matters Colour Conditioner 400ml,1.50,unit,38p,100ml
Simple Biodegradable Cleansing Face Wipes x20,2.00,unit,10p,ea
Nivea Q10 + Vitamin C Firming Body Lotion for Dry Skin 400ml,4.65,unit,1.16,100ml
Wet Ones Be Gentle Antibacterial Hand Wipes x12,1.00,unit,8.33,100sht
Sainsbury's Small Hair Brush,1.00,unit,1.00,ea
Schwarzkopf got2b Glued Screaming Hold Wax 150ml,3.30,unit,2.20,100ml
L'Oreal Paris Casting Creme Gloss Semi Permanent Hair Dye Darkest Brown 300,6.00,unit,6.00,ea
Bayley's Of Bond Street Orange Handwash 500ml,1.50,unit,30p,100ml
Maybelline SuperStay 7 Days Gel Nail Polish 25 Crystal Clear,3.50,unit,3.50,10ml
Imperial Leather Foamburst Moisture Coconut 200ml,5.00,unit,2.50,100ml
L'Oreal Elnett Crme de Mousse Volume Strong Hold 200ml,6.00,unit,3.00,100ml
Sainsbury's Slanted Tweezers,1.50,unit,1.50,ea
Olay Total Effects Fragrance Free Moisturiser Day Cream 50ml,15.00,unit,30.00,100ml
Sainsbury's Limited Edition Spiced Apple & Fig Handwash 250ml,1.30,unit,43p,100ml
Clairol Nice'n Easy Non Permanent Hair Dye No Ammonia Light Ash Brown 75,5.50,unit,5.50,ea
Sanex Men Sensitive Skin Body & Face Shower Gel 500ml,2.00,unit,40p,100ml
Maybelline Master Shape Brow Pencil Soft Brown,3.00,unit,3.00,ea
VO5 Extreme Style Surf Style Texturising Paste 150ml,3.00,unit,2.00,100ml
"Nice 'n Easy Root Touch Up Hair Dye, Light Blonde 9",6.50,unit,6.50,ea
Batiste Instant Hair Refresh Dry Shampoo Plus with a Hint of Colour Divine Dark 400ml,5.00,unit,1.25,100ml
Ogx Hydrate + Defrizz Kukui Oil Conditioner 385ml,3.50,unit,91p,100ml
Brut Splash On Lotion 200ml,4.00,unit,2.00,100ml
Bulldog Skincare Lemon & Bergamot Shower Gel 500ml,3.00,unit,60p,100ml
Veet Warm Wax With Pure Essential Oils 250ml,9.00,unit,3.60,100ml
"Sainsbury's Collection Luxury Soap, Bergamot & Nectarine 200g",2.00,unit,1.00,100g
Schwarzkopf Live Intense Colour Permanent Hair Dye Deep Black 099,4.80,unit,4.80,ea
L'Oreal Men Expert Stress Resist Shower Gel 300ml,1.50,unit,50p,100ml
Bayley's Of Bond Street Rose And Raspberry Luxurious Hand Wash 500ml,1.50,unit,30p,100ml
Gillette Blue3 Disposable Men's Razor x4,2.00,unit,50p,bld
Excellence Creme 6.3 Light Golden Brown Hair Dye,7.00,unit,7.00,ea
7th Heaven Charcoal Peel-Off 10ml,1.00,unit,10.00,100ml
Old Spice Aftershave Lotion 150ml,8.00,unit,5.33,100ml
Sainsbury's Double Blade Replacements x10,2.00,unit,20p,bld
Neutrogena Clear & Defend Moisturiser 50ml,5.00,unit,10.00,100ml
L'Oreal Men Expert Hydra Energetic Anti-Fatigue Face Wash 100ml,2.50,unit,2.50,100ml
Garnier Natural Rose Water Toner Sensitive Skin 200ml,2.50,unit,1.25,100ml
Olay Daily Facials 5-in1 Dry Cloths - Sensitive Skin,6.50,unit,22p,wipe
Palmer's Coconut Oil Formula Coconut Oil Lip Balm SPF 15 4g,1.75,unit,1.75,ea
Olay Anti-Wrinkle Moisturiser Day Lotion 100ml,6.00,unit,6.00,100ml
"Dax Short & Neat Hair Wax for Short Hair, Blue 99g",3.00,unit,3.03,100g
Dettol Liquid Hand Wash Antibacterial Care Grapefruit 250ml,1.50,unit,60p,100ml
Sainsbury's Mini Emery Boards x3,1.00,unit,33p,ea
Sanex Dermo Naturals Shower Cream 450ml,2.00,unit,44p,100ml
Rimmel Exaggerate Waterproof Eye Definer 261 Noir 0.28g,4.50,unit,4.50,ea
Garnier Nutrisse Permanent Hair Dye Golden Brown 5.3,6.00,unit,6.00,ea
Phil Smith Big It Up! Volume Boosting Spray 200ml,4.00,unit,2.00,100ml
Sanex Dermo Sensitive Skin Hypoallergenic Bar Soap 2x90g,1.00,unit,56p,100g
L'Oreal Elvive Extraordinary Oil Coloured Hair 100ml,10.00,unit,10.00,100ml
"Pantene Pro-V Repair & Protect Shampoo 270ML, For Damaged Hair",1.50,unit,56p,100ml
Dirty Works Bath Bomb Trio,3.50,unit,1.17,ea
Happy Naturals Everyday Moisture Conditioner Macadamia & Hemp 300ml,2.50,unit,83p,100ml
Simple Micellar Water 400ml,5.50,unit,1.38,100ml
Love Beauty And Planet Volume & Bounty Shampoo,6.00,unit,1.50,100ml
L'Oreal Paris Casting Creme Gloss Semi Permanent Hair Dye Dark Brown 400,6.00,unit,6.00,ea
Happy Naturals Revitalising Body Wash Sea Minerals & Ginger Root 250ml,2.75,unit,1.10,100ml
Phil Smith Be Gorgeous Mirror Shine Spray 75ml,2.50,unit,3.33,100ml
Garnier Belle Color Natural Permanent Hair Dye Brown 5,3.50,unit,3.50,ea
L'Oreal Men Expert Pure Charcoal Purifying Daily Face Wash 100ml,2.50,unit,2.50,100ml
Mhm Extra Firm Hairspray 75ml,1.00,unit,1.33,100ml
Schwarzkopf got2b Twisted Curling Mousse 250ml,3.30,unit,1.32,100ml
Garnier Belle Color Natural Permanent Hair Dye Dark Brown 4,3.50,unit,3.50,ea
Rimmel 60 Seconds Super Shine 500 Caramel Cupcake 8ml,3.50,unit,3.50,ea
Phil Smith Be Gorgeous Oh So Straight Conditioner 250ml,3.50,unit,1.40,100ml
Garnier Olia Permanent No Ammonia Hair Dye Light Brown 6.0,6.00,unit,6.00,ea
Head & Shoulders Classic Anti-Dandruff Hair & Scalp Conditioner 275ml,3.50,unit,1.28,100ml
Adidas Eau De Toilette Spray Ice Dive 100ml,7.00,unit,7.00,100ml
Sainsbury's Fresh Faced Detoxifying Facial Wash 150ml,1.75,unit,1.17,100ml
"My Skin Matters 3 in 1 Scrub, Wash & Mask 150ml",1.50,unit,1.00,100ml
Sainsbury's Pony Tail Bands Thin Brown x12,1.50,unit,13p,ea
Casting Creme Gloss 323 Dark Chocolate Brown Semi Permanent Hair Dye,6.00,unit,6.00,ea
Ogx Brazilian Keratin Smooth Conditioner 385ml,3.50,unit,91p,100ml
Rockface All Weather Moisturiser 100ml,2.50,unit,2.50,100ml
L'Oreal Paris Casting Creme Gloss Semi Permanent Hair Dye Iced Chocolate Cool Brunette Brown 515,6.00,unit,6.00,ea
Baylis & Harding Royale Bouquet Limited Edition Luxury Soap Set 3x100g,4.00,unit,1.33,ea
Nivea Men Energy Shower Gel 400ml,1.65,unit,41p,100ml
O'Keeffe's Working Hands Hand Cream 96g,6.50,unit,6.77,100g
John Frieda Luxurious Volume Blow Out Styling Spray 100ml,5.00,unit,5.00,100ml
Ogx Hydrate + Defrizz Kukui Oil Shampoo 385ml,3.50,unit,91p,100ml
Witch Hide & Clear Concealer,4.00,unit,200.00,100g
Herbal Essences Bio:Renew Passion Flower & Rice Milk Nourish Shampoo 400ml,3.00,unit,75p,100ml
Maybelline Master Precise Liquid Eyeliner Pen Black,6.00,unit,6.00,ea
Rimmel Lasting Finish Foundation 200 Soft Beige 30ml,10.00,unit,10.00,ea
Maybelline Great Lash Big Mascara Blackest Black,6.00,unit,6.00,ea
Phil Smith Be Gorgeous Big It Up! Volume Thickening Cream 100ml,4.00,unit,4.00,100ml
L'Oreal Paris Excellence Permanent Hair Dye Natural Mahogany Brown 5.5,7.00,unit,7.00,ea
"Batiste Shampoo, Dark 200ml",3.00,unit,1.50,100ml
Bayley's Of Bond Street Bluebell Handwash 500ml,1.50,unit,30p,100ml
Rimmel Professional Eyebrow Pencil 002 Hazel 1.4g,5.00,unit,5.00,ea
Herbal Essences bio:renew Shampoo 250ml Argan Oil Repair,3.00,unit,1.20,100ml
Maybelline SuperStay 7 Days Gel Nail Polish 135 Nude Pink,3.50,unit,3.50,ea
Carmex Cherry Tube 10g,2.00,unit,20.00,100ml
L'Oreal Paris Revitalift Laser Renew Anti Ageing Day Cream 50ml,15.00,unit,30.00,100ml
NIVEA Biodegradable Cleansing Wipes Organic Aloe Vera 25 Wipes,3.25,unit,13p,ea
Olay Anti-Wrinkle Firm And Lift Eye Renewal Gel 15ml,6.00,unit,40.00,100ml
"Sainsbury's Jaw Clip, Medium x4",2.00,unit,50p,ea
Cuticura Original Anti Bacterial Hand Gel 200ml,2.00,unit,1.00,100ml
Imperial Leather Foamburst Moisture Rose 200ml,5.00,unit,2.50,100ml
Dirty Works 8 in 1 miracle cream 50ml,5.25,unit,10.50,100ml
Original Source Creamy Vanilla & Raspberry Shower 250ml,1.00,unit,40p,100ml
Happy Naturals Nourishing Body Butter Argan Oil & Sweet Orange 200ml,3.00,unit,1.50,100ml
Garnier Nutrisse Ultra Permanent Hair Dye Frosted Chestnut Brown 5.25,6.00,unit,6.00,ea
Max Factor False Lash Effect Waterproof Black Mascara,12.00,unit,12.00,ea
Original Source Sea Salt & Samphire Shower Gel 250ml,1.00,unit,40p,100ml
Freederm Deep Pore Cleansing Wipes 25 Wipes,4.00,unit,16p,wipe
Alpecin Caffeine Shampoo 375ml,8.00,unit,2.13,100ml
Schwarzkopf Live Intense Colour Permanent Hair Dye Red Passion 043,4.80,unit,4.80,ea
Black & White Hair Pomade 50ml,4.50,unit,9.00,100ml
L'Oreal Paris Excellence Permanent Hair Dye Natural Light Gold Blonde 9.3,7.00,unit,7.00,ea
Neutrogena Clear & Defend Facial Wash 200ml,4.50,unit,2.25,100ml
L'Oreal Paris Casting Creme Gloss Semi Permanent Hair Dye Chocolate Brown 535,6.00,unit,6.00,ea
Herbal Essences bio:renew Shampoo Bourbon & Manuka Honey Deep Repair 400ml,3.00,unit,75p,100ml
The Collection Passion Body Frag 75ml,85p,unit,1.13,100ml
"Pantene Pro-V Repair & Protect Conditioner 270ML, For Damaged Hair",1.50,unit,56p,100ml
Radox Bath Oil Coconut 200ml,3.50,unit,1.75,100ml
Cutex Ultra-Powerful Nail Polish Remover 200ml,2.50,unit,1.25,100ml
L'Oreal Paris Excellence Permanent Hair Dye Natural Ash Blonde 8.1,7.00,unit,7.00,ea
Excellence Creme Blondes Supreme Lightest Blonde Hair Dye,7.00,unit,7.00,ea
Garnier Olia Permanent No Ammonia Hair Dye Golden Brown 5.3,6.00,unit,6.00,ea
Garnier Belle Color Natural Permanent Hair Dye Light Brown 6,3.50,unit,3.50,ea
Olay Total Effects Touch of Foundation Medium BB Moisturiser 50ml,15.00,unit,30.00,100ml
Garnier Nutrisse Ultra Permanent Hair Dye Dark Cherry Red 2.6,6.00,unit,6.00,ea
Dove Pro Age Nourishing Body Care Body Lotion 400 ML,3.15,unit,79p,100ml
Wilkinson Sword Intuition Moisture Razor,7.00,unit,7.00,ea
Maybelline Great Lash Waterproof Mascara Very Black,6.00,unit,6.00,ea
"Just For Men Hair Dye, Light Brown",6.75,unit,6.75,ea
Clairol Nice'n Easy Crme Natural Looking Oil-Infused Permanent Hair Dye Light Ash Blonde 9A,5.00,unit,5.00,ea
Brut Aftershave 100ml,7.00,unit,7.00,100ml
Neutrogena Clear & Defend Facial Scrub 150ml,4.50,unit,3.00,100ml
Nivea Indulgent Moisture Coconut Shower Cream 250ml,1.00,unit,40p,100ml
The Collection Love Body Fragrance 75ml,85p,unit,1.13,100ml
L'Oreal Elnett Infinite Shine Hairspray 75ml Paris Collection,2.00,unit,2.66,100ml
Herbal Essences Bio:Renew Flower & Rice Milk Nourish Conditioner 400ml,3.00,unit,75p,100ml
Garnier Nutrisse 10.1 Ice Blonde Permanent Hair Dye,6.00,unit,6.00,ea
Schwarzkopf got2b Beach Matt Salt Spray 200ml,3.30,unit,1.65,100ml
Dirty Works Coconut Foaming Sugar Scrub 250g,2.50,unit,2.50,ea
Sainsbury's 3-Way Buffer,3.00,unit,3.00,ea
Max Factor Creme Puff 05 Translucent Powder,9.00,unit,4.29,10g
L'Oreal Paris Men Expert Black Mineral Shower Gel 300ml,1.50,unit,50p,100ml
Olay Regenerist 3 Point Daily Treatment Moisturiser Day Cream 50ml,30.00,unit,60.00,100ml
Rimmel Lasting Finish Foundation 100 Ivory 30ml,10.00,unit,10.00,ea
Magic Retouch Brown Root Touch Up,6.00,unit,8.00,100ml
O'Keeffe's Lip Repair Unscented Lip Balm 4.2g,3.00,unit,71.43,100g
Head & Shoulders Apple Anti-Dandruff Hair & Scalp Conditioner 275ml,3.50,unit,1.28,100ml
L'Oreal Men Expert Hydra Energetic Daily Moisturiser 50ml,4.00,unit,8.00,100ml
Clairol Nice'n Easy Non Permanent Hair Dye No Ammonia Medium Gold Brown 78,5.50,unit,5.50,ea
L'Oreal Paris Excellence Permanent Hair Dye Natural Iced Brown 5.15,7.00,unit,7.00,ea
Sanex Dermo Pro Hydrate Shower Gel Cream 450ml,2.00,unit,44p,100ml
Palmer's Coconut Oil Formula Leave-In Conditioner 250ml,3.75,unit,1.50,100ml
"Sainsbury's Snap On Clips, Black x6",1.50,unit,25p,ea
My Skin Matters purifying toner 250ml,1.50,unit,60p,100ml
Dirty Works Get Set Glow Mini Luxuries,4.00,unit,4.00,ea
L'Oreal Paris Magic Retouch Temporary Instant Grey Root Concealer Spray Dark Brown,6.00,unit,8.00,100ml
L'Oreal Men Expert Hydra Energetic Deep Exfoliating Face Scrub 100ml,2.50,unit,2.50,100ml
Garnier Belle Color Ultra Light Natural Permanent Hair Dye Blonde 110,3.50,unit,3.50,ea
Ogx Anti-Breakage Keratin Oil Conditioner 385ml,3.50,unit,91p,100ml
Lynx Collision Leather + Cookies Body Spray For Men 150ml,3.00,unit,2.00,100ml
Burt's Bees Ultra Conditioning Lip Balm Tube 4.25g,3.50,unit,8.23,10g
"Beckham Aftershave Lotion, Homme 50ml",8.00,unit,16.00,100ml
L'Oreal Paris Preference Permanent Hair Dye Brasilia Dark Brown 3.0,6.00,unit,6.00,ea
Schwarzkopf Live Intense Colour Permanent Hair Dye Mystic Violet 087,4.80,unit,4.80,ea
Garnier Micellar Water Oil Infused 400ml,4.00,unit,1.00,100ml
Ogx Anti-Breakage Keratin Oil Shampoo 385ml,3.50,unit,91p,100ml
My Skin Matters Hand & Nails Cream 75ml,1.50,unit,2.00,100ml
Source of Nature Facial Wash 150ml,2.00,unit,1.33,100ml
Source of Nature Eye Make-Up Remover White Tea & Buriti Oil 125ml,2.00,unit,1.60,100ml
Rimmel Exaggerate Eye Liner Intense 001 Black 2.5ml,6.00,unit,6.00,ea
Simple Water Boost Skin Face Hydrating Gel Cream 50ml,3.50,unit,7.00,100ml
Bior Deep Pore Charcoal Cleanser 200ml,3.50,unit,1.75,100ml
Men Advance Blade Razor x6 with Trimmer,5.00,unit,5.00,ea
L'Oreal Paris Casting Creme Gloss Semi Permanent Hair Dye Iced Brown 415,6.00,unit,6.00,ea
Max Factor Masterpiece Max 001 Black Mascara,9.00,unit,6.92,10g
L'Oreal Paris Excellence Permanent Hair Dye Rich Auburn Red 5.6,7.00,unit,7.00,ea
Gillette Fusion Proshield Razor Blades x4,15.50,unit,3.88,bld
L'Oreal Paris Micellar Water Cleanser Sensitive Skin400ml,4.00,unit,1.00,100ml
"Dax Wave & Groom Hair Wax for Short Hair, Red 99g",3.00,unit,3.03,100g
Garnier Belle Color Natural Permanent Hair Dye Dark Blonde 7,3.50,unit,3.50,ea
Mhm Mousse 200ml,1.50,unit,75p,100ml
Nair Tough Hair Coarse/Dark Hair Removal Cream 200ml,2.70,unit,1.35,100ml
L'Oreal Paris Anti-Wrinkle Expert Firming Cream 45+50ml,8.00,unit,16.00,100ml
Sainsbury's Hair Clamp Tortoise Large,2.00,unit,2.00,ea
Nair Hair Remover Natural Argan Oil Nourish Shower Power Cream 2 x 30ml,1.50,unit,2.50,100ml
Rimmel Natural Waterproof Bronzing Powder 022 Sun Bronze 14g,5.00,unit,5.00,ea
L'Oreal Excellence 7.31 Natural Dark Caramel Blonde Permanent Hair Dye,7.00,unit,7.00,ea
Ogx Extra Strength Damage Remedy + Coconut Miracle Oil Conditioner 385ml,3.50,unit,91p,100ml
Schwarzkopf Live Intense Colour Permanent Hair Dye Real Red 035,4.80,unit,4.80,ea
Herbal Essences bio:renew Conditioner Bourbon & Manuka Honey 400ml,3.00,unit,75p,100ml
Nivea Men Active Age Face Moisturiser 50ml,6.00,unit,12.00,100ml
L'Oreal Paris Age Perfect Golden Age Day Cream 50ml,13.00,unit,26.00,100ml
Men Advance 2 Blade Disposable Razor with Pivoting Head x10,1.50,unit,15p,bld
Clairol Nice'n Easy Non Permanent Hair Dye No Ammonia Dark Warm Brown 82,5.50,unit,5.50,ea
Garnier Natural Rose Cleansing Milk Sensitive Skin 200ml,2.50,unit,1.25,100ml
Lynx Ice Chill Body Spray For Men 250ml,4.00,unit,1.60,100ml
Herbal Essences bio:renew Conditioner 200ml Argan Oil Repair,3.00,unit,1.50,100ml
Clairol Nice'n Easy Crme Natural Looking Oil-Infused Permanent Hair Dye Medium Brown 5,5.00,unit,5.00,ea
L'Oreal Paris Volume Million Lashes Mascara Extra Black,8.00,unit,8.00,ea
Gillette SkinGuard Sensitive Mens Shaving Foam 250ml,3.00,unit,1.20,100ml
Garnier Belle Color Permanent Hair Dye Black 1,3.50,unit,3.50,ea
Nivea Creme All Purpose Body Cream for face hands and body 400ml,4.50,unit,1.13,100ml
Gillette SkinGuard Sensitive Mens Shaving Gel 200ml,3.00,unit,1.50,100ml
Head & Shoulders Anti-Dandruff Supreme Smooth Shampoo For Dry Hair 400ml,3.50,unit,88p,100ml
Clairol Nice'n Easy Non Permanent Hair Dye No Ammonia Light Golden Brown 76,5.50,unit,5.50,ea
Garnier Ultimate Blends Hair Food Banana 3-in-1 Dry Vegan Hair Mask 390ml,3.50,unit,90p,100ml
Garnier Ultimate Blends Hair Food Coconut Oil 3-in-1 Frizzy Vegan Hair Mask 390ml,3.50,unit,90p,100ml
Lynx Signature Daily Fragrance Spray 100ml,6.00,unit,6.00,100ml
L'Oreal Paris Preference Permanent Hair Dye Florida Golden Blonde 7.3,6.00,unit,6.00,ea
Dettol Antibacterial Liquid Hand Wash Camomile 250ml,2.50,unit,1.00,100ml
Garnier Moisture Bomb 3in1 Day Cream Moisturiser 50ml,5.00,unit,10.00,100ml
Rimmel Hide The Blemish Concealer Sand,5.00,unit,5.00,ea
Batiste Dry Shampoo & Volume with Plumping Collagen 200ml,5.00,unit,2.50,100ml
Clairol Age Defy Medium Brown Hair Dye 5,5.50,unit,5.50,ea
Happy Naturals Nourishing Hand Cream Argan Oil & Sweet Orange 100ml,2.50,unit,2.50,100ml
Radox Bath Oil Eucalyptus 200ml,3.50,unit,1.75,100ml
"John Frieda Sheer Blonde Go Blonder, Controlled Lightening Spray 100ml",5.00,unit,5.00,100ml
Happy Naturals Nourishing Body Scrub Argan Oil & Shea 200ml,3.00,unit,1.50,100g
L'Oreal Paris Anti Wrinkle Expert Restoring Cream 55+ 50ml,8.00,unit,16.00,100ml
L'Oreal Paris Casting Creme Gloss Semi Permanent Hair Dye Ebony Black 200,6.00,unit,6.00,ea
Cetaphil Gentle Skin Cleanser 236ml,8.50,unit,3.60,100ml
Rimmel Fix & Protect Primer,7.00,unit,7.00,ea
L'Oreal Paris Pure Clay Detox Face Mask 50ml,6.00,unit,12.00,100ml
Garnier Belle Color Natural Permanent Hair Dye Dark Ash Blonde 7.1,3.50,unit,3.50,ea
Rimmel London Extra Super Lash Mascara 101 Black Black 8ml,5.50,unit,6.88,10ml
Garnier Olia Permanent No Ammonia Hair Dye Soft Black 3.0,6.00,unit,6.00,ea
Garnier Olia Permanent No Ammonia Hair Dye Light Blonde 9.0,6.00,unit,6.00,ea
Garnier Nutrisse Ultra Maximum Lightener Permanent Hair Dye Blonde D+++ Bleach,6.00,unit,6.00,ea
Love Beauty And Planet Blooming Colour Shampoo,6.00,unit,1.50,100ml
Simple Hydrating Biodegradable Cleansing Wipes x20,2.00,unit,2.00,ea
Rimmel Extra 3D Lash 003 Extreme Black 8ml,5.00,unit,62.50,100ml
"Phil Smith Be Gorgeous Shampoo, Super Smooth 350ml",3.50,unit,1.00,100ml
L'Oreal Paris Excellence Permanent Hair Dye Natural Light Ash Blonde 9.1,7.00,unit,7.00,ea
So...? Vanilla Body Mist 100ml,2.00,unit,2.00,100ml
Clairol Nice'n Easy Non Permanent Hair Dye No Ammonia Medium Ash Blonde 73,5.50,unit,5.50,ea
Garnier Nutrisse Ultra Permanent Hair Dye Fiery Red 6.6,6.00,unit,6.00,ea
Bulldog Skincare for Men Original Beard Oil 30ml,3.50,unit,11.67,100ml
Palmer's Coconut Oil Formula Moisture Gro Hairdress 150g,2.00,unit,1.33,100g
Bulldog Skincare Original Shower Gel 500ml,3.00,unit,60p,100ml
Maybelline Colossal Mascara 100% Black,7.00,unit,7.00,ea
L'Oreal Paris Preference Permanent Hair Dye Caracas Intense Deep Brown 4.15,6.00,unit,6.00,ea
Sainsbury's Mini Jaw Hair Clips x6,2.00,unit,33p,ea
Casting Creme Gloss 316 Plum Semi Permanent Hair Dye,6.00,unit,6.00,ea
Bull Dog Skincare for Men Oil Control Face Wash 150ml,3.00,unit,2.00,100ml
Sainsbury's Velor Powder Puff x2,2.00,unit,1.00,ea
Gillette Mach3 Men's Razor Blades x13 Refills,22.00,unit,1.69,bld
Palmer's Coconut Oil Formula Deep Conditioning Protein Pack 60g,1.50,unit,2.50,100g
Baylis & Harding English Lavender And Chamomile Hand Wash 500ml,2.00,unit,40p,100ml
L'Oreal Men Expert Pure Power Anti-Spot Moisturiser 50ml,4.00,unit,8.00,100ml
Garnier Belle Color Natural Permanent Hair Dye Light Honey Blonde 9.3,3.50,unit,3.50,ea
O'Keeffe's Working Hands Hand Cream 85g,6.00,unit,7.06,100ml
L'Oreal Paris Fine Flowers Cleansing Milk Sensitive Skin400ml,3.00,unit,75p,100ml
"John Frieda Frizz Ease Weightless Wonder Conditioner for Frizzy, Fine Hair 250ml",4.00,unit,1.60,100ml
Biore Charcoal Strips,6.50,unit,6.50,ea
Sainsbury's Curved Scissors,2.00,unit,2.00,ea
Bulldog Skincare Peppermint & Eucalyptus Shower Gel 500ml,3.00,unit,60p,100ml
Pantene Wonder Ampoules Colour Protect For Coloured Hair 3x15ml,3.75,unit,8.33,100ml
John Frieda Precision Foam Colour Brilliant Brunette Hair Dye Light Natural Brown 6N,6.50,unit,6.50,ea
Garnier Nutrisse Permanent Hair Dye Auburn 4.5,6.00,unit,6.00,ea
Rockface Face & Body Scrub 150ml,2.50,unit,1.67,100ml
E45 Straightforward Skincare Rich 24HR Lotion 400ml,7.00,unit,1.75,100ml
Herbal Essences bio:renew Shampoo 250ml Coconut Milk Hydrate,3.00,unit,1.20,100ml
The Collection Miami Body Fragrance 75ml,85p,unit,1.13,100ml
Clairol Nice' n Easy Non Permanent Hair Dye No Ammonia Medium Ash Brown 77,5.50,unit,5.50,ea
Pantene Dry Oil Vitamin E Repair & Protect 100ml,7.00,unit,7.00,100ml
Gillette Simply Venus 3 Women's Disposable Razors 8 Count,5.00,unit,63p,bld
Dr. Wolff Plantur 39 Phyto-Caffeine Shampoo 250ml,9.75,unit,3.90,100ml
Bulldog Skincare for Men Oil Control Moisturiser 100ml,4.00,unit,4.00,100ml
Source of Nature Hand Cream 75ml,2.00,unit,2.67,100ml
L'Oreal Paris Preference Permanent Hair Dye Glasgow Very Very Light Ash Blonde 03,6.00,unit,6.00,ea
Veet Wax Strips Maxi Format x40,13.00,unit,13.00,bld
Just For Men Control GX Grey Reducing 2 in 1 Shampoo and Conditioner 147ml,9.00,unit,6.12,100ml
John Frieda Brilliant Brunette Volumising Deep Shampoo 250ml,4.00,unit,1.60,100ml
Schwarzkopf Live Intense Colour Permanent Hair Dye Cosmic Blue 090,4.80,unit,4.80,ea
L'Oreal Paris Casting Creme Gloss Semi Permanent Hair Dye Chocolate Brownie Brown 454,6.00,unit,6.00,ea
The Collection Musk Body Fragrance 75ml,85p,unit,1.13,100ml
Dirty Works Cucumber Eye Pads,2.75,unit,14p,ea
"Sainsbury's Medium Pony Bands, Brown x12",1.50,unit,13p,ea
Bulldog Skincare Vetiver & Black Pepper Shower Gel 500ml,3.00,unit,60p,100ml
Maybelline SuperStay 7 Days Nail Polish 78 Nude Porcelain,3.50,unit,3.50,10ml
L'Oreal Paris Excellence Permanent Hair Dye Natural Baby Blonde 10,7.00,unit,7.00,ea
Nivea Men Sport Shower Gel 400ml,1.65,unit,41p,100ml
"John Frieda Frizz Ease Weightless Wonder Shampoo for Frizzy, Fine Hair 250ml",4.00,unit,1.60,100ml
