Description,Price/Unit,Unit,Price/Measure,MeasureMaybelline Fit Me Pressed Face Powder 128 Warm Nude,6.00,unit,6.67,10g
L'Oreal Paris Age Perfect Golden Age Rosy Radiant Eye Cream 15ml,15.00,unit,15.31,100g
Olay Retinol24 Night Face Moisturiser With Retinol & Vitamin B3 50ml,17.50,unit,35.00,100g
"Head & Shoulders Anti Dandruff Shampoo, Deep Hydration with Coconut Oil 500ml",3.50,unit,70p,100ml
Remington Pg6130 Grooming Kit,18.00,unit,18.00,ea
Sainsbury's Hair Pins Black x 40,2.00,unit,2.00,ea
Disney Frozen II Bath & Shower Bubbles 3+ 400ml,2.00,unit,50p,100ml
Men Advance 5 Blade Disposable Razor with Trimmer x3,3.50,unit,1.17,bld
Clairol Nice'n Easy Non Permanent Hair Dye No Ammonia Mahogany 81,5.50,unit,5.50,ea
Maybelline SuperStay 24hr Dual Lipstick 340 Absolute Plum,10.00,unit,10.00,ea
John Frieda Sheer Blonde Ultra Illuminating Shampoo 250ml,5.00,unit,2.00,100ml
FatFace Luxury Hand Cream Rose & Violet 100ml,4.00,unit,4.00,ea
Rimmel London Lasting Finish Lipstick 264 Coffee Shimmer 4g,4.50,unit,4.50,ea
Clairol Nice'n Easy Crme Natural Looking Oil-Infused Permanent Hair Dye Medium Cool Blonde 8C,5.00,unit,5.00,ea
Nip+Fab Glycolic Daily Cleansing 60 Pads,11.00,unit,13.75,100ml
Boutique Eyebrow Defining Gel 5ml,2.50,unit,5.00,10ml
Source of Nature Cleansing Milk White Tea & Shea Butter 200ml,2.00,unit,1.00,100ml
Rimmel London 60 Seconds Super Shine 203 Lose Your Lingerie 8ml,3.50,unit,3.50,ea
Super Facialist Glow Boost Skin Serum 30ml,11.50,unit,38.34,100ml
L'Oreal Paris Miss Baby Roll Mascara Black,8.00,unit,8.00,ea
Marvel Spider-Man Bath & Shower Bubbles 3+ 400ml,2.00,unit,50p,100ml
Max Factor Pan Stik 13 Nouveau Beige 9g,8.00,unit,11.43,10g
Max Factor Crme Puff Blush Lovely Pink,8.00,unit,8.00,ea
L'Oreal Age Perfect Intensive Renourish Manuka Honey Serum 30ml,20.00,unit,66.67,100ml
Pantene Hair Biology Mask De-frizz & Illuminate 160ml,3.50,unit,2.19,100ml
Sainsbury's Head Band x3,2.00,unit,67p,ea
QVS Curved Nail Scissors,4.50,unit,4.50,ea
Sanctuary Spa Pamper Cracker,10.00,unit,10p,ml
Rimmel Wonder'Full Mascara 001 Black 11ml,9.50,unit,79.17,100ml
Maybelline SuperStay 7 Days Gel Nail Polish 21 Pink in Park,3.50,unit,3.50,ea
Dirty Works Beauty Bag,7.00,unit,7.00,ea
L'Oreal Paris True Match Foundation 1.N Ivory 30ml,10.00,unit,33.33,100ml
Aussie Blonde Hydration 3 Minute Miracle Deep Treatment Hair Mask 225ml,3.30,unit,1.47,100ml
Harry's Men's Face Lotion SPF15 50ml,7.00,unit,14.00,100ml
Simple SPF 30 Triple Protection Moisturiser 40 ml,7.00,unit,17.50,100ml
Sainsbury's Smooth! Face Hair Removal Kit 2x250ml,4.00,unit,4.00,100ml
Faith in Nature Grapefruit & Orange Body Wash 400ml,3.70,unit,93p,100ml
Super Facialist Retinol+ Anti-Ageing Restoring Serum 30ml,11.50,unit,38.34,100ml
Eylure Naturals Lashes No. 031,5.00,unit,5.00,ea
Baylis & Harding The Fuzzy Duck Cotswold Floral Bath Fizzers Set x4,7.00,unit,1.75,ea
Phil Smith Be Gorgeous Root Touch Up Root Concealer Spray for Light Brunette Hair 75ml,6.00,unit,8.00,100ml
Beautopia Glam Trio Emery Boards,3.00,unit,1.00,ea
Maybelline The Falsies Mascara Very Black,9.00,unit,9.00,ea
Rimmel Scandal'eyes Wow Mascara Extreme Black 12ml,8.50,unit,8.50,ea
Herbal Essences bio:renew Conditioner 200ml White Grapefruit Volume,3.00,unit,1.50,100ml
Faith in Nature Avocado Conditioner 400ml,3.70,unit,88p,100ml
Nip + Fab Glycolic Fix Night Pads Extreme 60 Pads,12.50,unit,15.63,100ml
Maybelline SuperStay 7 Days Gel Nail Polish 130 Rose Pink,5.00,unit,5.00,ea
Dirty Works Talk to the Hand Manicure Set,5.00,unit,5.00,ea
L'Oreal Paris Volume Million Lashes Feline Mascara Black,8.00,unit,8.00,ea
Smith England Boost Lasting Volume Shampoo 250ml,8.00,unit,3.20,100ml
Smith England Nourish Moisture Remedy Shampoo 250ml,8.00,unit,3.20,100ml
Charlie Blue Eau De Toilette 100ml,5.00,unit,5.00,100ml
Lynx Africa & Marmite Shower Gel 250ml,1.50,unit,60p,100ml
L'Oreal Men Expert Barber Club Long Beard Skin Oil 30ml,5.50,unit,18.34,100ml
Happy Naturals Argan Oil & Sweet Orange Mini Collection 3x50ml,3.50,unit,3.50,ea
Dirty Works Top To Toe Treats,7.00,unit,7.00,ea
L'Oreal Paris Magic Retouch Precision Instant Dark Root Touch Up Spray Light Blonde 75ml,6.00,unit,6.00,ea
Super Facialist Purify & Refresh Facial Scrub 150ml,5.50,unit,3.66,100ml
Maybelline Instant Anti Age Eraser Eye Concealer 03 Fair,9.00,unit,13.24,10ml
Garnier Organic Cornflower Micellar Water 400ml,7.00,unit,1.75,100ml
L'Oreal Age Perfect Intensive Renourish Manuka Honey Day Cream 50ml,20.00,unit,40.00,100ml
Rimmel London Lasting Finish Lipstick 006 Pink Blush 4g,4.50,unit,4.50,ea
Hawkins & Brimble Elemi & Ginseng Matt Clay Pomade 100ml,8.00,unit,8.00,100ml
Dirty Works Handbag Heroes,5.00,unit,5.00,ea
Maybelline Fit Me Pressed FacePowder 220 Natural Beige,6.00,unit,6.67,10g
Clairol Nice'n Easy Crme Natural Looking Oil-Infused Permanent Hair Dye Dark Brown 4,5.00,unit,5.00,ea
L'Oreal Paris Superliner Le Khol Eyeliner 101 Midnight Black,4.00,unit,13.33,10g
Maui Moisture Body Care Extra Hydrating & Shea Butter Body Wash 577ml,6.00,unit,1.04,100ml
L'Oreal Age Perfect Intensive Renourish Manuka Honey Night Cream 50ml,20.00,unit,40.00,100ml
Nivea Unicorn Moments Lip Trio Gift Set,4.00,unit,4.00,ea
Faith in Nature Grapefruit & Orange Shampoo 400ml,3.70,unit,93p,100ml
Phil Smith Little Smiths Detangling Flower Hair Brush,4.00,unit,4.00,ea
Rimmel London Lasting Finish Lipstick 084 Amethyst Shimmer 4g,4.50,unit,4.50,ea
Phil Smith Be Gorgeous Root Touch Up Root Concealer Spray for Dark Blonde Hair 75ml,6.00,unit,8.00,100ml
Baylis & Harding The Fuzzy Duck Men's Ginger & Lime Piece Set x5,13.00,unit,13.00,ea
Beautopia Manicure Set,6.00,unit,6.00,ea
QVS Ceramic Stone Pedicure File,4.50,unit,4.50,ea
Clairol Nice'n Easy Non Permanent Hair Dye No Ammonia Lightest Gold Brown 96,5.50,unit,5.50,ea
QVS Tweezer Triple Set,8.00,unit,8.00,ea
Harry's Fig Shower Gel 250ml,5.00,unit,2.00,100ml
Babyliss Velvet Orchid Dryer 5513U,25.00,unit,25.00,ea
Sanctuary Spa Lost in the Moment Gift Set,13.00,unit,13.00,ea
Maybelline Color Sensational Satin Lipstick 725 Taupe Nude,5.00,unit,5.00,ea
Max Factor Lipfinity Lipstick 070 Spicy,9.00,unit,18.00,10g
Rimmel London Lasting Finish 25Hr Skin Perfecting Full Coverage Foundation SPF 20 400 Natural Beige,10.00,unit,10.00,ea
Men Advance Sensitive Post Shave Balm 100ml,3.00,unit,3.00,100ml
Dr. Pawpaw Original Balm 25ml,7.00,unit,28.00,100ml
Maybelline Fit Me Concealer 20 Sand 6.8ml,6.00,unit,8.82,10ml
Smith England Nourish Moisture Remedy Conditioner 250ml,8.00,unit,3.20,100ml
Burt's Bees Bark & Chamomile Deep Cleansing Cream,7.50,unit,4.41,100g
Max Factor Miracle Prep Illuminating & Hydrating Primer,10.00,unit,33.34,100ml
Olay Eyes Firming Eye Serum For Wrinkles And Sagging Skin 15 ml,25.00,unit,166.67,100ml
Ogx Damage Remedy + Coconut Miracle Oil Hair Mask 168g,3.50,unit,2.08,100g
BeautyPro Detoxifying Bubbling Cleansing Mask with Activated Charcoal 20ml,4.00,unit,22.22,100ml
Boutique HD Eyebrow Pencil Dark,2.00,unit,2.00,ea
L'Oreal Paris Brow Artist Pencil 02 Blonde,6.00,unit,6.00,ea
L'Oreal Paris Tattoo Signature Superliner 24HR Liquid Eyeliner Black,5.00,unit,5.00,ea
Balance Me Moisture Rich Face Cream 50ml,19.20,unit,38.40,100ml
Rimmel London Super Gel 032 Cocktail Passion 12ml,5.00,unit,50.00,10g
Lynx Ice Chill Daily Fragrance 100ml,6.00,unit,6.00,100ml
Charlie Red Eau De Toilette Natural Spray 100ml,5.00,unit,5.00,100ml
Rimmel London Super Gel Step 1 054 Trust You 12ml,5.00,unit,41.66,100ml
Scunci Scissors With Cover Card,6.00,unit,6.00,ea
Garnier Ultimate Blends Nourishing Hair Food Banana Conditioner for Dry Hair 350ml,3.00,unit,86p,100ml
Nivea Men Active Age Night Regenerator 50ml,6.00,unit,12.00,100ml
Nivea Men Sensitive Shave Duo Gift Set,6.50,unit,6.50,ea
Maybelline Color Sensational Lip Liner132 Sweet Pink,4.00,unit,4.00,ea
Wellbeing Hand Maintenance Set,6.00,unit,6.00,ea
Rimmel Maxi Blush Third Base 9g,4.50,unit,4.50,ea
Dirty Works Perfect Pamper Set,8.00,unit,8.00,ea
Nivea Oil in Lotion Coconut & Monoi Oil 400ml,5.00,unit,1.25,100ml
Rimmel London Volume Flash x10 Mascara 001 Black 8ml,7.00,unit,7.00,ea
Wilkinson Sword Hydro 5 Sense Energize Men's Razor,5.00,unit,5.00,ea
Maybelline The Blushed Nudes Eyeshadow Palette,9.00,unit,90.00,10g
Sanctuary Spa Body Moisture Spray 150ml,6.00,unit,4.00,100ml
Garnier Moisture Bomb Lavender Hydrating Face Sheet Mask for Fatigued Skin 32g,2.00,unit,2.00,ea
L'Oreal Paris Brow Artist Pencil 03 Brunette,6.00,unit,6.00,ea
Garnier Nutrisse Permanent Hair Dye Natural Light Ash 9.13,6.00,unit,6.00,ea
Pantene Pro-V Lift & Volume Silicone Free Hair Conditioner with Biotin & Rose Water 275ml,5.00,unit,1.82,100ml
Sainsbury's Kids Accessories 10 Hair Bands + 4 Snap Clips,2.50,unit,2.50,ea
Maybelline SuperStay Pressed Powder 010 Ivory,6.00,unit,10.00,100g
Faith in Nature Coconut Body Wash 400ml,3.70,unit,93p,100ml
Garnier Micellar Rose Water Cleanse & Glow 400ml,4.00,unit,4.00,ea
Fudge Urban Texture Junk 75ml,7.00,unit,10.00,100g
Sainsbury's Accessories Scrunchies x2,2.00,unit,2.00,ea
L'Oreal Paris Color Riche Lipstick 373 Magnetic Coral,8.00,unit,8.00,ea
Boutique Blusher Brush,4.00,unit,4.00,ea
Burt's Bees Rosemary & Lemon Hand Cream with Shea Butter 28.3g,5.00,unit,5.00,ea
Maybelline Instant Anti Age Eraser Eye Concealer 00 Ivory,9.00,unit,13.24,10ml
Rimmel Glam Eyes Day 2 Night Mascara 001 Black 9.5ml,6.00,unit,6.00,ea
Feather & Down Sweet Dreams All Purpose Sleep Balm 16g,7.00,unit,7.00,ea
Happy Naturals Monoi Body Souffle,3.50,unit,3.50,100ml
L'Oreal Paris Magic Retouch Temporary Instant Grey Root Concealer Spray Dark Iced Brown,6.00,unit,6.00,ea
"John Frieda Detox & Repair Conditioner for Dry, Stressed & Damaged Hair 250ml",4.00,unit,1.60,100ml
Faith in Nature Lavender & Geranium Conditioner 400ml,3.70,unit,93p,100ml
Sanctuary Spa Heel Balm 75ml,7.50,unit,10.00,100ml
L'Oreal Paris X Fiber Xtreme Resist Waterproof Mascara Black,9.00,unit,9.00,ea
Boutique Mini Make-Up Blending Sponges x2,2.50,unit,2.50,ea
Eco Warrior Gently Cleansing Sensitive Facial Bar Chamomile & Calendula Essential Oils 100g,3.50,unit,3.50,100g
Childs Farm Bubble Bath Organic Raspberry 500ml,7.50,unit,1.50,100ml
Boutique Smoothing Primer 30ml,4.00,unit,1.33,10ml
Burt's Bees Sensitive Facial Cleanser,8.50,unit,5.00,100ml
Rimmel London Kate Lipstick 01 4g,1.00,unit,1.00,ea
"John Frieda Detox & Repair Shampoo for Dry, Stressed & Damaged Hair 250ml",4.00,unit,1.60,100ml
Issey Miyake L'eau D'issey Pour Homme Men Eau de Toilette Natural Spray 75ml,35.00,unit,46.67,100ml
"Grace Lily Bath Flowers Magnolia, Pink Pepper & Sandalwood",5.00,unit,5.00,ea
Super Facialist Retinol+ Anti-Ageing Renewing Day Cream 50ml,13.50,unit,27.00,100ml
Rimmel Super Gel Nail Polish Glitter Top Coat 12ml,5.00,unit,5.00,ea
Invisibobble Original 3 Crystal Clear Hair Ties,5.00,unit,5.00,ea
Remington D3010 Power Dry 2000W Hairdryer,12.00,unit,12.00,ea
Rimmel London Scandal Eyes Reloaded Mascara 001 Black 12ml,8.50,unit,8.50,ea
BIC Soleil Scent 3 Blade Disposable Women's Razors x4,2.50,unit,63p,ea
L'Oreal Paris Revitalift Energising Red Day Cream 50ml,15.00,unit,30.00,100ml
Boutique Volumising & Defining Mascara Brown 8ml,3.00,unit,3.00,ea
Schwarzkopf Live Ultra Brights or Pastel Semi-Permanent Hair Dye Steel Silver 98,4.80,unit,4.80,ea
Maybelline Total Temptation Eyeshadow & Highlight Palette,12.00,unit,12.00,ea
Schwarzkopf Live Intense Colour Urban Metallics Permanent Hair Dye Blue Mercury U67,4.80,unit,4.80,ea
Maui Moisture Color Protection + Sea Minerals Shampoo 385ml,9.00,unit,2.34,100ml
Yes To Tomatoes Blemish Fighting Paper Mask 20ml,2.00,unit,2.00,ea
My Hair Matters Large Ceramic Hot Curl Brush,3.50,unit,3.50,ea
Boutique Cotton Pads x 50,2.00,unit,4p,ea
Maybelline Fit Me Liquid Foundation 115 Ivory,8.00,unit,2.67,10ml
Bull Dog Skincare for Men Oil Control Face Mask 100ml,4.00,unit,4.00,100ml
Maui Moisture Color Protection + Sea Minerals Conditioner 385ml,9.00,unit,2.34,100ml
Sanctuary Spa Purifying Charcoal Bubble Sheet Mask 22g,2.50,unit,11.37,100g
Let's Get Fabulous Face Palette,7.00,unit,7.00,ea
Olay Regenerist Whip Light As Air Moisturiser For Firmer Skin SPF30,35.00,unit,70.00,100ml
Pantene Gold Series Intense Hydrating Oil 95ml,6.00,unit,6.00,100ml
Dirty Works Glitterbug,6.00,unit,6.00,ea
Garnier Ultimate Blends Nourishing Hair Food Banana Shampoo for Dry Hair 350ml,3.00,unit,86p,100ml
Maybelline Color Sensational Lip Liner547 Pleasure Me Red,4.00,unit,4.00,ea
Balance Me Wonder Eye Cream 15ml,16.00,unit,106.66,100ml
Garnier Organic Lemongrass Gel Wash 150ml,6.00,unit,4.00,100ml
Maybelline Lasting Drama Gel Eyeliner 01 Black,9.00,unit,9.00,ea
Bior Baking Soda Anti-Blemish Cleansing Foam 200ml,6.00,unit,3.00,100ml
Noughty Intensive Care Leave-In Conditioner 150ml,7.00,unit,4.67,100ml
Maybelline Dream Lumi Touch Concealer Pen 01 Ivory,8.00,unit,8.00,ea
Head & Shoulders Deep Hydration Anti-Dandruff Hair Conditioner 275ml,3.50,unit,1.28,100ml
Method Foam Hand Wash Limited Edition Ginger Twist 300ml,3.50,unit,1.17,100ml
Garnier Moisture Bomb Sakura Hydrating Face Sheet Mask for Dull Skin 32g,2.00,unit,2.00,ea
Rimmel London Lasting Radiance Concealer Ivory 10ml,7.50,unit,75.00,100ml
Spider-Man Spidey Science Fan Bath Laboratory Gift Set,5.50,unit,5.50,ea
Rimmel London Kate Super Gel 012 Soul Session 12ml,5.00,unit,50.00,10g
Max Factor Crme Puff Blush Seductive Pink,8.00,unit,8.00,ea
Dirty Works Fragrance Rollerballs 3 x 10ml,7.50,unit,7.50,ea
L'Oreal Paris True Match Foundation 4.W Golden Natural 30ml,7.00,unit,7.00,ea
Boutique HD Eyebrow Pencil Light,2.00,unit,2.00,ea
Grace Lily Getaway Bag,7.00,unit,7.00,ea
Boutique Lengthening Mascara Black 8ml,3.00,unit,3.75,10ml
Phil Smith Be Gorgeous Root Touch Up Root Concealer Spray for Blonde Hair 75ml,6.00,unit,8.00,100ml
Garnier Fresh-Mix Replumping Face Sheet Shot Mask with Hyaluronic Acid 33g,3.00,unit,3.00,ea
Sally Hansen Nail Growth Miracle,10.00,unit,10.00,ea
QVS Toenail Clippers,4.50,unit,4.50,ea
Max Factor Volume Infusion Mascara Black,12.00,unit,12.00,ea
L'Oreal Paris C'est Magic BB Cream 02 Light,11.00,unit,28.21,100g
Eylure Exaggerate Lash No 143,7.00,unit,7.00,ea
Pantene Gold Series Leave-On Detangling Milk 225 ml,6.00,unit,2.67,100ml
Wellbeing Sleep Pamper Set,9.00,unit,9.00,ea
Dirty Works Bath Salt Stacker Gift,6.00,unit,6.00,ea
Rimmel London Scandaleyes Precision Micro Eyeliner 1.1ml,6.00,unit,75.00,100g
Babyliss Velvet Orchid Straightener 2513U,25.00,unit,25.00,ea
Super Facialist Rose Hydrate Miracle Makeover Facial Oil 30ml,10.00,unit,33.33,100ml
Nivea Skincare Cashmere Indulgence Gift Set,13.00,unit,13.00,ea
Noughty Wave Hello Curl Defining Shampoo 250ml,7.00,unit,2.80,100ml
Sally Hansen Miracle Cure 13.3ml,10.00,unit,7.52,10ml
Davidoff Coolwater Aftershave 75ml,20.00,unit,26.67,100ml
Olay Eyes Pro-Retinol Eye Treatment 15ml,30.00,unit,200.00,100ml
Max Factor Mastertouch Concealer Beige 309,8.00,unit,4.00,10g
Elegant Touch Natural French 126 (s),7.50,unit,7.50,ea
NIVEA MicellAir Professional Exfoliating Face Wash 125ml,2.50,unit,2.00,100ml
Paco Rabanne 1 Million Aftershave 100ml,35.00,unit,35.00,100ml
"Rimmel Lasting Finish Lips, Nude Pink",4.50,unit,4.50,ea
Yardley London Body Fragrance Collection 3x75ml,4.00,unit,4.00,ea
Harry's Shave Cream 100ml,7.00,unit,7.00,100ml
Rimmel London Super Gel 043 Venus 12ml,5.00,unit,50.00,10g
L'Oreal Paris Color Riche Lipstick 303 Rose Tendre,7.00,unit,7.00,ea
L'Oreal Paris Excellence Permanent Hair Dye Lightest Pearl Blonde 10.21,7.00,unit,7.00,ea
Max Factor Creme Puff 13 Nouveau Beige 21g,9.00,unit,4.29,10g
Beautopia Metal Nail File,3.00,unit,3.00,ea
Happiness Nail Polish Set,4.00,unit,4.00,ea
Happy Naturals Moisture Lip Balms,4.00,unit,4.00,ea
Smith England Guardian Colour Shield Shampoo 250ml,8.00,unit,3.20,100ml
Rimmel London Nail Nurse 5 in 1 Nail Base & Top Coat 12ml,4.50,unit,4.50,ea
Burt's Bees Sensitive Cleansing Facial Wipes,4.50,unit,15p,ea
Rimmel London Waterproof Wonder'full Mascara with Argan Oil 001 Black 11ml,9.50,unit,9.50,ea
TRESemm Keratin Smth Conditioner 700ml,2.80,unit,40p,100ml
Dr. Pawpaw Tinted Peach Pink Balm 25ml,7.00,unit,28.00,100ml
Smith England Boost Lasting Volume Conditioner 250ml,8.00,unit,3.20,100ml
Seriously Good To... Satsuma Indulgence Collection,8.00,unit,8.00,ea
Phil Smith Be Gorgeous Root Touch Up Root Concealer Spray for Light Blonde Hair 75ml,6.00,unit,8.00,100ml
Feather & Down Sweet Dreams Melting Shower Cream 250ml,6.00,unit,3.00,100ml
Beautopia Cuticle Trimmer and Pusher,2.50,unit,2.50,ea
Rimmel London Moisture Renew Lipstick 180 Vintage Pink 4g,7.00,unit,7.00,ea
Noughty To the Rescue Intense Moisture Treatment 300ml,9.00,unit,3.00,100ml
L'Oreal Paris Superliner Eyeliner Black,7.00,unit,5.00,10g
Rimmel London Radiance Brick Multi-Tonal Shimmer Powder 001 Light 12g,7.00,unit,7.00,ea
Garnier Organic Lavandin Moisturiser 50ml,10.00,unit,4.83,100g
Phil Smith Be Gorgeous Get Snappy Mini Claw Clips,3.50,unit,58p,ea
Maybelline Color Sensational Matte Lipstick 930 Nude Embrace,5.00,unit,2.00,10g
Boutique Cuticle Nipper,3.00,unit,3.00,ea
L'Oreal Paris Brow Artist Xpert 105 Brunette,6.00,unit,6.00,ea
Max Factor All Day Flawless 3 in 1 Foundation Golden,14.00,unit,14.00,ea
Garnier Pure Active Anti Blackhead Charcoal Mask Peel Off,4.00,unit,4.00,ea
Eco Warrior Moisturising Hand & Body Bar Coconut Blend 100g,3.50,unit,3.50,100g
Sanctuary Spa Body Oil Spray 125ml,7.50,unit,6.00,100ml
Pantene Grow Strong Shampoo with Bamboo & Biotin 400ml,4.50,unit,1.13,100ml
Tresemme Botanique Nourish Natural Hold Hair Spray 250 ML,4.00,unit,1.60,100ml
Maui Moisture Body Care Calming & Frangipani Body Wash 577ml,6.00,unit,1.04,100ml
Paco Rabanne Lady Million Eau de Parfum Natural Spray 30ml,42.00,unit,140.00,100ml
L'Oreal Men Expert Vitalift Anti-Wrinkle Gel Moisturiser 50ml,8.00,unit,16.00,100ml
Rimmel Match Perfection Concealer Porcelain 7ml,7.00,unit,100.00,100ml
Schwarzkopf Live Intense Lightener & Lift Permanent Hair Dye Cool Rose 101,4.80,unit,4.80,ea
Boutique Moisturising Concealer Vanilla,3.00,unit,6.00,10ml
Beautopia Complete Brush Set,12.00,unit,12.00,ea
Dirty Works Bubble in Paradise Coconut Gift Set,6.00,unit,6.00,ea
L'Oreal Paris Mega Volume Miss Manga Mascara Black,8.00,unit,8.00,ea
Tresemme Botanique Nourish Curl Conditioning Mousse 200 ML,4.00,unit,2.00,100ml
Rimmel London Brow this Way Brow Styling Gel with Argan Oil 004 Clear 5ml,3.50,unit,3.50,ea
Maybelline The Falsies Instant Lash Lift Look Lengthening Volumising Mascara 01 Black,10.00,unit,10.00,ea
Method Sweet Water Refill Pouch 1L,6.00,unit,60p,100ml
Boutique Precision Eyeliner Pencil Black,2.00,unit,2.00,ea
L'Oreal Paris C'est Magic BB Cream 04 Medium,11.00,unit,28.21,100g
L'Oreal Paris Preference Permanent Hair Dye Mango Copper Red 74,6.00,unit,6.00,ea
Beautopia Sharpener,3.00,unit,3.00,ea
L'Oreal Paris Touche Magique Concealer Warm Beige,8.00,unit,8.00,ea
"Live Color Xxl Ultra Bright, Electric Blue 95",4.80,unit,4.80,ea
Garnier Ultimate Blends Smoothing Hair Food Coconut Conditioner for Frizzy Hair 350ml,3.00,unit,86p,100ml
Nip + Fab SPF 30 Post-Glycolic Fix Moisturiser 40ml,13.00,unit,32.50,100ml
Max Factor Brow Shaper 30 Deep Brown,9.00,unit,9.00,ea
Method Energy Boost Body Wash 532ml,6.00,unit,1.13,100ml
Boutique Cuticle Pusher & Cleaner,2.00,unit,2.00,ea
Happy Naturals Sea Minerals Body Polish,3.50,unit,1.17,100ml
Baylis & Harding The Fuzzy Duck Winter Wonderland Sloe Gin Bubble Bath Decanter,8.50,unit,8.50,ea
Boutique Nail Polish Base Coat 10ml,3.00,unit,3.00,10ml
Belle Moon Ultimate Pampering Collection,12.00,unit,12.00,ea
Eylure Naturalite Lashes 116,5.50,unit,5.50,ea
Maybelline SuperStay 24hr Dual Lipstick 725 Caramel Nude,10.00,unit,10.00,ea
Max Factor Brow Shaper 20 Brown,9.00,unit,9.00,ea
Sally Hansen Hard As Wraps,7.00,unit,7.00,ea
Seriously Good To... Satsuma Mini Treats,3.50,unit,3.50,ea
Hask Argan Oil from Morocco Repairing Conditioner 355ml,5.00,unit,1.41,100ml
Maybelline Dream Matte Mousse Foundation 048 Sun Beige,8.00,unit,8.00,ea
Phil Smith Little Smiths Mini Butterfly Clips,2.50,unit,1.25,ea
L'Oreal Paris True Match Blush 145 Rosewood,8.00,unit,8.00,ea
Marvel Spider-Man Magic Facecloth,2.00,unit,2.00,ea
Invisibobble Original 3 Pretzel Brown Hair Ties,5.00,unit,5.00,ea
Wilkinson Sword Quattro Titanium Sensitive Men's Disposable Razors x3,4.00,unit,1.33,bld
Sanctuary Spa Liquid Gold Bath Elixir 250ml,9.50,unit,3.80,100ml
Rimmel London Hide the Blemish Concealer 004 Natural Beige 4.5g,5.00,unit,5.00,ea
John Frieda Frizz Ease Dream Curls Deep Conditioner 150ml,5.00,unit,3.34,100ml
Olay Cleanse Detox & Glow Daily Polish 150ml,5.00,unit,3.33,100ml
L'Oreal Paris Infallible 24H Foundation 200 Golden Sand 30ml,11.00,unit,11.00,ea
Simple Daily Skin Detox SOS Clearing Booster 25ml,6.00,unit,24.00,100ml
Burt's Bees Sensitive Daily Cream,12.50,unit,25.00,100ml
Nip + Fab Glycolic Fix Serum 30ml,13.00,unit,43.34,100ml
Faith in Nature Grapefruit & Orange Conditioner 400ml,3.70,unit,93p,100ml
Boutique Bronzer Brick Latte 9g,4.00,unit,4.44,10g
Garnier SkinActive PureActive Intensive 3in1 Charcoal Anti-Blackhead 150ml,3.50,unit,2.33,100ml
Smith England Nourish Intensive Moisture Mask 200ml,8.00,unit,4.00,100ml
L'Oreal Paris Infallible 24H Foundation 120 Vanilla 30ml,11.00,unit,11.00,ea
Rimmel London Kate Super Gel 044 Rock N Sparkle 12ml,5.00,unit,1.06,10g
Maybelline Color Sensational MatteLipstick 975 Divine Wine,5.00,unit,1.39,10g
Philips OneBlade QP2520,37.50,unit,37.50,ea
Lynx Hydrate Mate Shower Gel 300ml,3.00,unit,1.00,100ml
Bulldog Skincare Original Moisturiser Cracker 100ml,4.00,unit,4p,ml
L'Oreal Men Expert Barber Club Messy Hair Clay 75ml,4.00,unit,5.33,100ml
Balance Me Radiance Face Oil 30ml,24.00,unit,80.00,100ml
Rimmel London Match Perfection SPF 20 010 Light Porcelain 30ml,9.00,unit,73p,10g
Boutique Flawless Hydrating Illuminating Primer 30ml,5.00,unit,1.67,10ml
Rimmel London Match Perfection SPF 20 103 True Ivory 30ml,9.00,unit,30.00,100ml
Cutex Care Hydrating Cuticle Oil 13.6ml,6.00,unit,40.00,100ml
Smith England Guardian Colour Shield Conditioner 250ml,8.00,unit,3.20,100ml
Sanctuary Spa Complexion Perfecting Radiance Exfoliator 15ml,5.00,unit,5.00,100ml
Disney Frozen II Colour Change Bath Fizzer 3+ 130g,2.50,unit,1.92,100g
L'Oreal Paris Brow Artist Xpert 102 Cool Blonde,6.00,unit,6.00,ea
Noughty Care Taker Scalp Soothing Shampoo 250ml,7.00,unit,2.80,100ml
Rimmel London Step-1 Super Gel 020 Urban Affair 12ml,5.00,unit,41.66,100ml
Sanctuary Spa Tempting Travel Treats,13.00,unit,13.00,ea
L'Oreal Paris Color Riche Lipstick 214 Violet Saturn,8.00,unit,8.00,ea
Garnier Olia Permanent No Ammonia Hair Dye Metallic Silver 9.11,6.00,unit,6.00,ea
Boutique Lip Liner Mocha,2.00,unit,2.00,ea
Dirty Works You Hottie! The Snuggle Up Set,9.00,unit,9.00,ea
L'Oreal Paris Revitalift Filler Renew Anti-Ageing Night Cream 50ml,14.00,unit,28.00,100ml
Maxf Facefinity Compact 03 Natural 10g,11.00,unit,11.00,10g
Tresemme Botanique Nourish Air Dry Curl Cream 200 ML,4.00,unit,2.00,100ml
"Childs Farm Hand Wash, Grapefruit And Tea Tree Oil 250ml",3.00,unit,1.20,100ml
Rimmel London 60 Seconds Super Shine Sea Nymph Nail Polish,3.50,unit,3.50,ea
Rimmel 60 Seconds Glitter Nail Polish Silver 8ml,3.50,unit,3.50,ea
L'Oreal Paris Revitalift Filler Renew Replumping Serum 16ml,14.00,unit,87.50,100ml
Dirty Works Goodnight Girl Unwind Set,7.00,unit,7.00,ea
Olay Cleanse Dry Skin Make-Up Melting Cleansing Milk 200ml,4.00,unit,2.00,100ml
Garnier Nutri Bomb Milky Face Sheet Mask Almond Milk & Hyaluronic Acid 28g,2.00,unit,2.00,ea
TRESemm Keratin Smooth Shampoo 700ml,2.80,unit,40p,100ml
Clairol Natural Instincts Semi-Permanent Hair Dye Medium Cool Blonde 8A,5.50,unit,5.50,ea
Max Factor Miracle Prep Pore Minimising + Mattifying Primer 30ml,11.00,unit,36.67,100ml
L'Oreal Paris True Match Foundation 5.N Sand 30ml,7.00,unit,7.00,ea
Cutex Care All-in-One Strengthener Nail Treatment 13.6ml,5.00,unit,33.33,100ml
Nivea Men Complete Collection Gift Set,13.00,unit,13.00,ea
L'Oreal Paris Color Riche Lipstick 376 Cassis Passion,8.00,unit,8.00,ea
L'Oreal Men Expert Barber Club Beard Hair Styling Cream 75ml,5.00,unit,6.67,100ml
L'Oreal Paris Men Expert Hydra Energetic Tissue Mask 30g,2.00,unit,2.00,ea
Heathcote & Ivory In The Garden Hand Cream & Moisturising Hand Sanitiser Gift Set,5.50,unit,5.50,ea
Schwarzkopf Live Intense Lightener & Lift Permanent Hair Dye Cool Lilac 104,4.80,unit,4.80,ea
E45 Dermatological Itch Relief Cream 500g,24.50,unit,4.90,100g
Vera Wang Eau de Parfum Spray 50ml,20.00,unit,40.00,100ml
Maybelline Dream Lumi Touch Concealer Pen 02 Nude,8.00,unit,8.00,ea
Pantene Hair Biology Mask Full & Vibrant 160ml,3.50,unit,2.19,100ml
Hask Argan Oil from Morocco Repairing Shampoo 355ml,5.00,unit,1.41,100ml
Sainsbury's Accessories Make-Up Brush,3.00,unit,3.00,ea
Boutique Brow Grooming Dual Brush,2.00,unit,2.00,ea
Boutique Make Up Bag,5.00,unit,5.00,ea
Rimmel London Kate Super Gel 071 Guilty Pleasure 12ml,5.00,unit,1.06,10g
Maybelline SuperStay 24hr Dual Lipstick 510 Red Passion,10.00,unit,10.00,ea
L'Oreal Paris True Match Powder N4 Beige,5.00,unit,5.00,ea
Harry's 2in1 Shampoo 414ml,8.00,unit,1.93,100ml
Heathcote & Ivory Sweet Pea & Honey Suckle Hand & Nail Cream Collection x3 30ml,5.00,unit,5.56,100ml
Maybelline SuperStay Pressed Powder 021 Nude,6.00,unit,10.00,100g
Garnier Olia Bold Permanent No Ammonia Hair Dye Intense Copper 7.40,6.00,unit,6.00,ea
