Description,Price/Unit,Unit,Price/Measure,Measure
Nivea Micellar Cleansing Face Wipes x25,2.00,unit,8p,wipe
Nivea MicellAIR Micellar Water for Sensitive Skin 400ml,3.00,unit,75p,100ml
Nivea Q10 Power Anti-Ageing Night Cream with Anti-Wrinkle Firming Power 50ml,5.50,unit,11.00,100ml
Simple Kind To Skin Cleansing Facial Wipes x25,2.00,unit,8p,wipe
Baylis & Harding Mosaic Mandarin & Grapefruit Handwash 500ml,1.50,unit,30p,100ml
Dove Original Beauty Cream Bar 2x100g,1.00,unit,50p,100g
Pears Transparent Bar Soap 125g,70p,unit,56p,100g
Palmolive Naturals Milk & Honey Handwash Soap 300ml,90p,unit,30p,100ml
Baylis & Harding Jasmin and Apple Blossom Antibacterial Handwash 500ml,1.50,unit,30p,100ml
Sainsbury's Fresh Faced Gentle Facial Wipes x25,90p,unit,4p,wipe
"Dove Beauty Cream Soap Handwash, Supreme Silk 250ml",1.00,unit,40p,100ml
Dove Beauty Cream Caring Hand Wash 250ml,1.00,unit,40p,100ml
Simple Bar Soap 4x125g,1.95,unit,39p,100g
Sainsbury's Double Faced Oval Cotton Pads x50,1.85,unit,4p,ea
L'Oreal Elvive Colour Protect Coloured Hair Shampoo 400ml,3.50,unit,88p,100ml
Novon Paper Stemmed Cotton Buds x200,55p,unit,0p,ea
Nivea Gentle Cleansing Face Wipes x25,1.50,unit,6p,wipe
"Johnson's Make Up Be Gone Facial Wipes, Refreshing x25",1.50,unit,6p,wipe
Sainsbury's Bath Sponge,50p,unit,50p,ea
Head & Shoulders Classic Clean Anti-Dandruff Shampoo 500ml,3.50,unit,70p,100ml
Herbal Essences Dazzling Shine Shampoo 400ml,2.00,unit,50p,100ml
Simple Kind to Skin Moisturising Handwash 250ml,1.00,unit,40p,100ml
L'Oreal Elvive Colour Protect Coloured Hair Conditioner 400ml,3.50,unit,88p,100ml
"TRESemm Moisture Rich, Luxurious Moisture Hair Shampoo 900ml",2.95,unit,33p,100ml
Dove Original Beauty Cream Bar 6x100g,2.50,unit,42p,100g
"TRESemm Moisture Rich, Luxurious Moisture Hair Conditioner 900ml",2.95,unit,33p,100ml
"Lynx Body Spray Deodorant, Africa 150ml",3.00,unit,2.00,100ml
Baylis & Harding Jojoba Handwash 500ml,1.50,unit,30p,100ml
Palmolive Naturals Almond Handwash Soap 300ml,90p,unit,30p,100ml
Gillette Sensitive Skin Shaving Gel 200ml,1.75,unit,88p,100ml
Palmolive Naturals Moisture Care With Olive Soap Bar 3x90g,1.00,unit,37p,100g
Aussie Miracle Moist Shampoo 300ml,2.65,unit,88p,100ml
Gillette Sensitive Skin Shaving Foam 200ml,1.50,unit,75p,100ml
Dove Original Beauty Cream Bar 4x100g,2.00,unit,50p,100g
Simple Cleansing Wipes Banded Pack 2x25,3.00,unit,6p,wipe
Aussie Miracle Moist Conditioner 250ml,2.65,unit,1.06,100ml
Wet Ones Be Fresh Antibacterial Hand Wipes x12 Wipes,1.00,unit,8.33,100sht
Palmolive Hygiene Plus Aloe Sensitive Antibacterial Liquid Handwash Soap 300ml,90p,unit,30p,100ml
Head & Shoulders Classic Clean Anti-Dandruff Shampoo 250ml,2.75,unit,1.10,100ml
Wash & Go 2 in 1 Universal Shampoo 200ml,1.00,unit,50p,100ml
Herbal Essences Hello Hydration Shampoo 400ml,2.00,unit,50p,100ml
Silvikrin Classic Hairspray Maximum Hold 400ml,3.00,unit,75p,100ml
"Sainsbury's Collection Handwash, Bergamot & Nectarine 500ml",1.30,unit,26p,100ml
Baylis & Harding Black Pepper & Ginseng Handwash 500ml,1.50,unit,30p,100ml
Head & Shoulders Classic Clean Anti-Dandruff 2 in 1 Shampoo 450ml,4.50,unit,1.00,100ml
Gillette Fusion Sensitive Skin Shaving Gel 200ml,3.00,unit,1.50,100ml
Nivea Refreshing Cleansing Face Wipes x25,1.50,unit,6p,wipe
Wet Ones Be Zingy Antibacterial Hand Wipes x12 Wipes,1.00,unit,8.33,100sht
Wright's Coal Tar Bar Soap 125g,80p,unit,64p,100g
Carex Fun Edition Love Hearts Handwash 250ml,1.00,unit,40p,100ml
Pears Handwash 250ml,2.00,unit,80p,100ml
Imperial Leather Gentle Care Bar Soap 4x100g,1.75,unit,44p,100g
L'Oreal Elvive Fibrology Fine Hair Thickening Shampoo 400ml,3.50,unit,88p,100ml
Herbal Essences Dazzling Shine Conditioner 400ml,2.00,unit,50p,100ml
Sainsbury's Double Faced Round Cotton Wool Pads x100,1.75,unit,2p,ea
"Impulse Body Spray, Tease 75ml",1.00,unit,1.33,100ml
Sainsbury's Apple Shampoo 500ml,75p,unit,15p,100ml
Pears Oil Clear Soap 125g,70p,unit,56p,100g
Dove Daily Moisture Shampoo 400ml,2.00,unit,50p,100ml
"TRESemm Cleanse & Renew, Deep Cleansing Hair Shampoo 900ml",2.95,unit,33p,100ml
Herbal Essences Ignite My Colour Shampoo 400ml,2.00,unit,50p,100ml
Simple Kind To Skin Moisturising Facial Wash 150ml,3.00,unit,2.00,100ml
Radox Bath Therapy Muscle Soak Herbal Bath Salts 400g,1.00,unit,25p,100g
"Nivea Lip Balm, Original Care 4.8g",1.25,unit,26.04,100g
"Sainsbury's Ladies Shave Gel, Sensitive 200ml",1.00,unit,50p,100ml
"Impulse Body Spray, True Love 75ml",1.00,unit,1.33,100ml
Herbal Essences Hello Hydration Conditioner 400ml,2.00,unit,50p,100ml
Gillette Blue II Plus Slalom Disposable Razors x8,3.50,unit,44p,bld
Men Advance Sensitive Shave Gel 200ml,1.00,unit,50p,100ml
Batiste Original Dry Shampoo 200ml,2.25,unit,1.13,100ml
"Dove Purely Pampering Beauty Bar, Shea Butter 2x100g",1.00,unit,50p,100g
Sainsbury's Classic Clean Anti-Dandruff Shampoo 300ml,1.00,unit,33p,100ml
"Sainsbury's Collection Handwash, Fig & Jasmine 500ml",1.30,unit,26p,100ml
Clean & Clear Facial Wash 150ml,3.00,unit,2.00,100ml
Sainsbury's Massage Sponge,1.00,unit,1.00,ea
"Alberto Balsam Hair Shampoo, Sunkissed Raspberry 350ml",1.00,unit,29p,100ml
Alberto Balsam Sunkissed Raspberry Hair Conditioner 350ml,1.00,unit,29p,100ml
Simple Kind To Eyes Eye Makeup Remover 125ml,3.00,unit,2.40,100ml
Wilkinson Sword Extra II Razor for Women x5,1.25,unit,25p,ea
"Impulse Body Spray, Hint of Musk 75ml",1.00,unit,1.33,100ml
Vosene Medicated Original Anti-Dandruff Shampoo 250ml,2.00,unit,80p,100ml
Gillette Mach 3 Razor Blades x4,8.50,unit,2.13,bld
Nivea Men Sensitive Shave Gel with 0 % Alcohol 200ml,2.00,unit,1.00,100ml
L'Oreal Elvive Colour Protect Coloured Hair Shampoo 250ml,2.00,unit,80p,100ml
Sainsbury's Fairtrade Cottonwool Pads x100,1.85,unit,2p,ea
L'Oreal Paris Age Perfect Cleansing Wipes x25,4.75,unit,19p,wipe
Silvikrin Classic Hairspray Firm Hold 400ml,3.00,unit,75p,100ml
Sainsbury's Classic Clean Anti-Dandruff 2 in 1 Shampoo 300ml,1.00,unit,33p,100ml
Gillette Fusion Razor Blades x4,11.50,unit,2.88,bld
Herbal Essences Ignite My Colour Conditioner 400ml,2.00,unit,50p,100ml
Aussie Mega Instant Shampoo 300ml,2.65,unit,88p,100ml
Aussie 3 Minute Miracle Reconstructor Conditioner 250ml,3.30,unit,1.32,100ml
"Method Handwash, Botanical Garden 354ml",2.50,unit,71p,100ml
Sainsbury's Coconut Shampoo 500ml,75p,unit,15p,100ml
"Lynx Body Spray Deodorant, Dark Temptation 150ml",3.00,unit,2.00,100ml
Batiste Blush Floral & Flirty Dry Shampoo 200ml,2.25,unit,1.13,100ml
L'Oreal Elvive Fibrology Fine Hair Conditioner 400ml,3.50,unit,88p,100ml
Gillette Venus Sensitive Skin Shave Gel 200ml,2.50,unit,1.25,100ml
"TRESemm Colour Revitalise Colour, Fade Protection Hair Shampoo 900ml",2.95,unit,33p,100ml
"Impulse Body Spray, Very Pink 75ml",1.00,unit,1.33,100ml
Gillette Series Sensitive Shaving Gel 200ml,1.50,unit,75p,100ml
Alberto Balsam Coconut & Lychee Hair Shampoo 350ml,1.00,unit,29p,100ml
Simple Kind To Skin Hydrating Light Moisturiser 125ml,3.00,unit,2.40,100ml
Method Sweet Water Gel Handwash 354ml,2.50,unit,71p,100ml
"TRESemm Colour Revitalise, Colour Fade Protection Hair Conditioner 900ml",2.95,unit,33p,100ml
Nivea Cleansing Face Wipes for Sensitive Skin x25,1.50,unit,6p,wipe
L'Oreal Elvive Colour Protect Coloured Hair Conditioner 250ml,2.00,unit,80p,100ml
Imperial Leather Meadow Honey & Shea Butter Handwash 300ml,90p,unit,30p,100ml
Imperial Leather Cotton Clouds Moisturising Handwash 300ml,90p,unit,30p,100ml
Sainsbury's Nail Polish Remover 250ml,1.25,unit,50p,100ml
Head & Shoulders Classic Clean Anti-Dandruff 2 in 1 Shampoo 225ml,2.75,unit,1.22,100ml
Carex Advanced Protect Moisturising Antibacterial Hand Wash 500ml,2.25,unit,45p,100ml
Sainsbury's Coconut Conditioner 500ml,75p,unit,15p,100ml
"Nivea Refreshingly Soft Moisturising Cream for Face, Hands & Body 75ml",2.25,unit,3.00,100ml
Alberto Balsam Coconut & Lychee Hair Conditioner 350ml,1.00,unit,29p,100ml
Alberto Balsam Juicy Green Apple Hair Shampoo 350ml,1.00,unit,29p,100ml
Cussons Mild Cream Bar Soap 4x90g,1.00,unit,28p,100g
Sainsbury's Mens Sensitive Shave Foam 250ml,95p,unit,38p,100ml
Head & Shoulders Itchy Scalp & Anti-Dandruff Shampoo 500ml,3.50,unit,70p,100ml
E45 Moisturising Lotion 500ml,5.00,unit,1.00,100ml
Imperial Leather Sensitive Botanical Garden 300ml,90p,unit,30p,100ml
"Adidas Body Spray, Ice Dive 150ml",1.80,unit,1.20,100ml
Gillette Venus Simply 2 Disposable Razors x8,3.00,unit,38p,ea
Dove Daily Moisture Conditioner 350ml,2.00,unit,57p,100ml
Nivea Eye Make-Up Remover Double Effect 125ml,3.00,unit,2.40,100ml
Carex Dermacare Moisture Eco Refill Antibacterial Hand Wash 1L,2.85,unit,29p,100ml
Nivea Men Sensitive Shave Foam with 0% Alcohol 200ml,2.00,unit,1.00,100ml
"Bic 2 Blade Disposable Razor, Sensitive Skin x10",2.00,unit,20p,bld
"Impulse Bodyspray Deodorant, Be Suprised 75ml",1.00,unit,1.33,100ml
"Sainsbury's Collection Handwash, Rose & Peony 500ml",1.30,unit,26p,100ml
Aussie Aussome Volume Shampoo 300ml,2.65,unit,88p,100ml
Simple Kind To Skin Refreshing Facial Wash Gel 150ml,3.00,unit,2.00,100ml
Sainsbury's Face Cloth,1.00,unit,1.00,ea
Gillette Venus Razor Blades x4,9.00,unit,2.25,bld
Nivea Soap Bar Soft 2x100g,1.00,unit,50p,100g
Gillette Venus Oceana Disposable Razors x3,3.50,unit,1.16,ea
"Lynx Body Spray Deodorant, Attract for Him 150ml",3.00,unit,2.00,100ml
Gillette Mach 3 Razor Blades x8,15.00,unit,1.88,bld
L'Oreal Elvive Extraordinary Oil Dry Hair Conditioner 400ml,3.50,unit,88p,100ml
Aussie Mega Instant Hair Conditioner 250ml,2.65,unit,1.06,100ml
Alberto Balsam Ultra Strong Styling Gel 200ml,1.00,unit,50p,100ml
Aveeno Daily Moisturising Lotion 300ml,7.00,unit,2.33,100ml
Head & Shoulders Citrus Fresh Anti-Dandruff Shampoo 500ml,3.50,unit,70p,100ml
Clean & Clear Cleansing Lotion 200ml,3.00,unit,1.50,100ml
Simple Kind To Skin Replenishing Rich Moisturiser 125ml,3.00,unit,2.40,100ml
Simple Kind To Eyes Eye Makeup Remover Pads x30,4.00,unit,13p,ea
TRESemm Remoisturising Hair Conditioner 900ml,2.95,unit,33p,100ml
"Neutrogena Norwegian Formula Hand Cream, Unscented 50ml",2.50,unit,5.00,100ml
L'Oreal Elvive Extraordinary Oil Dry Hair Shampoo 400ml,3.50,unit,88p,100ml
L'Oreal Elvive Full Restore 5 Damaged Hair Shampoo 400ml,3.50,unit,88p,100ml
Head & Shoulders Apple Anti-Dandruff Shampoo 500ml,3.50,unit,70p,100ml
"Wilkinson Sword Razor Blades, Extra II, Sensitive x10",2.00,unit,20p,bld
Simple Kind To Skin Soothing Facial Toner 200ml,3.00,unit,1.50,100ml
Nivea Refreshing Face Wash Gel 150ml,3.00,unit,2.00,100ml
Simple Kind To Skin Purifying Cleansing Lotion 200ml,3.00,unit,1.50,100ml
Aussie Miracle Moist Conditioner 400ml,5.50,unit,1.38,100ml
Garnier Micellar Water Sensitive Skin 400ml,3.00,unit,75p,100ml
Sainsbury's Extra Strength Nail Polish Remover 250ml,1.50,unit,60p,100ml
Wella Shockwaves Ultra Strong Power Hold Hairspray 250ml,2.75,unit,1.10,100ml
Herbal Essences Bee Strong Shampoo 400ml,2.00,unit,50p,100ml
Herbal Essences Bio:Renew Shampoo 400ml Argan Oil of Morocco,3.00,unit,75p,100ml
John Frieda Brilliant Brunette Moisturising Shampoo 250ml,4.00,unit,1.60,100ml
L'Oreal Elnett Normal Strength Hairspray 200ml,3.00,unit,1.50,100ml
Sainsbury's Apple Conditioner 500ml,75p,unit,15p,100ml
Imperial Leather Foamburst Unicorn Marshmallow 200ml,2.00,unit,1.00,100ml
Aveeno Intensive Relief Hand Cream 75ml,5.00,unit,6.67,100ml
Dove Intensive Repair Conditioner 350ml,2.00,unit,57p,100ml
Gillette Venus Spa Breeze Razor Blades x4,11.50,unit,2.88,ea
L'Oreal Elnett Extra Strength Hairspray 400ml,6.75,unit,1.69,100ml
Vaseline Original Petroleum Jelly 50ml,1.50,unit,3.00,100ml
Bic Twin Lady x5,1.50,unit,30p,bld
Neutrogena T/Gel Therapeutic Shampoo 250ml,3.00,unit,75p,ea
Gillette Venus Simply 3 Disposable Razor x4,3.00,unit,75p,ea
Herbal Essences Bio:Renew Conditioner 400ml Argan Oil of Morocco,3.00,unit,75p,100ml
Carex Advanced Protect Marine Antibacterial Hand Wash 500ml,2.25,unit,45p,100ml
John Frieda Brilliant Brunette Moisturising Conditioner 250ml,4.00,unit,1.60,100ml
Aussie Miracle Moist Shampoo 500ml,5.50,unit,1.10,100ml
Batiste Cherry Dry Shampoo 200ml,2.25,unit,1.13,100ml
Nivea Face Cream Light Moisturiser for Normal & Combination Skin 50ml,4.00,unit,8.00,100ml
Alpecin C1 Caffeine Shampoo 250ml,6.00,unit,2.40,100ml
E45 Cream 125g,4.00,unit,3.20,100g
John Frieda Luxurious Volume Thickening Shampoo 250ml,4.00,unit,1.60,100ml
Dove Intensive Repair Shampoo 400ml,2.00,unit,50p,100ml
Sainsbury's Eye Makeup Remover Pads x30,1.50,unit,5p,wipe
Head & Shoulders Smooth & Silky Anti-Dandruff Shampoo 500ml,3.50,unit,70p,100ml
Carex Fun Edition Unicorn Antibacterial Hand Wash 250ml,1.00,unit,40p,100ml
Harmony Extra Firm Hairspray 300ml,2.00,unit,67p,100ml
Silvikrin Classic Hairspray Natural Hold 400ml,3.00,unit,75p,100ml
"Nivea Body Lotion for Dry Skin, Rich Nourishing 400ml",5.00,unit,1.25,100ml
Baylis & Harding Limited Edition Bottle of Hope Hand Wash 500ml,1.50,unit,30p,100ml
L'Oreal Elvive Full Restore 5 Damaged Hair Conditioner 400ml,3.50,unit,88p,100ml
Herbal Essences Bee Strong Conditioner 400ml,2.00,unit,50p,100ml
Men Advance Impact Bodyspray 150ml,85p,unit,57p,100ml
Aussie Aussome Volume Conditioner 250ml,2.65,unit,1.06,100ml
Gillette Blue II Disposable Razors x10,3.50,unit,35p,bld
Neutrogena T/Gel Therapeutic Shampoo 125ml,4.00,unit,3.20,100ml
Sainsbury's Tea Tree 2 In 1 500ml,75p,unit,15p,100ml
"Vaseline Hand Cream, Healthy Hands + Stronger Nails 75ml",2.00,unit,2.67,100ml
Aussie Miracle Recharge Hair Insurance Leave In Conditioner 250ml,3.30,unit,1.32,100ml
L'Oreal Elvive Fibrology Fine Hair Thickening Shampoo 250ml,2.00,unit,80p,100ml
Batiste Tropical Dry Shampoo 200ml,2.25,unit,1.13,100ml
"Bic Disposable Razor, Sensitive x20",2.00,unit,10p,bld
St Ives Blemish Fighting Apricot Scrub 150ml,3.00,unit,2.00,100ml
Gillette Fusion Proglide Razor Blades x4,13.50,unit,3.38,bld
"Nivea Creme All Purpose Body Cream for face, hands and body 200ml",2.75,unit,1.38,100ml
Gillette Venus Satin Care Shaving Gel With A Touch Of Olay 200ml,2.00,unit,1.00,100ml
Carex Advanced Care Macadamia Oil Antibacterial Hand Wash 500ml,2.25,unit,45p,100ml
L'Oreal Elnett Normal Strength Hairspray 400ml,6.75,unit,1.69,100ml
"Nivea Soft Moisturising Cream for face, hands and body 200ml",3.75,unit,1.88,100ml
"Lynx Body Spray, Excite 150ml",3.00,unit,2.00,100ml
Nivea Men Sensitive Face Moisturiser with 0% Alcohol 75ml,3.00,unit,4.00,100ml
Aveeno Daily Moisturising Lotion 200ml,5.50,unit,2.75,100ml
John Frieda Frizz Ease Flawlessly Straight Conditioner 250ml,4.00,unit,1.60,100ml
"Method Gel Handwash, French Lavender 354ml",2.50,unit,71p,100ml
Nivea Eye Make-Up Remover Extra Gentle 125ml,3.00,unit,2.40,100ml
Head & Shoulders Apple Anti-Dandruff 2 in 1 Shampoo 450ml,4.50,unit,1.00,100ml
Palmer's Cocoa Butter Lotion 250ml,4.30,unit,1.72,100ml
Head & Shoulders Citrus Fresh Anti-Dandruff Shampoo 250ml,2.75,unit,1.10,100ml
John Frieda Frizz Ease Curl Around Conditioner 250ml,4.00,unit,1.60,100ml
John Frieda Sheer Blonde Go Blonder Shampoo 250ml,5.00,unit,2.00,100ml
Garnier Ultimate Blends Honey Strengthening Shampoo 360ml,2.00,unit,56p,100ml
Gillette Fusion Razor Blades x8,15.00,unit,1.88,bld
E45 Dermatological Cream for Dry Skin 50g,3.00,unit,6.00,100g
Old Spice Deodorant Spray 150ml,2.00,unit,1.33,100ml
Nivea Men Rehydrating Face Moisturiser Protect & Care 75ml,3.00,unit,4.00,100ml
Wella Shockwaves Ultra Strong Power Volume Mousse 200ml,3.00,unit,1.50,100ml
Olay Anti-Wrinkle Moisturiser Day Cream SPF15 50ml,6.00,unit,12.00,100ml
"Beckham Body Spray, Homme 150ml",2.50,unit,1.67,100ml
"Sainsbury's Ladies Shave Gel, Moisture 200ml",1.10,unit,55p,100ml
L'Oreal Elnett Extra Strength Hairspray 200ml,3.00,unit,1.50,100ml
Johnson's Face Care MakeUp Be Gone Extra-Sensitive Wipes 25 Wipes,1.50,unit,6p,wipe
L'Oreal Paris Gentle Make-Up Remover Eye 125ml,2.50,unit,2.00,100ml
Garnier Body Intensive 7 Days Shea UltraReplenishing Lotion 400ml,3.00,unit,75p,100ml
L'Oreal Elvive Styliste Weak Hair Mousse 200ml Full Restore 5,2.00,unit,1.00,100ml
"Method Gel Handwash, Pink Grapefruit 354ml",2.50,unit,71p,100ml
TRESemm Protect Heat Defence Hair Styling Spray 300ml,3.00,unit,1.00,100ml
L'Oreal Elvive Styliste Volume Flat Hair Mousse 200ml,2.00,unit,1.00,100ml
Gillette Sensor 3 Disposable Razors x4,4.50,unit,1.13,bld
Nivea Men Deep Cleaning Face Wash Protect & Care 150ml,2.00,unit,2.00,100ml
John Frieda Frizz Ease Flawlessly Straight Shampoo 250ml,4.00,unit,1.60,100ml
"Vaseline Lip Therapy, Original 20g",1.00,unit,5.00,100g
John Frieda Frizz Ease Extra Strength Serum 50ml,5.00,unit,10.00,100ml
VO5 Extreme Style Matt Hair Clay 75ml,4.00,unit,5.33,100ml
Wilkinson Sword Xtreme III Beauty x4,2.00,unit,50p,ea
Wilkinson Sword Quattro For Women 3 Blades,6.00,unit,2.00,unit
Men Advance Energy Body Spray 150ml,85p,unit,57p,100ml
Head & Shoulders Citrus Fresh Anti-Dandruff 2 in 1 Shampoo 450ml,4.50,unit,1.00,100ml
John Frieda Sheer Light Blondes Highlight Activating Conditioner 250ml,4.00,unit,1.60,100ml
John Frieda Luxurious Volume Conditioner 250ml,4.00,unit,1.60,100ml
Aussie Mega Instant Shampoo 500ml,5.50,unit,1.10,100ml
Nivea Body Lotion for Dry Skin Express Hydration 400ml,5.00,unit,1.25,100ml
"King Of Shaves Alpha Shave Gel, Antibactieral 150ml",2.50,unit,1.66,100ml
VO5 Mega Hold Gel Spray 200ml,3.00,unit,1.50,100ml
Palmer's Cocoa Butter Lip Balm,1.75,unit,43.75,100g
Schwarzkopf got2b Glued Blast Freeze Hairspray 300ml,3.30,unit,1.10,100ml
The Collection Muscle Relax Bath Soak 500ml,90p,unit,18p,100ml
"Neutrogena Norwegian Formula Hand Cream, Scented 50ml",2.50,unit,5.00,100ml
John Frieda Sheer Light Blondes Highlight Activating Shampoo 250ml,4.00,unit,1.60,100ml
Nivea Men Sensitive Post Shave Balm with 0% Alcohol 100ml,3.00,unit,3.00,100ml
Palmer's Coca Butter Lotion 400ml,6.00,unit,1.50,100ml
Nivea Men Shaving Protect & Care Moisturising Shave Gel 200ml,2.00,unit,1.00,100ml
Head & Shoulders Apple Anti-Dandruff Shampoo 250ml,2.75,unit,1.10,100ml
"Method Foam Handwash, Green Tea & Aloe, 300ml",3.00,unit,1.00,100ml
L'Oreal Elvive Clay Oily Roots Shampoo 400ml,3.50,unit,88p,100ml
Wella Shockwaves Heat Defying Curl Mousse 200ml,2.75,unit,1.38,100ml
Dirty Works Multi Tasking 4 in 1 Wipes x25,1.50,unit,6p,wipe
Bic Miss Soleil Razors x4,2.00,unit,50p,bld
Aveeno Skin Relief Moisturising Lotion 200ml,6.00,unit,3.00,100ml
Clean & Clear Deep Action Cream Wash 150ml,3.00,unit,2.00,100ml
"Nivea Body Lotion for Dry Skin, Extra Rich Moisturising 250ml",2.40,unit,96p,100ml
Garnier Ultimate Blends Honey Strengthening Conditioner 360ml,2.00,unit,56p,100ml
Sainsbury's Emery Board x10,1.25,unit,13p,ea
Palmer's Cocoa Butter Hand Cream 60g,1.75,unit,2.92,100g
Gillette Sensor Excel Razor Blades x10,12.00,unit,1.20,bld
Aveeno Skin Relief Moisturising Lotion 300ml,8.00,unit,2.67,100ml
John Frieda Sheer Blonde Go Blonder Conditioner 250ml,5.00,unit,2.00,100ml
St Ives Invigorating Apricot Scrub 150ml,3.00,unit,2.00,100ml
Sanex Dermo Moisturising Shower Gel 450ml,2.00,unit,44p,100ml
Clairol Root Touch Up Hair Dye Medium Brown 5,6.50,unit,6.50,ea
John Frieda Frizz Ease Curl Reviver Mousse 200ml,4.00,unit,2.00,100ml
Dove Coconut Oil Shower Mousse 200ml,3.00,unit,1.50,100ml
John Frieda Frizz Ease Moisture Barrier Firm Hold Hairspray 250ml,4.00,unit,1.60,100ml
Dove Pampering Body Wash 225ml,1.00,unit,44p,100ml
Pantene Pro-V Classic Clean Shampoo For Normal To Mixed Hair 500ml,3.50,unit,70p,100ml
Sainsbury's Purifying Tea Tree Cleansing Wipes,90p,unit,4p,wipe
VO5 Extreme Style ReWork Putty 150ml,3.00,unit,2.00,100ml
"Atrixo Hand Cream, Intensive Protection 200ml",4.00,unit,2.00,100ml
Cutex Moisture Guard Nail Polish Remover 200ml,2.00,unit,1.00,100ml
"Lynx Body Spray, Black 150ml",3.00,unit,2.00,100ml
"Beckham Body Spray, Instinct 150ml",2.50,unit,1.67,100ml
Gillette Blue 3 Dispsable Razors x8,6.00,unit,75p,bld
"Veet Hair Removal Cream, Sensitive 200ml",8.00,unit,4.00,100ml
Gillette Series Sensitive Skin Shaving Foam 250ml,1.50,unit,60p,100ml
"Little Soap Company Organic Bar Soap, English Lavender & Citrus 110g",2.50,unit,2.27,100g
Nivea Men Sensitive Face Wash with 0% Alcohol 100ml,2.00,unit,2.00,100ml
Clairol Root Touch Up Hair Dye Dark Brown 4,6.50,unit,6.50,ea
Nivea 2-in-1 Cleanser & Toner 200ml,3.00,unit,1.50,100ml
L'Oreal Elvive Dream Lengths Long Hair Shampoo 400ml,3.50,unit,88p,100ml
L'Oreal Elnett Normal Strength Hairspray 75ml,2.00,unit,2.66,100ml
L'Oreal Elvive Fibrology Fine Hair Conditioner 250ml,2.00,unit,80p,100ml
Purify Micellar Cleansing Wipes,1.25,unit,5p,wipe
Ogx Renew Argan Oil Of Morocco Shampoo 385ml,3.50,unit,91p,100ml
L'Oreal Elvive Dream Lengths Long Hair Conditioner 400ml,3.50,unit,88p,100ml
Olay Anti-Wrinkle Firm & Lift Moisturiser Night Cream 50ml,6.00,unit,12.00,100ml
Pantene Pro-V Classic Clean 3in1 Shampoo Conditioner Treatment For Normal To Mixed Hair 450ml,3.50,unit,78p,100ml
Wella Shockwaves Tuff Stuff Gel 200ml,2.75,unit,1.38,100ml
"Veet Ready To Use Wax Strips, Sensitive x20",6.00,unit,30p,ea
L'Oreal Men Expert Hydra Energetic Anti-Fatigue Moisturiser 50ml,5.00,unit,10.00,100ml
Garnier Skin Naturals 2 In 1 Eye Make-Up Remover 125ml,2.00,unit,1.60,100ml
L'Oreal Elnett Extra Strength Hairspray 75ml,2.00,unit,2.66,100ml
Neutrogena Norwegian Formula Deep Moisture Fast Absorbing Body Lotion 400ml,3.50,unit,88p,100ml
"Phil Smith Be Gorgeous Conditioner, Cocolicious 350ml",3.50,unit,1.40,100ml
Phil Smith Be Gorgeous Bombshell Blonde Conditioner 250ml,3.50,unit,1.40,100ml
Herbal Essences Bio:Renew Shampoo 400ml Coconut Milk Hydrate,3.00,unit,75p,100ml
Dove Essential Nourishing Lotion 400ml,3.00,unit,75p,100ml
Neutrogena T/Gel Shampoo Sensitive Scalp 125ml,4.00,unit,3.20,100ml
"Vaseline Lip Therapy, Aloe 20g",1.00,unit,5.00,100g
VO5 Mega Hold Styling Mousse 200ml,3.00,unit,1.50,100ml
TRESemm Salon Finish Freeze Hold Hairspray 100ml,1.80,unit,1.80,100ml
VO5 Extreme Style Texturising Gum 75ml,3.00,unit,4.00,100ml
Nivea Lip Balm Soothe & Protect SPF15 For Dry Lips 4.8g,2.25,unit,46.88,100g
Wilkinson Sword Intuition Sensitive Blades x3,9.00,unit,3.00,ea
E45 Itch Relief Cream 50g,4.00,unit,8.00,100g
Wilkinson Sword Xtreme III Razor x8,6.00,unit,75p,bld
Wilkinson Sword Xtreme III x4,2.00,unit,50p,bld
Clean & Clear Blackhead Clearing Scrub,4.00,unit,2.76,100ml
Ramer Cascade Shower Sponge x1 (colour varies),2.00,unit,2.00,ea
John Frieda Frizz Ease Original Serum 50ml,5.00,unit,10.00,100ml
"Nivea Body Lotion, Light Moisturising & Cleansing 250ml",2.40,unit,96p,100ml
Ogx Renew Argan Oil Of Morocco Conditioner 385ml,3.50,unit,91p,100ml
Sainsbury's Nail Polish Remover Pads x15,1.00,unit,7p,ea
Bulldog Moisturiser 100ml,4.00,unit,4.00,100ml
Gillette Fusion Power Razor Blades x4,13.50,unit,3.38,bld
"Elegant Touch Emery Boards, Professional",1.50,unit,1.50,ea
Nivea Gentle Exfoliating Face Scrub 150ml,3.50,unit,2.33,100ml
Garnier Body Intensive Restoring Hand Cream 100ml,4.00,unit,4.00,100ml
Clearasil Ultra Treatment Pads x65,3.50,unit,5p,ea
Impulse Instant Crush Body Spray 75ml,1.00,unit,1.33,100ml
L'Oreal Elvive Clay Oily Roots Conditioner 400ml,3.50,unit,88p,100ml
Herbal Essences Bio:Renew Conditioner 400ml Coconut Milk Hydrate,3.00,unit,75p,100ml
VO5 Styling Wax 75ml,3.00,unit,4.00,100ml
Batiste Medium & Brunette Dry Shampoo 200ml,3.00,unit,1.50,100ml
E45 Dermatological Moisturising Lotion 200ml,4.50,unit,2.25,100ml
"Atrixo Hand Cream, Enriched Moisturising 200ml",4.00,unit,2.00,100ml
Aussie Mega Instant Conditioner 400ml,5.50,unit,1.38,100ml
Sanex Zero% Sensitive Skin Shower Gel 500ml,2.00,unit,40p,100ml
L'Oreal Elnett Supreme Hold Hairspray 400ml,6.75,unit,1.69,100ml
Neutrogena Refreshingly Clear Daily Exfoliator 150ml,4.00,unit,2.67,100ml
"Phil Smith Be Gorgeous Shampoo, Bombshell Blonde 350ml",3.50,unit,1.00,100ml
Garnier Ultimate Blends Coconut Oil Frizzy Vegan Hair Conditioner 360ml,2.00,unit,56p,100ml
"Phil Smith Be Gorgeous Shampoo, Cocolicious 350ml",3.50,unit,1.00,100ml
Olay Beauty Fluid Sensitive Moisturiser 200ml,6.00,unit,3.00,100ml
L'Oreal Elnett Flexible Hold Hairspray 400ml,6.75,unit,1.69,100ml
Clearasil Ultra Treatment Wash 150ml,4.00,unit,2.67,100ml
Sainsbury's Acetone Free Nail Polish Remover 250ml,1.50,unit,60p,100ml
Olay Anti-Wrinkle 2 in 1 Moisturiser Day Cream & Serum 50ml,6.00,unit,12.00,100ml
Simple Kind To Skin Soothing Facial Scrub 75ml,3.00,unit,4.00,100ml
Gillette Sensor 3 Disposable Razors x8,5.00,unit,63p,bld
"Veet Ready To Use Wax Strips, Normal x20",7.00,unit,35p,ea
Gillette Blue II Disposable Razors x20,5.50,unit,28p,bld
Sainsbury's Moisture Cream Bar Soap 100g,60p,unit,60p,100g
Aussie 3 Minute Miracle Colour Conditioner 250ml,3.30,unit,1.32,100ml
Simple Regeneration Age Resisting Facial Wash 150ml,4.00,unit,2.67,100ml
Simple Gentle Care Shampoo 400ml,3.00,unit,75p,100ml
L'Oreal Expert Hydra Sensitive Shower Gel 300ml,1.50,unit,50p,100ml
John Frieda Frizz Ease Miraculous Recovery Masque 150ml,5.00,unit,3.34,100ml
Garnier Ultimate Blends Coconut Oil Frizzy Vegan Hair Shampoo 360ml,2.00,unit,56p,100ml
"Vaseline Unfragranced Hand Cream, Intensive Rescue 50ml",2.50,unit,5.00,100ml
Ogx Nourish Coconut Milk Shampoo 385ml,3.50,unit,91p,100ml
Nivea Oil Free Face Cream  Moisturiser for Oily & Combination Skin 50ml,2.50,unit,5.00,100ml
Carex Mr Men And Little Miss Sherbet Lemon Hand Wash Antibacterial 250ml,1.00,unit,40p,100ml
Witch Skin Care Stick 10g,2.50,unit,25.00,100g
