Description,Price/Unit,Unit,Price/Measure,Measure
Sainsbury's Fairtrade Bananas Loose,73p,kg,73p,kg
Sainsbury's Carrots Loose,41p,kg,41p,kg
Sainsbury's British Semi Skimmed Milk 2.27L (4 pint),1.10,unit,48p,ltr
Sainsbury's Fairtrade Bananas x5,80p,unit,16p,ea
Sainsbury's Red Pepper,45p,unit,45p,ea
Sainsbury's Mixed Peppers (Colours may vary) x3,1.35,unit,45p,ea
Sainsbury's Carrots 1kg,35p,unit,35p,kg
Sainsbury's Lemons,30p,unit,30p,ea
Sainsbury's Broccoli Loose,1.60,kg,1.60,kg
Sainsbury's Strawberries 400g,3.50,unit,8.75,kg
By Sainsburys Medium Ripe & Ready Avocados x2,1.60,unit,80p,ea
Sainsbury's Spring Onions Bunch 100g,37p,unit,37p,ea
Sainsbury's Closed Cup White Mushrooms 300g,95p,unit,3.17,kg
Sainsbury's Responsibly Sourced Scottish Salmon Fillets x2 240g,3.25,unit,13.54,kg
Sainsbury's Woodland Free Range Large Eggs x12,2.05,unit,17p,ea
Sainsbury's Royal Gala Apples x6,1.60,unit,27p,ea
Sainsbury's British Whole Milk 2.27L (4 pint),1.10,unit,48p,ltr
Sainsbury's Easy Peelers 600g,80p,unit,1.33,kg
Sainsbury's Easy Peelers Taste the Difference 600g,1.20,unit,2.00,kg
Sainsbury's Cauliflower,35p,unit,35p,ea
Cravendale Purefilter Semi Skimmed Milk 2L,1.90,unit,95p,ltr
Sainsbury's Blueberries 150g,1.75,unit,11.66,kg
Sainsbury's Braeburn Apples x6,1.60,unit,27p,ea
Sainsbury's Vittoria on the Vine Cherry Tomatoes Taste the Difference 250g,1.70,unit,6.80,kg
Sainsbury's Jubilee Large Vine Tomatoes Taste the Difference 450g,1.70,unit,3.78,kg
Sainsbury's Limes,30p,unit,30p,ea
Sainsbury's English Butter Salted 250g,1.50,unit,6.00,kg
Sainsbury's English Butter Unsalted 250g,1.50,unit,6.00,kg
Sainsbury's Woodland Free Range Large Eggs x6,1.10,unit,18p,ea
Sainsbury's Fine Beans 200g,1.00,unit,5.00,kg
Sainsbury's Large Onions x3,95p,unit,1.58,kg
Sainsbury's Tomato Puree Double Concentrate 200g,35p,unit,1.75,kg
Hovis Soft Medium Sliced White Bread 800g,1.10,unit,14p,100g
Sainsbury's Plain Tortilla Wraps x8 512g,90p,unit,11p,ea
Sainsbury's White Granulated Sugar 1kg,75p,unit,75p,kg
Sainsbury's Conference Pears x4,1.50,unit,1.50,ea
Sainsbury's Pink Lady Apples x6,2.60,unit,43p,ea
Sainsbury's Passata 500g,40p,unit,8p,100g
Sainsbury's Tenderstem Broccoli 200g,1.20,unit,6.00,kg
Sainsbury's Greek Style Natural Yogurt 500g,85p,unit,17p,100g
Sainsbury's Raspberries 225g,2.75,unit,12.22,kg
Sainsbury's Chicken Breast Fillets 640g,3.60,unit,5.63,kg
Napolina Chopped Tomatoes 400g,1.00,unit,2.50,kg
Heinz Baked Beans 4x415g,2.50,unit,1.51,kg
Sainsbury's 100% Pure Squeezed Smooth Orange Juice Not From Concentrate 1L,1.25,unit,13p,100ml
New York Bakery Co. Bagels Plain x5,1.60,unit,32p,ea
Sainsbury's Woodland Free Range Medium Eggs x6,90p,unit,15p,ea
Sainsbury's Baby Button Mushrooms 200g,1.10,unit,5.50,kg
Heinz Baked Beans 415g,85p,unit,2.05,kg
Warburtons Toastie Thick Sliced White Bread 800g,1.10,unit,14p,100g
Sainsbury's Smooth Pure Orange Juice 1L,90p,unit,9p,100ml
Sainsbury's Yellow Pepper,45p,unit,45p,ea
Sainsbury's Red Grapefruit,60p,unit,60p,ea
Sainsbury's Large Red Onions x3,85p,unit,2.33,kg
Heinz Cream of Tomato Soup 400g,1.00,unit,25p,100g
Sainsbury's Microwave Rice Basmati 250g,50p,unit,2.00,kg
Sainsbury's Root Ginger Loose,5.00,kg,5.00,kg
Sainsbury's Kale 200g,80p,unit,4.00,kg
Sainsbury's Babycorn 175g,1.60,unit,9.14,kg
Sainsbury's Granny Smith Apples x6,1.60,unit,27p,ea
Sainsbury's Sugar Snap Peas 200g,1.35,unit,6.75,kg
Walkers Ready Salted Crisps 6x25g,1.70,unit,1.13,100g
Sainsbury's 100% Pressed Apple Juice Not From Concentrate 1L,1.25,unit,13p,100ml
Sainsbury's Dwarf Beans 300g,1.40,unit,4.67,kg
McVitie's Milk Chocolate Digestives Biscuits 266g,1.00,unit,38p,100g
Napolina Chopped Tomatoes 4x400g,2.00,unit,1.25,kg
Sainsbury's Fresh Packed Bunch Coriander 30g,75p,unit,25p,10g
KTC Chopped Tomatoes 400g,40p,unit,10p,100g
Sainsbury's White Rolls x6,70p,unit,12p,ea
Sainsbury's Red Kidney Beans in Water 400g (240g*),55p,unit,2.29,kg
Sainsbury's Medium Sliced Wholemeal Bread 800g,55p,unit,7p,100g
Sainsbury's Orange Pepper,45p,unit,45p,ea
Sainsbury's Courgettes 500g,1.25,unit,2.50,kg
Sainsbury's Conference Pears Ripe & Ready x4,2.00,unit,50p,ea
Arla Lactofree Fresh Semi Skimmed Dairy Drink 1L,1.50,unit,1.50,ltr
Sainsbury's Red Chillies 60g,65p,unit,1.08,100g
Sainsbury's Chickpeas in Water 400g (240g*),55p,unit,2.29,kg
Alpro Almond No Sugars Long Life Drink 1L,1.80,unit,1.80,ltr
Sainsbury's Chopped Tomatoes Can 400g,35p,unit,88p,kg
Diet Coke 8x330ml,3.00,unit,11p,100ml
Sainsbury's Oranges x5,1.00,unit,20p,ea
Sainsbury's Green Pepper,45p,unit,45p,ea
Tropicana Smooth Orange Juice 950ml,1.50,unit,16p,100ml
Anchor Salted Spreadable 500g,3.75,unit,7.50,kg
Sainsbury's Cream Crackers 300g,40p,unit,13p,100g
McVitie's Digestive Biscuits 400g,1.20,unit,30p,100g
Walkers Quavers Cheese Snacks 6x16g,1.70,unit,1.77,100g
Weetabix Cereal x24,2.80,unit,12p,bisc
Sainsbury's Butcher's Choice Pork Sausages x8 454g,1.50,unit,3.30,kg
Sainsbury's Double Cream 600ml,2.00,unit,33p,100ml
Sainsbury's Pure Apple Juice 1L,90p,unit,9p,100ml
Sainsbury's Woodland Free Range Large Eggs SO Organic x6,2.15,unit,36p,ea
Walkers Cheese & Onion Crisps 6x25g,1.70,unit,1.13,100g
Sainsbury's Fusilli 1kg,1.00,unit,1.00,kg
Heinz Baked Beans 3x200g,1.80,unit,3.00,kg
Jacob's Mini Cheddars Original x6 25g,1.00,unit,66p,100g
Sainsbury's Asparagus Tips 100g,1.75,unit,17.50,kg
Sainsbury's Baked Beans In Tomato Sauce 200g,25p,unit,1.25,kg
Sainsbury's Grissini Bread Sticks 125g,90p,unit,72p,100g
Sainsbury's Soft Medium Sliced White Bread 800g,55p,unit,7p,100g
Sainsbury's Unsweetened Soya Drink 1L,85p,unit,85p,ltr
Pom-Bear Original Multipack Crisps 6x13g,1.00,unit,1.28,100g
Warburtons Medium Sliced White Bread 800g,1.10,unit,14p,100g
Hubbards Foodstore Peeled Plum Tomatoes 400g,28p,unit,7p,100g
Sainsbury's Free Range Fresh Egg Noodles 410g,1.25,unit,30p,100g
Hula Hoops Original Potato Ring Crisps 6x24g,1.25,unit,87p,100g
Princes Tuna Chunks in Spring Water 4x145g (112g*),3.50,unit,86p,100g
Sainsbury's Coconut Milk 400ml,90p,unit,23p,100ml
Sainsbury's King Prawns 150g,3.00,unit,2.00,100g
Birds Eye Potato Waffles x10 567g,1.50,unit,2.65,kg
KTC Chick Peas 400g,45p,unit,11p,100g
Sainsbury's Basmati Rice 1kg,1.55,unit,1.55,kg
Just Snax Tortilla Chips Basics 200g,50p,unit,25p,100g
Sainsbury's Fresh Packed Basil 30g,75p,unit,25p,10g
Walkers Salt & Vinegar Crisps 6x25g,1.70,unit,1.13,100g
Alpro Almond No Sugars Chilled Drink 1L,1.85,unit,1.85,ltr
Sainsbury's White Finger Rolls x6,70p,unit,12p,ea
Sainsbury's Milk Chocolate Chip Brioche Roll x8,1.10,unit,14p,ea
Tropicana Smooth Orange Juice 1.6L,3.80,unit,24p,100ml
Batchelors Super Noodles Chicken Flavour 90g,50p,unit,5.56,kg
Sainsbury's Fruity Hot Cross Buns Taste the Difference x4 280g,1.50,unit,38p,ea
Sainsbury's Runny Honey 340g,1.80,unit,53p,100g
Sainsbury's 100% Pure Squeezed Orange Juice with Bits Not From Concentrate 1L,1.25,unit,13p,100ml
Walkers Wotsits Really Cheesy Snacks 6x16.5g,1.25,unit,1.26,100g
Yeo Valley Organic Little Yeos Fruity Favourites Yogurt 4x90g,1.65,unit,46p,100g
Sainsbury's Chicken Thigh Fillets 640g,3.20,unit,5.00,kg
Sainsbury's Microwave Rice Brown 250g,45p,unit,1.80,kg
Sainsbury's Wholegrain Malties Cereal 750g,1.10,unit,15p,100g
Cadbury Dairy Milk Giant Chocolate Buttons Bag 119g,1.00,unit,84p,100g
Cadbury Dairy Milk Chocolate Bar 200g,1.50,unit,75p,100g
Sainsbury's Scottish Porridge Oats 1.5kg,1.55,unit,10p,100g
Sainsbury's Bourbon Cream Biscuits 200g,35p,unit,18p,100g
Kettle Chips Lightly Salted Sharing Crisps 150g,1.00,unit,67p,100g
Sainsbury's Penne 1kg,1.00,unit,1.00,kg
Yeo Valley Organic Natural Yogurt 500g,1.65,unit,33p,100g
Sainsbury's Golden Delicious Apples x6,1.60,unit,27p,ea
Sainsbury's Pure Apple Juice 6x200ml,1.50,unit,13p,100ml
Sainsbury's Fresh Packed Mint 30g,75p,unit,25p,10g
Sainsbury's Baked Beans In Reduced Sugar & Salt Tomato Sauce 200g,25p,unit,1.25,kg
Sainsbury's Smoked Streaky Bacon Taste the Difference 220g,2.25,unit,10.23,kg
McVitie's Rich Tea Biscuits 300g,1.20,unit,40p,100g
Heinz Cream of Chicken Soup 400g,80p,unit,20p,100g
Sainsbury's Garlic x4,1.00,unit,25p,ea
Sainsbury's Custard Creams 200g,35p,unit,18p,100g
Sainsbury's Red Kidney Beans in Chilli Sauce 400g,65p,unit,1.63,kg
Sainsbury's Green Pesto 190g,90p,unit,47p,100g
Ambrosia Custard Can 400g,75p,unit,19p,100g
McVitie's Dark Chocolate Digestive Biscuits 266g,1.00,unit,38p,100g
Aunt Bessie's Homestyle Chips 900g,1.75,unit,1.94,kg
Innocent Orange Juice Smooth 1.35L,2.50,unit,18p,100ml
Sainsbury's Smoked Bacon Medallions Be Good To Yourself 200g,2.00,unit,10.00,kg
Happy Egg Large Free Range Eggs x10,2.75,unit,28p,ea
Tilda Steamed Basmati Plain Rice 250g,1.30,unit,5.20,kg
Sainsbury's Thick Unsmoked Bacon Rasher x6 300g,2.05,unit,6.83,kg
Dolmio Bolognese Pasta Sauce Original 500g,1.85,unit,37p,100g
Nestle Multigrain Cheerios Cereal 600g,3.50,unit,58p,100g
Sainsbury's White Muffins x6,85p,unit,14p,ea
Activia Strawberry Yogurt 4pk 480g,2.00,unit,42p,100g
Alpro Soya Chilled Drink 1L,1.55,unit,1.55,ltr
Sainsbury's Peach Slices In Fruit Juice 411g,80p,unit,36p,100g
Sainsbury's Dark Chocolate Basics 100g,40p,unit,40p,100g
Sainsbury's Spaghetti 500g,55p,unit,1.10,kg
Lovett's Digestive Biscuits 400g,45p,unit,11p,100g
Doritos Cool Original Tortilla Chips 180g,95p,unit,53p,100g
Sainsbury's Plain Flour 1.5kg,80p,unit,53p,kg
Sainsbury's Unsmoked Back Bacon Rashers  x8 250g,1.50,unit,6.00,kg
Sensations Thai Sweet Chilli Crisps 150g,1.00,unit,67p,100g
Sainsbury's Milk Chocolate Digestive Biscuits Basics 300g,65p,unit,22p,100g
Sainsbury's Trimmed Mange Tout 200g,1.35,unit,6.75,kg
Branston Baked Beans 4x410g,2.00,unit,1.22,kg
Sainsbury's Royal Gala Apples SO Organic x6,2.30,unit,38p,ea
Sainsbury's Closed Cup White Mushrooms 500g,1.50,unit,3.00,kg
Uncle Ben's Classic Microwave Rice Basmati 250g,1.55,unit,6.20,kg
Ambrosia Rice Pudding Can 400g,75p,unit,19p,100g
Sainsbury's Arborio Risotto Rice 500g,1.25,unit,2.50,kg
Muller Corner Vanilla & Banana Yogurts with Chocolate Balls 6 x 130g,3.00,unit,38p,100g
Sainsbury's Wholemeal Tortilla Wraps x8 512g,90p,unit,11p,ea
Quaker Oat So Simple Original Porridge 12x27g,2.75,unit,85p,100g
Sainsbury's Cream Of Tomato Soup 400g,45p,unit,11p,100g
Hula Hoops Variety Pack Potato Ring Crisps 6x24g,1.25,unit,87p,100g
Napolina Spaghetti 500g,1.30,unit,2.60,kg
Sainsbury's 100% Pure Squeezed Smooth Orange Juice Not From Concentrate 1.75L,1.95,unit,11p,100ml
PG tips Original Biodegradable Black Tea Bags x240,4.50,unit,65p,100g
Maryland Minis Chocolate Chip Cookies x6,1.00,unit,84p,100g
McCoy's Classic Variety Pack Crisps 6x25g,1.70,unit,1.13,100g
Sainsbury's Pains Au Chocolat x4,1.25,unit,31p,ea
Sainsbury's Black Beans Carton SO Organic 380g (230g*),75p,unit,3.26,kg
Uncle Ben's Special Microwave Rice Golden Vegetable 250g,1.00,unit,4.00,kg
Sainsbury's Self Raising Flour 1.5kg,80p,unit,53p,kg
Sainsbury's Sweetened Soya Drink 1L,85p,unit,85p,ltr
Sainsbury's Baby Corn & Mange Tout 200g,1.70,unit,8.50,kg
Sainsbury's Hash Browns 700g,1.25,unit,1.79,kg
McVitie's Penguin Biscuits x8 197g,1.00,unit,51p,100g
Heinz Spaghetti Hoops In Tomato Sauce 400g,75p,unit,1.88,kg
FAGE Total 0% Natural Fat Free Greek Recipe Strained Yogurt 500g,2.75,unit,55p,100g
Kettle Chips Sea Salt & Balsamic Vinegar of Modena Sharing Crisps 150g,1.00,unit,67p,100g
Heinz Cream of Tomato Soup x4 400g,2.50,unit,16p,100g
Sainsbury's Milk Chocolate Basics 100g,40p,unit,40p,100g
Sainsbury's White Cabbage Loose,35p,kg,35p,kg
Walkers Prawn Cocktail Crisps 6x25g,1.70,unit,1.13,100g
Sainsbury's Limes x5,1.50,unit,30p,ea
McVitie's jaffa cakes triple 3x11 402g,1.50,unit,36p,100g
Bisto Gravy Granules 170g,1.00,unit,59p,100g
Sainsbury's Apple & Mango Juice Not From Concentrate 1L,1.25,unit,13p,100ml
Sainsbury's Pak Choi 200g,1.20,unit,60p,100g
Sainsbury's Olive Oil Extra Virgin 1L,3.40,unit,34p,100ml
Sainsbury's Chocolate Filled Crepes x6,1.10,unit,58p,100g
Sainsbury's Highland All Butter Shortbread Finger Biscuits 200g,70p,unit,35p,100g
McVitie's HobNobs Milk Chocolate Biscuits 262g,1.00,unit,38p,100g
Petits Filous Apricot & Strawberry Fromage Frais 4x85g,1.50,unit,44p,100g
Sainsbury's 100% Pure Squeezed Pineapple Juice Not From Concentrate 1L,1.25,unit,13p,100ml
Sunbites Sweet Chilli Multigrain Snacks 6x25g,1.70,unit,1.13,100g
Sainsbury's Ready Rolled Puff Pastry 375g,1.20,unit,32p,100g
Sainsbury's Butter Beans In Water 400g (235g*),55p,unit,2.34,kg
Heinz Spaghetti Hoops In Tomato Sauce 205g,60p,unit,2.93,kg
Heinz Baked Beans Snap Pots 4 Pack 800g,2.50,unit,3.13,kg
Heinz Top Down Ketchup 460g,1.75,unit,38p,100g
Sainsbury's Baked Beans In Tomato Sauce 400g,30p,unit,75p,kg
Green Giant Original Sweet Corn x4 198g,2.65,unit,4.02,kg
Cadbury Dairy Milk Freddo Chocolate Bar 6x18g,1.25,unit,1.16,100g
Cadbury Brunch Bar Chocolate Chip 6x32g,1.75,unit,91p,100g
Sainsbury's Strong White Unbleached Bread Flour 1.5kg,1.05,unit,70p,kg
Sainsbury's Wholewheat Biscuits Cereal x24 430g,1.80,unit,8p,bisc
Uncle Ben's Classic Microwave Rice Long Grain 250g,1.00,unit,4.00,kg
New York Bakery Co. Bagels Cinnamon & Raisin x5,1.60,unit,32p,ea
Sainsbury's SO Organic Italian Organic Chopped Tomatoes in Tomato Juice 400g,80p,unit,2.00,kg
Sainsbury's Blueberries 300g,3.50,unit,11.67,kg
Batchelors Original Mushy Peas 300g,55p,unit,1.83,kg
Warburtons Crumpets x9,1.00,unit,11p,ea
Sainsbury's Smoked Back Bacon Rashers x8 250g,1.50,unit,6.00,kg
Sainsbury's Scottish Porridge Oats 1kg,1.10,unit,11p,100g
Aunt Bessie's Homestyle Chips 1.5kg,2.50,unit,1.67,kg
Weetabix Cereal x48,4.80,unit,10p,bisc
Jacob's Cream Crackers 300g,1.20,unit,40p,100g
Sainsbury's Pasta Sauce Tomato & Herb 500g,65p,unit,13p,100g
Heinz Vegetable Soup 400g,1.00,unit,25p,100g
Cadbury Brunch Bar Raisin 6x32g,1.75,unit,91p,100g
Hubbard's Foodstore Peach Slices in Light Syrup 411g,33p,unit,14p,100g
Sainsbury's Malted Milk Biscuits 200g,55p,unit,28p,100g
Sainsbury's Microwave Rice Brown Basmati 250g,50p,unit,2.00,kg
Oatly Original Oat Drink Long Life 1L,1.50,unit,1.50,ltr
Yeo Valley Organic Yogurt Greek Style With Honey 4x100g,2.00,unit,50p,100g
Sainsbury's Cannellini Beans In Water 400g (235g*),55p,unit,2.34,kg
Sainsbury's Sunflower Oil 1L,1.10,unit,11p,100ml
Sainsbury's Vegetable Oil 1L,1.10,unit,11p,100ml
Napolina Tomato Passata 500g,60p,unit,1.20,kg
Hula Hoops BBQ Beef Potato Ring Crisps 6x24g,1.25,unit,87p,100g
Sainsbury's Coconut Milk Light 400g,90p,unit,23p,100ml
Warburtons Plain Thin Bagels x6,1.50,unit,25p,ea
Jacob's Mini Cheddars Original x12 25g,3.00,unit,1.00,100g
Sainsbury's British Single Cream 300ml,1.00,unit,33p,100ml
McVitie's Ginger Nut Biscuits 250g,1.00,unit,40p,100g
Sainsbury's Low Fat Rice Cake Be Good To Yourself 135g,1.00,unit,74p,100g
Walkers Classic Variety Crisps 6x25g,1.70,unit,1.13,100g
Oreo Original Sandwich Biscuits 154g,1.00,unit,65p,100g
Activia Rhubarb Yogurt 4x120g,2.00,unit,42p,100g
Kit Kat Finger Milk Chocolate Biscuit Bar Multipack x2 14 Pack,2.00,unit,69p,100g
Sainsbury's Microwave Rice Long Grain White 250g,45p,unit,1.80,kg
Sainsbury's Fig Rolls 200g,45p,unit,23p,100g
Bahlsen Choco Leibniz Milk 125g,1.60,unit,1.28,100g
Sainsbury's Garden Peas In Water 300g (185g*),40p,unit,2.16,kg
McCain Ready Baked Jacket Potatoes x4 800g,2.00,unit,2.50,kg
Hubbard's Clear Honey 340g,99p,unit,29p,100g
KitKat 2 Finger Milk Chocolate Biscuit Bar Multipack 9x20.7g,2.00,unit,1.07,100g
Tunnock's Caramel Wafers x8,1.80,unit,23p,ea
Magnum Ice Cream Classic Chocolate 4x110ml,3.20,unit,73p,100ml
Heinz Baked Beans With Pork Sausages 415g,1.25,unit,3.01,kg
Nescaf Azera Americano Instant Coffee 100g,4.60,unit,4.60,100g
Walkers Baked Crisps Ready Salted 6x25g,1.70,unit,1.13,100g
Sainsbury's Farfalle 500g,55p,unit,1.10,kg
Yorkshire Everyday Tea Bags x80,2.00,unit,80p,100g
Sainsbury's Thick Smoked Bacon Rashers x6 300g,2.05,unit,6.83,kg
Old El Paso Original Smoky BBQ Fajita Kit 500g,3.00,unit,60p,100g
Sainsbury's Pure Orange Juice 6x200ml,1.50,unit,13p,100ml
Sainsbury's Strawberry Jam 454g,75p,unit,17p,100g
Sainsbury's Reduced Sugar & Salt Baked Beans In Tomato Sauce 4x400g,1.00,unit,63p,kg
Nature Valley Crunchy Oats & Honey Cereal Bars 5x42g,1.50,unit,71p,100g
Farrow's Giant Marrowfat Peas 300g (180g*),40p,unit,2.23,kg
Marmite Yeast Extract Spread 250g,2.70,unit,1.08,100g
Sainsbury's Kids Caledonian Still Water 6x300ml,1.10,unit,6p,100ml
McVitie's Club Orange Biscuits x8,1.70,unit,97p,100g
Walkers Squares Salt & Vinegar Snacks 6x22g,1.25,unit,95p,100g
Heinz Baked Beans In Tomato Sauce 200g,70p,unit,3.50,kg
Weetabix Crispy Minis Chocolate Chip 600g,3.00,unit,50p,100g
Sainsbury's Spaghetti 1kg,1.00,unit,1.00,kg
Sainsbury's Multigrain Hoops Cereal 375g,1.00,unit,27p,100g
Terry's Chocolate Orange Milk Ball 157g,1.00,unit,64p,100g
Maryland Chocolate Chip Cookies 230g,1.00,unit,44p,100g
Alpro Oat Long Life Drink 1L,1.80,unit,1.80,ltr
Sainsbury's Wholewheat Biscuits Cereal x48 860g,2.50,unit,5p,bisc
Walkers Salt & Shake Crisps 6x24g,1.70,unit,1.18,100g
Heinz Baked Beans In Tomato Sauce 150g,55p,unit,3.67,kg
Twix Chocolate Biscuit Fingers Multipack 9 x 23g,1.25,unit,61p,100g
Bisto Reduced Salt Gravy Granules 170g,1.00,unit,59p,100g
Sainsbury's Guacamole 170g,1.40,unit,82p,100g
Ritz Original Crackers 200g,1.00,unit,50p,100g
Sainsbury's Sardines in Olive Oil 120g (90g*),40p,unit,44p,100g
Sainsbury's Lemon Juice 250ml,60p,unit,24p,100ml
New York Bakery Co. Bagels Sesame x5,1.60,unit,32p,ea
Sainsbury's Poppadoms Plain 64g,1.40,unit,2.19,100g
Sainsbury's Pork Chipolata Taste the Difference 375g,2.25,unit,6.00,kg
Activia No Added Sugar 0% Fat Mixed Red Fruits Yogurt 8x120,3.00,unit,31p,100g
Aunt Bessie's Crispy & Fluffy Crinkle Cut Chips 900g,1.25,unit,1.39,kg
Sainsbury's Stringless Beans 225g,1.30,unit,5.78,kg
Sainsbury's Mini Breadsticks 95g,1.00,unit,1.05,100g
Snack a Jacks Salt & Vinegar Rice Cakes 4x22g,1.75,unit,1.99,100g
Sainsbury's Raisins Seedless 500g,1.80,unit,3.60,kg
Napolina Peeled Plum Tomatoes 400g,1.00,unit,2.50,kg
Fox's Party Ring Biscuits 125g,50p,unit,40p,100g
Sainsbury's Sardines in Tomato Sauce 120g,40p,unit,33p,100g
Ambrosia Custard Pots 4x125g,1.50,unit,30p,100g
Walkers Quavers Cheese Snacks 12x16g,3.00,unit,1.56,100g
Pot Noodle Chicken & Mushroom 90g,80p,unit,8.89,kg
Hellmann's Real Squeezy Mayonnaise 430ml,2.10,unit,49p,100ml
Sainsbury's Green Lentils In Water 400g (265g*),55p,unit,2.08,kg
Sharwood's Medium Egg Noodles 340g,1.75,unit,5.15,kg
Cadbury Time Out Chocolate Wafer Biscuit Bar 7x16g,1.00,unit,68p,100g
Green & Black's Organic 70% Dark Chocolate Bar 90g,2.00,unit,2.22,100g
Tyrrells Lightly Sea Salted Sharing Crisps 150g,2.00,unit,1.33,100g
Just Snax Salted Peanuts 200g,50p,unit,25p,100g
Nescaf Gold Blend Instant Coffee 200g,5.00,unit,2.50,100g
Quorn Vegetarian Mince Family Pack 500g,2.50,unit,5.00,kg
Sainsbury's Pine Nuts 100g,3.60,unit,3.60,100g
Metcalfe's Sweet & Salt Popcorn Multipack 6x17g,1.80,unit,1.76,100g
Sainsbury's Wholewheat Fusilli 1kg,1.00,unit,1.00,kg
Sainsbury's Evaporated Milk 410g,65p,unit,16p,100g
Green Giant Original Sweet Corn 198g,75p,unit,4.55,kg
Soreen Banana Lunchbox Loaves 5x30g,1.50,unit,30p,ea
Sainsbury's Rich Tea Biscuits 200g,45p,unit,23p,100g
Sainsbury's Pear Halves In Fruit Juice 411g,80p,unit,36p,100g
Loyd Grossman Pasta Sauce Tomato & Basil 350g,1.00,unit,28p,100g
Cadbury Animals Chocolate Biscuits 7x20g,1.00,unit,76p,100g
Cadbury Chocolate Mini Fingers x5 115g,1.00,unit,86p,100g
Oatly Oat Drink Barista Edition Long Life 1L,1.80,unit,1.80,ltr
Maltesers Chocolate Pouch Bag 102g,1.50,unit,1.47,100g
Heinz Baked Beans With Pork Sausages 200g,70p,unit,3.50,kg
FAGE Total Natural Greek Recipe Strained Yogurt 500g,2.75,unit,55p,100g
Sainsbury's Conchiglie (Shells) 500g,55p,unit,1.10,kg
Sainsbury's Spirali 500g,55p,unit,1.10,kg
Alpro Soya Light Chilled Drink 1L,1.55,unit,1.55,ltr
Sainsbury's Sweetcorn 3x198g (157g*),1.30,unit,2.76,kg
KTC Coconut Milk 400ml,1.00,unit,25p,100ml
Sainsbury's Italian Plum Tomatoes 400g,35p,unit,88p,kg
Jacob's Cheddars Cheese Biscuits 150g,1.30,unit,87p,100g
Sainsbury's Butter Brioche Roll x8,1.10,unit,14p,ea
Sainsbury's Icing Sugar 1kg,1.70,unit,1.70,kg
Quorn Vegetarian Mince 300g,2.00,unit,6.67,kg
Sainsbury's Scotch Pancakes x6,55p,unit,9p,ea
Sainsbury's Cornflour 500g,1.50,unit,3.00,kg
Quaker Oat So Simple Porridge Golden Syrup Flavour 10x36g,2.75,unit,76p,100g
Barny Chocolate Sponge Bear Biscuits 5x25g,1.00,unit,80p,100g
Sainsbury's Runner Beans 225g,1.25,unit,5.56,kg
Sainsbury's Whole Rolled Porridge Oats Taste the Difference 750g,1.80,unit,24p,100g
Sainsbury's White Caster Sugar1kg,1.60,unit,1.60,kg
Sainsbury's Pork & Bramley Apple Sausages Taste the Difference x6 400g,2.75,unit,6.88,kg
Sainsbury's Milk Chocolate Digestive Biscuits 400g,60p,unit,15p,100g
Sainsbury's Macaroni 500g,55p,unit,1.10,kg
Skips Prawn Cocktail 6x13.1g,1.00,unit,1.27,100g
Hartley's No Added Sugar Strawberry Jelly Pot 115g,60p,unit,52p,100g
Magnum Mini Ice Cream Classic Almond & White 6x55ml,2.50,unit,76p,100ml
Hartley's Strawberry Jelly Pot 125g,60p,unit,48p,100g
Cadbury Fudge Chocolate Bar 6x22g,1.25,unit,95p,100g
Sainsbury's Tomato Ketchup 680g,80p,unit,12p,100g
Sainsbury's Baked Beans In Tomato Sauce With Sausages 400g,70p,unit,1.75,kg
Sainsbury's Cream Of Chicken Soup 400g,45p,unit,11p,100g
Sainsbury's Easy Cook Long Grain White Rice 1kg,1.25,unit,1.25,kg
Kingsfood Hot Dog Sausages x8 400g (184g*),55p,unit,2.99,kg
Sainsbury's Chickpeas SO Organic 380g (230g*),75p,unit,3.26,kg
Koko Coconut UHT Drink 1L,1.50,unit,1.50,ltr
Sainsbury's Mackerel Fillets in Tomato Sauce 125g,65p,unit,52p,100g
Oatly Organic Oat Drink Long Life 1L,1.50,unit,1.50,ltr
Sainsbury's Tomato Puree Double Concentrate 142g,30p,unit,2.11,kg
Hubbard's Foodstore Mushy Peas 300g,21p,unit,7p,100g
Sainsbury's Pitted Black Olives 350g (160g*),75p,unit,47p,100g
KitKat Chunky Milk Chocolate Bar Multipack 4x40g,1.00,unit,63p,100g
Sainsbury's Fusilli 500g,55p,unit,1.10,kg
Bonne Maman Strawberry Conserve 370g,2.60,unit,70p,100g
Sunbites Sour Cream & Pepper Multigrain Snacks 6x25g,1.70,unit,1.13,100g
Tyrrells Cider Vinegar & Salt Sharing Crisps 150g,2.00,unit,1.33,100g
Sainsbury's Chopped Tomatoes With Basil & Oregano 390g,55p,unit,1.41,kg
Lindt Excellence Dark 70% Cocoa Chocolate Bar 100g,1.50,unit,1.50,100g
Oxo Beef Stock Cubes x12 71g,1.00,unit,1.41,100g
Kettle Chips Mature Cheddar & Red Onion Sharing Crisps 150g,1.00,unit,67p,100g
Sainsbury's Gold Roast Instant Coffee 200g,3.00,unit,1.50,100g
Sainsbury's Rice Pudding Creamed 400g,55p,unit,14p,100g
Doritos Chilli Heatwave Tortilla Chips 180g,95p,unit,53p,100g
PG tips Original Biodegradable Black Tea Bags x160,3.00,unit,65p,100g
McCoy's Meaty Variety Pack Crisps 6x25g,1.70,unit,1.13,100g
Yeo Valley Organic Greek Style Natural Yogurt 450g,1.70,unit,38p,100g
Kellogg's Special  K Original Cereal 750g,3.00,unit,40p,100g
Pringles Salt & Vinegar Crisps 200g,1.25,unit,63p,100g
Nescafe Gold Blend Instant Coffee Refill 150g,3.50,unit,2.33,100g
Blue Diamond Almond Breeze Long Life Unsweetened Drink 1L,1.00,unit,1.00,ltr
Napolina Chick Peas 400g (240g*),65p,unit,2.71,kg
Heinz Cream of Tomato Soup 300g,90p,unit,30p,100g
Rowse Natural Blossom Honey Squeezy 340g,2.00,unit,59p,100g
Quaker Rolled Porridge Oats 1kg,1.75,unit,18p,100g
Bernard Matthews Chicken Chunks 90g,1.10,unit,1.22,100g
Alpro Plain Yoghurt Alternative 500g,1.75,unit,35p,100g
Sainsbury's Salmon Fillets 480g,6.25,unit,13.02,kg
Doritos Tangy Cheese Tortilla Chips 180g,95p,unit,53p,100g
Whole Earth Crunchy Peanut Butter 454g,2.00,unit,44p,100g
Sainsbury's Oaty Biscuits 300g,45p,unit,15p,100g
Max Twister Mini Ice Cream Lolly Pineapple Strawberry & Lemon 8x50ml,1.50,unit,37p,100ml
Sainsbury's Chopped Tomatoes 227g,30p,unit,1.32,kg
Walkers Wotsits Really Cheesy Snacks 12x16.5g,3.00,unit,1.52,100g
Sainsbury's White Granulated Sugar 500g,40p,unit,80p,kg
Tetley Everyday Tea Bags Softpack x240,4.00,unit,53p,100g
Tunnock's Milk Chocolate Teacakes Biscuits x10,1.80,unit,18p,unit
Sainsbury's Cornflakes Cereal 500g,1.00,unit,20p,100g
Sainsbury's Mini Breadsticks Packs 6x20g,1.30,unit,1.08,100g
Sainsbury's Mild Smoked Salmon 100g,3.25,unit,3.25,100g
Sainsbury's Pumpkin Seeds 100g,1.00,unit,10.00,kg
Walkers Smoky Bacon Crisps 6x25g,1.70,unit,1.13,100g
Old El Paso Smoky BBQ Fajitas Seasoning Mix 35g,1.00,unit,2.86,100g
Sainsbury's White Chocolate Basics 100g,40p,unit,40p,100g
Sainsbury's Raspberries Taste the Difference 150g,2.50,unit,16.67,kg
Sainsbury's Dark Soy Sauce 150ml,65p,unit,43p,100ml
Galaxy Smooth Milk Chocolate Bars Multipack 4 x 42g,1.25,unit,74p,100g
Sainsbury's Sardines in Spring Water 120g (90g*),40p,unit,44p,100g
Arla Lactofree Fresh Whole Dairy Drink 1L,1.50,unit,1.50,ltr
Sainsbury's Sun Dried Tomato Antipasto Oil 280g (150g*),1.75,unit,1.17,100g
Sainsbury's Pitted Green Olives 350g (160g*),75p,unit,47p,100g
Sainsbury's Woodland Free Range Mixed Weight Eggs SO Organic x12,3.50,unit,29p,ea
Kallo Organic Lightly Salted Rice Cakes 130g,1.30,unit,1.00,100g
Quorn Vegetarian Chicken Style Pieces 300g,2.00,unit,6.67,kg
Sainsbury's Freshly Squeezed Orange Juice with Bits Taste the Difference 1L,2.50,unit,25p,100ml
Kettle Chips Sea Salt & Crushed Black Peppercorns Sharing Crisps 150g,1.00,unit,67p,100g
Heinz Cream Of Mushroom Soup 400g,1.00,unit,25p,100g
