Description,Price/Unit,Unit,Price/Measure,MeasureSkittles Giants Fruit Sweets Pouch Bag 170g,1.35,unit,79p,100g
Sainsbury's Red Designer Icing 120g,1.50,unit,1.25,100g
Sainsbury's Deliciously Free From Fresh Egg Tagliatelle 250g,2.20,unit,88p,100g
OGGS Zesty Lemon Cakes 184g,3.75,unit,94p,ea
Kabuto Noodles Vegetable Katsu 65g,2.00,unit,23.53,kg
VeeTee Long Grain Rice & Tasty 300g,1.00,unit,33p,100g
Uncle Ben's Mixed Pepper Rice 250g,1.00,unit,4.00,kg
Walkers Max Double Crunch XXL Chicken & Chorizo Crisps 140g,1.00,unit,72p,100g
Betty Crocker Chocolate Swirl Cake Mix 425g,2.50,unit,59p,100g
Sainsbury's Roast Garlic & Herb Grinder 35g,2.60,unit,74p,10g
Zott Jogobella 400g,1.00,unit,25p,100g
Sainsbury's Free From Honey Roast Gammon Flavour Tortilla Curls 150g,75p,unit,50p,100g
Morliny Berlinki Chicken Hot Dogs 250g,1.30,unit,52p,100g
Twix Top Chocolate Biscuit Bars Multipack 10x21g,1.25,unit,60p,100g
Extra White Chewing Gum Sugar Free 10 Pieces 14g,55p,unit,3.93,100g
Yorkie Original Milk Chocolate Bar 46g,65p,unit,1.41,100g
Sainsbury's Brazil Nuts 250g,3.00,unit,1.20,100g
Nissin Cup Noodles Seafood 76g,1.75,unit,23.33,kg
Ritz Olive Oil & Grana Padano Crackers 100g,1.50,unit,1.50,100g
Naturya Fairtrade Organic Cacao Powder 250g,6.50,unit,2.60,100g
BFree Sliced White Loaf 400g,3.00,unit,75p,100g
Pot Noodle Thai Green Curry 90g,80p,unit,89p,100g
Karyatis Mixed Hot Chillies 205g (130g*),2.00,unit,1.54,100g
Free'ist No Added Sugar & Gluten Free White Chocolate with Strawberries & with Sweetener 75g,1.25,unit,1.67,100g
NOMO Fruit & Crunch Chocolate Bar 32g,90p,unit,2.81,100g
Sharwood's Rice Pot Chicken Korma 70g,1.50,unit,2.14,100g
Sainsbury's Hot & Spicy Pickled Shallots in Malt Vinegar 465g,1.90,unit,90p,100g
Sainsbury's Deliciously Free From Strawberry Iced Dessert 500ml,3.50,unit,70p,100ml
Uncle Bens Microwave Smokey BBQ Rice 250g,1.00,unit,40p,100g
L'OR Intense Instant Coffee 165g,6.00,unit,3.64,100g
Lyons Viscounts 98g,70p,unit,71p,100g
Yogiyo Korean Sesame Soy 100g,70p,unit,70p,100g
Benus Whole Grain Bread 500g,75p,unit,2.14,100g
Nakd Strawberry Sundae Fruit & Nut Bar 35g,75p,unit,2.14,100g
Propercorn Microwavable Salted Popcorn 3x70g,2.25,unit,1.07,100g
Kubus Water Strawberry 500ml,80p,unit,16p,100ml
Sainsbury's Microground Gingerbread Latte Instant Coffee 126g,2.00,unit,1.59,100g
Schwartz Sweet Potato Wedges Mix 35g,70p,unit,2.00,100g
La Espanola Olive Oil 750ml,5.00,unit,67p,100ml
Heinz DC Super Friends Shapes in Tomato Sauce Snap Pots 2x190g,1.30,unit,3.42,kg
Sainsbury's Coconut Oil 500ml,4.40,unit,88p,100ml
Thorntons Continental Dark Chocolate Selection Box 284g,7.00,unit,2.47,100g
Sainsbury's Fruit Nut & Seed Medley 200g,2.65,unit,1.33,100g
Polo Mints Pot Original 66g,1.00,unit,1.51,100g
Fudco Mild Paprika Powder 100g,1.20,unit,1.20,100g
Sainsbury's No Added Sugar Blueberry Juice Drink 1L,85p,unit,9p,100ml
Randoms Randoms Squish'ems Sweets Sharing Pouch 140g,1.00,unit,72p,100g
Kettle Chips Vegan Sheese & Red Onion Sharing 135g,1.25,unit,92p,100g
Capri-Sun No Added Sugar Blackcurrant & Apple x8 200ml,2.00,unit,13p,100ml
Sainsbury's Multigrain Porridge Oats 500g,1.00,unit,20p,100g
Carte Noire Intense Instant Coffee 100g,4.00,unit,4.00,100g
Atlante Ingredients Italian Finely Chopped Tomatoes 400g,50p,unit,13p,100g
Kallo Organic Belgian Milk Chocolate Rice Cake Thins 90g,2.00,unit,2.22,100g
Taylors of Harrogate Praline Especial Brazil Ground Coffee 227g,4.50,unit,1.98,100g
Union Hand-Roasted Coffee House Roast Cafetire Grind 200g,4.00,unit,2.00,100g
Organix Oat & Raisin Mini Flapjack Bites 4x15g,2.50,unit,3.13,100g
Nando's Peri-Peri Hot Sauce 500g,3.90,unit,78p,100g
Pakeeza Live Natural Set 900g,1.45,unit,16p,100g
Sainsbury's Pecan Nuts 200g,3.50,unit,1.75,100g
Sainsbury's Lungo Coffee Pods x10 52g,1.65,unit,3.17,100g
Sainsbury's Echinacea & Hibiscus Infusion Tea Bags x20 40g,1.55,unit,3.88,100g
Godiva Masterpieces Caramel Lion with Belgian Milk Chocolate 193g,5.00,unit,2.59,100g
Sainsbury's Lion Snacks Lightly Salted 6x15g,1.00,unit,1.11,100g
itsu Satay Udon'Noodles 174g,2.50,unit,14.37,kg
Doritos Tangy Cheese Tortilla Chip Crisps 55g,90p,unit,1.64,100g
Dr. Oetker Vege-Gel Gelatine Sachets 3x6.5g,1.00,unit,5.13,100g
Sainsbury's Chicken Gravy Pouch Taste the Difference 350g,1.50,unit,43p,100g
Cadbury Nibbly Chocolate Mini Fingers Biscuits 125g,1.50,unit,1.20,100g
Doritos Stax Cheese 170g,1.50,unit,88p,100g
Naked Rice Long Grain Rice Chinese Char Siu 78g,85p,unit,1.09,100g
Odysea Greek Extra Virgin Olive Oil 500ml,5.00,unit,1.00,100ml
Tic Tac Mixers Cherry Cola 49g,1.40,unit,2.86,100g
Little's Rich Hazelnut Flavour Infused Instant Coffee 50g,3.00,unit,6.00,100g
Sainsbury's Instant Skinny Latte 8x18g,1.00,unit,69p,100g
Sainsbury's Pine Nuts Organic 100g,4.40,unit,4.40,100g
Deliciously Ella Almond Butter & Salted Caramel Cups 36g,1.50,unit,4.17,100g
Wasabi Sushi & Bento Vegetable Gyoza Yakisoba 450g,4.00,unit,8.89,kg
Gran Luchito Mexico Zingy & Tangy Tomatillo Salsa 300g,2.65,unit,88p,100g
BFree Bake at Home White Demi Baguettes 2x110g,3.00,unit,1.36,100g
Clearspring Organic Instant Gluten Free Cous Cous 200g,1.50,unit,75p,100g
Lee Kum Kee Premium Dark Soy Sauce 500ml,2.00,unit,40p,100ml
CafePod Nespresso Compatible Decaf Espresso Aluminium Capsules x18,4.00,unit,4.04,100g
Capsicana The Ultimate Refried Black Beans 200g,2.40,unit,1.20,100g
Free'ist No Added Sugar Chocolate Chip Cookies with Sweetener 135g,1.50,unit,1.11,100g
Tymbark Apple & Mint Drink 250ml,55p,unit,22p,100ml
Heinz Classic BBQ Sauce 665g,2.50,unit,38p,100g
Grace Aloe Vera Water Mango 500ml,90p,unit,18p,100ml
Dr. Oetker Extra Strong Pink Food Colouring Gel 15g,1.20,unit,8.00,100g
Munchy Seeds Honey Seeds 120g,2.50,unit,2.08,100g
Extra Ice Peppermint Chewing Gum Sugar Free Multipack 6x10 Pieces,2.00,unit,2.38,100g
Sainsbury's Home 12 Cup Non Stick Muffin Tray,4.50,unit,4.50,ea
Crosse & Blackwell Best of British Broccoli & Stilton Soup 400g,75p,unit,19p,100g
Sainsbury's Panang Curry Paste 190g,1.35,unit,71p,100g
Munchy Seeds Omega Sprinkles 125g,2.50,unit,1.79,100g
Magija Chocolate Dessert Bar 45g,90p,unit,2.00,100g
Prince Polo Classic Xxl 52g,75p,unit,1.50,100g
Sainsbury's Deliciously Free From Breaded Chicken Steaks x4 380g,3.25,unit,86p,100g
Batchelors Low Fat Super Noodles Chicken & Herb Flavour 81g,50p,unit,62p,100g
House of Cake Edible Eyes Cake Decorations x50,2.30,unit,2.30,ea
Fudco Fine Desiccated Coconut 250g,1.70,unit,68p,100g
Sainsbury's Finger Rolls x6,65p,unit,11p,ea
Sharwood's Rice Pot Chicken Tikka 70g,1.50,unit,2.14,100g
Oreo Assortment Biscuit Tin 396g,4.00,unit,1.01,100g
Hartley's 10 Cal Strawberry Jelly Pot Multipack 6x175g,4.50,unit,43p,100g
Swizzels Push-UP! Blackcurrant Cherry & Apple Strawberry Ice Lollies 5x56ml,1.00,unit,36p,100g
Hubbard's Foodstore Gravy Granules 170g,30p,unit,18p,100g
Nissin Cup Noodles Beef & Yasai 71g,1.75,unit,23.97,kg
Sainsbury's Coconut Rooibos Infusion Tea Bags Taste the Difference x20 40g,1.75,unit,4.38,100g
Fudco Himalayan Pink Salt 500g,2.75,unit,55p,100g
W K Kellogg No Added Sugar Carrot Raspberry & Apple Granola 500g,3.80,unit,76p,100g
Odysea Nocellara Olives 290g,2.70,unit,9.31,kg
Vitasoy Soybean Drink 250ml (Sugar levy applied),55p,unit,22p,100ml
House of Cake Unicorn & Rainbow Cake Decorations x12,1.50,unit,1.50,ea
Sainsbury's On the Go Roasted & Salted Mixed Nuts 60g,1.00,unit,1.67,100g
Sainsbury's Cake Decorations Butterfly 12x3g,1.60,unit,1.60,ea
Fibre One Birthday Cake Brownie 5x24g,2.90,unit,2.42,100g
Lee Kum Kee Chiu Chow Chilli Oil 170g,3.00,unit,1.76,100g
Sainsbury's Almonds SO Organic 200g,2.30,unit,1.15,100g
Swizzels Mega Drumstick Lolly Bubblegum 28g,35p,unit,1.25,100g
Sainsbury's Spiced Turmeric Infusion Tea Bags x20 36g,1.55,unit,4.31,100g
Doves Farm Organic Pasta Flour 1kg,2.00,unit,2.00,kg
Fudco Roasted & Salted Jumbo Pistachios 200g,3.80,unit,1.90,100g
Sainsbury's Petite Cases x100,1.05,unit,1p,ea
Dr. Oetker Extra Strong Yellow Food Colouring Gel 15g,1.20,unit,8.00,100g
Oshee Vitamin Muesli Bar Plum & Cranberry 40g,50p,unit,1.25,100g
Sainsbury's Pitted Green Olives SO Organic 290g,1.80,unit,62p,100g
Garner's Spiced Pickled Cabbage 454g,2.00,unit,44p,100g
The Curators Original Beef Jerky 28g,1.75,unit,6.25,100g
Dr. Oetker Extra Strong Violet Food Colouring Gel 15g,1.20,unit,8.00,100g
Aunt Bessie's Shortcrust Pastry Mix 500g,1.00,unit,2.00,kg
Natural Gold Grape Juice 650ml,2.70,unit,42p,100ml
Sainsbury's Tuna Flakes in a Sweet Chilli Dressing 80g,1.00,unit,1.25,100g
Riga Gold Gourmet Selection Brisling Sardines in Olive Oil 120g,1.50,unit,1.25,100g
Kubus Carrot Raspberry & Apple Drink 900ml,1.25,unit,14p,100ml
Sainsbury's Cake Decorations Gold Pearls 80g,1.10,unit,1.38,100g
Walkers Max Variety Crisps 6x27g,1.25,unit,77p,100g
Crosse & Blackwell Spicy Parsnip & Carrot Soup 400g,75p,unit,19p,100g
Sainsbury's Chargrilled Artichoke Salad Taste the Difference 290g (184g*),3.25,unit,1.77,100g
Loyd Grossman No Added Sugar Bolognese Pasta Sauce 350g,1.00,unit,28p,100g
Sainsbury's Green Designer Icing 120g,1.50,unit,1.25,100g
Betty Crocker Gluten Free Devil's Food Chocolate Cake Mix 425g,2.60,unit,61p,100g
Schr Gluten Free Curvies Original 170g,2.00,unit,1.18,100g
Sainsbury's Baharat 36g,2.10,unit,58p,10g
Marmite Yeast Extract Biscuits for Cheese 150g,2.00,unit,1.33,100g
CafePod Nespresso Compatible Supercharger Espresso Aluminium Capsules x18,4.00,unit,4.04,100g
Nissin Cup Noodles Pork Tonkotsu 77g,1.75,unit,23.33,kg
The Natural Confectionery Co. Dino Mix Sweets Bag 160g,1.00,unit,63p,100g
Sainsbury's Writing Icing Chocolate & Caramel Flavour 4x19g,2.00,unit,2.63,100g
Alpen Protein Bars Chocolate 5x34g,2.75,unit,1.62,100g
Sainsbury's Malted Wheat & Honey Bloomer Taste the Difference 400g,1.20,unit,30p,100g
Frugo Orange 250ml,60p,unit,24p,100ml
Sainsbury's Intenso Coffee Pods x30 156g,4.75,unit,3.04,100g
Sainsbury's Mini Toffee Star Biscuits in Christmas Tin 200g,7.00,unit,3.50,100g
Krakus Kabanos Classic Pork Snack 180g,2.00,unit,1.11,100g
Odysea Greek Big Halkidiki Pitted Olives 290g,2.00,unit,6.90,kg
Lavazza Iced Coffee Cappuccino 250ml,1.25,unit,5.00,ltr
Kenco Iced Latte Original Instant Coffee 8 Sachets,1.50,unit,87p,100g
Walkers Max Double Crunch Bold BBQ Ribs Crisps 140g,1.00,unit,71p,100g
Gran Luchito Mexico Super Smoky Chipotle Salsa 300g,2.65,unit,88p,100g
Crosse & Blackwell Winter Vegetable Soup 400g,75p,unit,19p,100g
Alpen Protein Bars Berries & Yoghurt 5x34g,2.75,unit,1.62,100g
Sainsbury's Glimmer Sugar Pink 75g,1.00,unit,1.33,100g
W K Kellogg No Added Sugar Plain 570g,3.80,unit,67p,100g
Blue Dragon Firecracker Stir Fry Sauce 120g,70p,unit,58p,100g
Baxters Cool Cucumber & Dill Relish 220g,2.00,unit,91p,100g
Sainsbury's Fairtrade Black Peppercorns 50g,2.75,unit,55p,10g
Reese's Mini Peanut Butter Cup Pouch 90g,1.50,unit,1.67,100g
Mlekpol Krolewski Z Kolna Cheese Slices 150g,1.20,unit,80p,100g
Kohinoor Butter Chicken Sauces 375g,1.50,unit,40p,100g
Tony's Chocolonely Fairtrade Milk Chocolate Almond Honey Nougat 180g,2.75,unit,1.52,100g
Sainsbury's Mackerel Creamy Korma 125g,80p,unit,64p,100g
Sainsbury's Mixed Nuts in Shell with Nut Cracker 430g,5.50,unit,1.28,100g
Marmite Cashews 90g,2.00,unit,2.22,100g
Sainsbury's Deliciously Free From Choc Iced Dessert 500ml,3.50,unit,70p,100ml
Tilda Microwave Peri Peri Basmati Rice 250g,1.50,unit,60p,100g
Cadbury Creamy White Chocolate Bar 180g,1.50,unit,83p,100g
Sainsbury's Cake Decorations White Shimmer Pearls 80g,1.10,unit,1.38,100g
Sainsbury's Deliciously Free From Spaghetti Bolognese 400g,3.00,unit,75p,100g
Sainsbury's Brazil Nuts In Shell 325g,3.00,unit,92p,100g
Sainsbury's Roasted Smokey Almonds 100g,1.50,unit,1.50,100g
L'Aquila London Truffoil White Truffle Flavoured Extra Virgin Olive Oil 100ml,3.50,unit,3.50,100ml
Sainsbury's Cake Decorations Red & Pink Heart Confetti 55g,1.00,unit,1.82,100g
Brunswick Sardines in Louisiana Hot Sauce 106g,85p,unit,80p,100g
Sainsbury's Baked Spiced Turmeric & Coconut Flatbread Chips 150g,1.00,unit,67p,100g
Odysea Organic Greek Extra Virgin Olive Oil 500ml,5.00,unit,1.00,100ml
Oxo Original Beef Stock Pots x4 80g,1.00,unit,1.25,100g
Nakd Raspberry Chocolish Fruit & Nut Cereal Bars 4x35g,3.00,unit,2.14,100g
Mardel Dulce De Leche 450g,1.00,unit,89p,100g
Sainsbury's Low Sugar Cappuccino 8x14g,1.00,unit,89p,100g
Sainsbury's Free From Iced Mince Pies x4 225g,2.00,unit,89p,100g
Littleover Apiaries Acacia Honey 340g,4.00,unit,1.18,100g
Walkers Max Double Crunch Loaded Cheddar & Onion Crisps 140g,1.00,unit,71p,100g
Kellogg's All-Bran Fibre Crunch Berry Burst Cereal 390g,3.00,unit,77p,100g
Modern Standard Colombia Aromas Del Sur Ground Coffee 227g,4.00,unit,1.76,100g
Galaxy Truffles Chocolate Medium Gift Box 206g,3.50,unit,1.70,100g
Betty Crocker Rainbow Chip Party Cake Mix 425g,2.50,unit,59p,100g
Sauce Shop Sriracha 255g,3.00,unit,1.18,100g
Eat Natural for Breakfast Protein Granola Almonds Seeds and Honey 400g,3.00,unit,75p,100g
Baxters Red Slaw Deli Topper 280g,1.50,unit,54p,100g
Naturelly Jelly Juice Apple & Blackcurrant 100g,80p,unit,80p,100g
Kubus Go Strawberry-Banana 300ml,70p,unit,23p,100ml
Sainsbury's Sri Lankan Style Curry Nut Mix 120g,1.25,unit,1.04,100g
Maggi So Juicy Mediterranean Chicken 44g,1.00,unit,2.70,100g
Schr Gluten Free Melto 30g,1.00,unit,3.33,100g
Dr. Oetker Easy Swirl Chocolate Cupcake Icing 180g,3.70,unit,2.06,100g
Nature Valley Crunchy Oats & Honey Cereal Bars 18x42g,60p,unit,1.43,100g
Barenaked Protein Noodles 250g,2.00,unit,80p,100g
Bunlimited 4 Classic Hot Dogs 280g,2.00,unit,7.14,kg
The Paleo Foods Co. Pecan & Almond Grain-Free Granola 285g,4.00,unit,1.40,100g
Odysea Balsamic Vinegar Of Modena 250ml,9.95,unit,39.80,ltr
Sainsbury's Raspberry Vinaigrette Taste the Difference 255ml,1.75,unit,69p,100ml
Sainsbury's Rainbow Pencil Sweets 160g,85p,unit,53p,100g
Twinings Decaffeinated Everyday Tea 80 Tea Bags,5.30,unit,2.65,100g
Lindt Master Chocolatier Collection 184g,7.00,unit,3.80,100g
Blue Dragon White Rice Vinegar 150ml,1.90,unit,1.27,100ml
Levi Roots Jerk Seasoning Original 45g,2.00,unit,44p,10g
Karyatis Greek Extra Virgin Olive Oil 500ml,3.45,unit,69p,100ml
New York Bakery Co. Gluten Free Original Bagels x4,2.60,unit,90p,100g
Sainsbury's Spiced Almond Biscuit 200g,80p,unit,40p,100g
Naturya Organic Chia Seeds 175g,4.00,unit,2.29,100g
Califia Farms Chocolate Coconut Almond Blend Drink 750ml,2.40,unit,3.20,ltr
W.K Kellogg Plant Protein Crunch Original Cereal 420g,2.00,unit,47p,100g
Kucharek Rosol Z Kury Chicken Stock Cubes x12 120g,90p,unit,60p,100g
Ting Grapefruit Crush 1.5L,1.00,unit,66p,ltr
Nature Valley Crunchy Variety Pack Cereal Bars 10x42g,4.00,unit,95p,100g
Natural Days Ground Rice Flour 500g,1.20,unit,24p,100g
Pipers Lye Cross Cheddar & Onion Crisps 150g,2.50,unit,1.67,100g
Belazu Ingredient Co. Truffle & Artichoke Pesto 165g,3.20,unit,1.94,100g
Kimura Japanese Lemonade 200ml (Sugar levy applied),1.65,unit,83p,100g
Sainsbury's Prawn Crackers 40g,75p,unit,1.88,100g
Lotus Biscoff Sandwich Vanilla 150g,1.40,unit,93p,100g
VeeTee Pilau Rice & Tasty 300g,1.00,unit,36p,100g
Squid Brand Fish Sauce 725ml,1.60,unit,22p,100ml
Paxo Brilliant Breadcrumbs Zesty Lemon & Cracked Black Pepper 120g,2.00,unit,16.67,kg
Geeta's Premium Lime & Chilli Chutney Hot 230g,1.20,unit,52p,100g
Fudco Whole Black Pepper 100g,1.50,unit,1.50,100g
Kallo Spinach & Pesto Veggie Cake 122g,2.50,unit,2.05,100g
The Great British Porridge Co. Blueberry & Banana 385g,4.00,unit,1.04,100g
M&M's Crispy Chocolate Bar 150g,2.50,unit,1.67,100g
Wonka Nerds Cherry & Watermelon 46g,90p,unit,1.93,100g
Fudco Pistachio Kernels 200g,5.00,unit,2.50,100g
Clarks Carob Fruit Syrup 250ml,2.00,unit,80p,100ml
Sainsbury's Belgian Biscuit Assortment 375g,6.00,unit,1.60,100g
Dunn's River Cornmeal Coarse,85p,unit,1.70,kg
Krakus Podwawelska Sausage 520g,3.60,unit,69p,100g
Sainsbury's Sea Salt & Rosemary Flatbread Chips 150g,1.00,unit,67p,100g
Lily O'Brien's Chocolate Creamy Caramels with Sea Salt 120g,2.00,unit,1.66,100g
Baxters Chef Selections Pineapple Coconut & Zesty Lime Chutney 215g,2.00,unit,80p,100g
Rhythm 108 Swiss Choc Almond 99g,3.50,unit,3.54,100g
Sainsbury's Fairtrade Peruvian Machu Picchu Ground Coffee Taste the Difference 227g,3.00,unit,1.32,100g
Hula Hoops Variety  Pack 18x24g,3.00,unit,69p,100g
Kings Veggie Jerky Black Bean Sauce Flavour 65g,1.25,unit,1.93,100g
The Chia Co. Chia Seeds Shots Black 7.5g,40p,unit,5.33,100g
MS Traditional Pork Scratchings 40g,1.00,unit,2.50,100g
Tony's Chocolonely Milk Chocolate Caramel Sea Salt 47g,1.35,unit,2.87,100g
Pukka Organic Green Collection Green Tea x20 Sachets 32g,3.00,unit,10.00,100g
Gefen Instant Noodle Soup Chicken 65g,85p,unit,1.31,100g
Sainsbury's Mackerel Fillets in Sriracha Hot Sauce 125g,80p,unit,64p,100g
Starbucks Blonde Espresso Roast Whole Bean Coffee Bag 200g,3.00,unit,1.50,100g
Nescaf Dolce Gusto Cafe au Lait Intenso Coffee x16 Pods 16 Drinks,3.50,unit,3.50,100g
Reese's White Peanut Butter Cup 42g,1.30,unit,3.33,100g
Sainsbury's Tuna Flakes with Mayo & Sweetcorn 80g,1.00,unit,1.25,100g
Baxters Spicy Jalapeno Chilli Relish 220g,2.00,unit,91p,100g
Twinings Cold In'fuse Passionfruit Mango & Orange 30g 12 Infusers,3.80,unit,12.67,100g
The Spice Tailor Plain Naans Hand-Streched & Flame-Baked x2 220g,2.00,unit,91p,100g
Crazy Jack Sesame Seeds Organic 100g,2.00,unit,2.00,100g
Montezuma's Absolute Black 100% Cocoa Solids with Almonds Dark Chocolate Bar 90g,2.50,unit,2.78,100g
Verival Organic Crunchy Spelt Granola Cereal 375g,3.00,unit,80p,100g
Pakeeza Mango Lassi 1kg,3.20,unit,32p,100g
Karyatis Seafood Salad 200g (120g*),3.65,unit,3.04,100g
Sea Isle Strawberry Flavour Syrup 750ml (Sugar levy applied),2.15,unit,29p,100ml
Sainsbury's Pickling Spice 30g,1.00,unit,33p,10g
Walkers Baked Ready Salted Crisps 37.5g,75p,unit,2.00,100g
Sainsbury's Pigs In Blankets Pot Noodle 80g,1.00,unit,1.25,100g
Thorntons Continental Famous Desserts Box 294g,6.00,unit,2.04,100g
Sainsbury's Home Aluminium Saucepan 15cm,6.00,unit,6.00,ea
Starbucks by Nescaf Dolce Gusto Toffee Nut Latte Coffee Limited Edition x12 Pods 12 Drinks,3.50,unit,2.74,100g
Sainsbury's Chicken Flavour Savoury Rice 105g,50p,unit,4.76,kg
Nakd Peanut Chocolish Fruit & Nut Cereal Bars 4x35g,3.00,unit,2.14,100g
Fray Bentos Meaty Puds Just Steak 200g,1.60,unit,8.00,kg
Sainsbury's Caramel Rooibos Infusion Tea Bags Taste the Difference x20 40g,1.75,unit,4.38,100g
Sainsbury's Coffee Pod Advent Calendar Taste the Difference 124g,50p,unit,40p,100g
The Spice Tailor Delhi Biryani 360g,3.20,unit,89p,100g
Sainsbury's Deliciously Free From Multiseed Round Rolls 300g,1.85,unit,66p,100g
Sainsbury's Hot & Spicy Sliced Pickled Beetroot in Vinegar 340g,70p,unit,35p,100g
Emily Fruit Crisps Crunchy Apple 15g,85p,unit,5.67,100g
Uncle Bens Vegetable Pilau Rice 250g,1.00,unit,4.00,kg
Osem Chicken Soup 400g,3.30,unit,83p,100g
Batchelors Pasta 'n' Sauce Cheese & Broccoli 65g,70p,unit,1.08,100g
Mighty Pea Unsweetened Milk Alternative 1L,2.00,unit,2.00,ltr
Sainsbury's Tandoori Curry Blend 80g,1.00,unit,13p,10g
Peperami Original 22.5g,75p,unit,3.33,100g
Red's Unholy BBQ Sauce 320g,2.00,unit,63p,100g
Walkers Oven Baked Prawn Cocktail Snacks 6x25g,1.70,unit,1.13,100g
Sainsbury's Home Non Stick Roasting Tin 38cm,4.00,unit,4.00,ea
Tymbark Cactus Drink 1L,1.20,unit,12p,100ml
Hubbard's Foodstore Ground Coffee 227g,1.09,unit,48p,100g
Sainsbury's Cheese&onion Chickpea Snacks 6pk 120g,1.00,unit,83p,100g
Rubicon Still Guava Juice Drink 1L,1.50,unit,1.50,100ml
Graal Mackerel Fillets in Tomato Sauce 170g,1.15,unit,67p,100g
Starbucks by Nescaf Dolce Gusto Caramel Macchiato Coffee x12 Pods 12 Drinks,3.00,unit,2.33,100g
Mallow & Marsh Salted Caramel Marshmallows 85g,2.00,unit,2.35,100g
Maggi So Juicy Rustic Chicken 44g,1.00,unit,3.33,100g
Starbucks Pike Place Medium Roast Whole Bean Coffee Bag 200g,3.00,unit,1.50,100g
Cocoa & Co. Belgian Chocolate Pug 135g,4.00,unit,2.96,100g
U:ME Coconut Oil Blend Spray 200ml,2.50,unit,1.25,100ml
Green & Black's Dark Chocolate Salted Caramel & Almonds Bag 120g,3.00,unit,2.50,100g
Creative Nature Whole Grain Banana Bread Mix 250g,3.50,unit,1.40,100g
Primavera Del Grano Penne Pasta 5kg,4.00,unit,8p,100g
Fudco Dhana Powder 100g,1.00,unit,1.00,100g
Fudco Flaked Almonds 250g,4.00,unit,1.60,100g
Twix Xtra Chocolate Biscuit Twin Bars 75g,85p,unit,1.13,100g
Satonoyuki Tofu 300g,2.00,unit,67p,100g
Flying Goose Sriracha Hot Chilli Sauce 455ml,3.00,unit,66p,100g
Terry's Milk Chocolate Orange Bar 90g,1.00,unit,1.11,100g
Sainsbury's Deliciously Free From White Choc Chips 100g,1.50,unit,1.50,100g
Polish Specialities Gherkins in Brine 700g,1.20,unit,17p,100g
Sainsbury's Free From Mini Chocolate Logs x4 155g,2.50,unit,1.61,100g
Taylors Hot Lava Java Coffee Bags 75g,3.00,unit,4.00,100g
Dr. Oetker Celebration Candles x6,1.70,unit,1.70,ea
Sainsbury's Gold Edible Glitter Spray 4g,3.00,unit,75.00,100g
Extra Mega Peppermint Chewing Gum Sugar Free Bottle 30 Cubes,2.00,unit,2.00,ea
Fudco Madras Mild Curry Powder 100g,1.30,unit,1.30,100g
Pot Pasta Creamy Carbonara 55g,75p,unit,1.36,100g
Mighty Fine Salted Caramel Honeycomb Dips 90g,2.50,unit,2.78,100g
Dunn's River Fish Seasoning 100g,75p,unit,75p,100g
Pipers Kirkby Malham Chorizo Crisps 150g,2.50,unit,1.67,100g
Sainsbury's Thai Style Seasoning 34g,1.00,unit,29p,10g
Princessa Wafer Bar Hazlenut 34g,55p,unit,1.62,100g
Twinings Superblends Glow Tea 20 Tea Bags,2.70,unit,6.75,100g
Rude Health Gluten Free Organic Sprouted Buckwheat Flour 500g,5.00,unit,10.00,kg
Napolina Spaghetti 1kg,1.50,unit,1.50,kg
Genius Gluten Free Gut-Lovin' Cob 385g,3.50,unit,1.00,100g
Sainsbury's Sundried Tomato & Grilled Aubergine Pasta Sauce Taste the Difference 350g,1.50,unit,43p,100g
Sainsbury's Tuna Flakes in a Coronation Dressing 80g,1.00,unit,1.25,100g
Tabitha's Chin Chin Original 140g,1.10,unit,79p,100g
Oshee Vitamin Water Lemon & Orange Flavour 555ml,1.10,unit,20p,100ml
Sainsbury's Mackerel Fillets in Smoky BBQ Sauce 125g,80p,unit,64p,100g
Sainsbury's Red Velvet Cake & Cupcake Kit 570g,1.95,unit,34p,100g
The Coconut Collaborative Banoffee Pots 4x45g,2.00,unit,1.11,100g
Heinz Seriously Good Squeezy Mayo 540g,2.00,unit,37p,100g
Nestle Nido Full Cream Milk Powder 400g,3.00,unit,75p,100g
Sainsbury's Cake Tin Liners x50,4.00,unit,8p,ea
Lancashire Farm Greek Yogurt 1kg,2.25,unit,2.25,kg
Sainsbury's BBQ Crunch Mix 120g,1.25,unit,1.04,100g
Twinings Cold In'fuse Rose Lemonade 12 Infusers,3.80,unit,12.67,100g
Tic Tac Lime & Orange 100 48g,1.40,unit,2.92,100g
Leon The Original Vegan Mayo 240g,2.50,unit,1.02,100ml
Sainsbury's Glimmer Sugar Gold 75g,1.00,unit,1.33,100g
Heinz Big Soup Chicken & Leek 400g,1.25,unit,31p,100g
Sainsbury's On the Go Dark Chocolate Corn Thins 32.5g,50p,unit,1.54,100g
Sainsbury's Cranberry & White Chocolate Granola 500g,1.60,unit,32p,100g
Terry's Chocolate Orange Segsations 240g,3.50,unit,1.46,100g
Sainsbury's Tuna Flakes in a Teriyaki Dressing 80g,1.00,unit,1.25,100g
Fray Bentos Chicken Meatballs in Barbecue Sauce 380g,80p,unit,2.11,kg
The Spice Tailor Tandoori Marinade Kit Classic 170g,2.00,unit,1.18,100g
Nairn's Gluten Free Savoury Biscuit Selection 235g,3.75,unit,1.60,100g
Sweetpea Pantry Gluten Free Super Oat Flapjack Mix 230g,2.70,unit,1.17,100g
Off the Eaten Path Rice Chickpea & Purple Sweet Potato Sea Salt Chips 120g,1.50,unit,1.25,100g
Lee Kum Kee Hoisin Sauce 210g,1.95,unit,93p,100g
No Dough Pizza Co Vegan Margherita 315g,3.50,unit,1.11,100g
Wilkin & Sons Ltd Tiptree Chilli Chutney 220g,2.30,unit,1.05,100g
Sacla' Vegan Bolognese Sauce with Pea Protein 350g,2.50,unit,71p,100g
Kit Kat Finger Honeycomb Chocolate Biscuit Bar Multipack x9,2.00,unit,1.07,100g
Nissin Soba Noodles Bag Classic 109g,1.00,unit,91p,100g
Hilltop Honey Cut Comb in Acacia Honey 340g,5.00,unit,1.47,100g
Sainsbury's Pimento Stuffed Olives & Manchego 300g,3.50,unit,1.17,100g
Tymbark Apple Cherry Drink 2L,1.60,unit,8p,100ml
Willie's Cacao Las Trincheras Gold Venezuelan Dark Chocolate Bar 26g,65p,unit,2.50,100g
Cadbury Dairy Milk 30% Less Sugar Chocolate Bar 35g,70p,unit,2.00,100g
Sainsbury's Chocolate Date Selection 165g,4.50,unit,2.73,100g
Tracklements Rich Redcurrant Jelly 250g,2.60,unit,1.04,100g
Cadbury Heroes Tin 800g,8.00,unit,1.00,100g
Nescaf Dolce Gusto Mexico Chiapias Americano Coffee x12 Pods 12 Drinks,3.50,unit,3.50,100g
Dr. Oetker Easy Swirl Pretty Pink Cupcake Icing 180g,3.70,unit,2.06,100g
Melvit Baking Flour 1kg,90p,unit,90p,kg
Cadbury Roses Tin 800g,8.00,unit,1.00,100g
Milton's Original Multi-Grain Baked Crackers with Toasted Sesame Seeds 170g,1.30,unit,76p,100g
Ktc Chick Peas 1kg,2.25,unit,23p,100g
Kinder Schoko-bons 70g,1.00,unit,1.43,100g
Fudco Deluxe Nuts & Raisins Mix 500g,6.00,unit,1.20,100g
Cadbury Double Chocolate Delight Sandwich 175g,1.50,unit,86p,100g
Peperami Pep'd Up Chicken Bites 50g,1.00,unit,2.00,100g
Sainsbury's Bread Sauce 300g,1.70,unit,57p,100g
Nomo Vegan & Free From Caramel Filled Chocolate Drops 93g,5.00,unit,5.32,100g
Sainsbury's Spiced Glazed Gammon Crisps Limited Edition Taste the Difference 150g,1.00,unit,67p,100g
Telma Beef Soup Cubes x3 45g,50p,unit,1.11,100g
Sainsbury's Lungo Coffee Pods x30 156g,4.75,unit,3.04,100g
Tate & Lyle Fairtrade 1:1 Jam Sugar 1kg,2.15,unit,2.15,kg
Sainsbury's Garlic Mayonnaise 280ml,85p,unit,30p,100ml
Sainsbury's Guatemalan Coffee Pods Taste the Difference x10 52g,2.50,unit,4.81,100g
