Description,Price/Unit,Unit,Price/Measure,MeasureOatly Oat Drink Skinny Chilled 1L,1.80,unit,1.80,ltr
Aunt Bessie's Golden Crumble Mix 400g,1.00,unit,2.50,kg
Sainsbury's Bouquet Garni 5g,85p,unit,1.70,10g
Snack A Jacks Cheese Rice Cakes 120g,1.80,unit,1.50,100g
Seeds of Change Organic Curry Sauce Tikka Masala  350g,1.50,unit,43p,100g
Sacla' Pesto Pots No. 1 Classic Basil 2x45g,1.50,unit,1.67,100g
Mug Shot Noodles Peri Peri Flavour 56g,50p,unit,8.93,kg
Heinz Tomato Ketchup Fiery Chilli 255g,1.30,unit,51p,100g
Walkers Quavers Cheese Snacks 24x16g,3.00,unit,78p,100g
Sainsbury's Deliciously Free From Oat & Sultana Cookies 150g,1.80,unit,1.20,100g
Chupa Chups Sugar Free Lolly 11g,25p,unit,2.27,100g
Sainsbury's Dried Pinto Beans Bag 500g,1.15,unit,2.30,kg
Patak's Korma Paste Pots 2 x 70g,1.00,unit,71p,100g
Kallo Yeast Free Vegetable Stock Cubes 6x11g,1.00,unit,1.52,100g
Siro Vanilla Sugar Free Wafer Biscuits 260g,1.00,unit,38p,100g
Sainsbury's Chicken Jalfrezi 400g,1.50,unit,3.75,kg
Jamie Oliver Pink Salt Grinder 90g,3.00,unit,33p,10g
Ko-Lee Bang! Bang! Noodles Chicken Feel Good Flavour 65g,90p,unit,13.85,kg
Tassimo Creamer from Milk Pods x16,3.50,unit,1.02,100g
Sainsbury's Spanish Sherry Vinegar 375ml,1.70,unit,4.53,ltr
Sainsbury's White Wine Vinegar SO Organic 500ml,1.60,unit,3.20,ltr
BFree Snack Size Pitta Pockets 6x32g,2.50,unit,1.30,100g
Vifon Golden Chicken Noodle Soup 70g,50p,unit,71p,100g
Fridge Raiders Slow Roasted Chicken Snack Bites 3x 22.5g,1.60,unit,2.37,100g
PG tips Decaffeinated Biodegradable Black Tea Bags x180,5.00,unit,96p,100g
Tropicana Orange Juice Smooth 300ml,1.50,unit,50p,100ml
Alpro Strawberry Yoghurt Alternative 500g,1.75,unit,35p,100g
Eat Real Hummus Lentil Quinoa Chips X5 116g,1.95,unit,1.68,100g
Fudco Deluxe Assorted Nuts 500g,6.00,unit,1.20,100g
Options White Chocolate 220g,4.00,unit,1.82,100g
Schar Lactose Free Margherita Pizza 280g,2.50,unit,8.33,kg
Sainsbury's Fragrant Tikka Curry Paste 200g,1.35,unit,68p,100g
Knorr Lamb Stock Pot 4x28g,1.45,unit,1.29,100g
Clipper Organic Nettle 20 Tea Bags 30g,2.00,unit,6.67,100g
Sensations Mumbai Streetmix Nuts 106g,1.25,unit,1.18,100g
Aunty's Ginger Syrup Steamed Pudding 2x95g,1.00,unit,53p,100g
Jamie Oliver Microwave Ready to eat Sweet Chilli Spelt 250g,2.30,unit,9.20,kg
Hillfarm Extra Virgin Cold Pressed Rapeseed Oil 500ml,4.00,unit,80p,100ml
Lindt Lindor Treat Bar 38g,65p,unit,1.71,100g
Idahoan Perfect Mash Buttery 109g,1.00,unit,9.17,kg
Sainsbury's Mellow Roast Instant Coffee 200g,2.50,unit,1.25,100g
Birds Eye Gluten Free Fish Fillets in Breadcrumbs x2 250g,3.00,unit,12.00,kg
Weetabix On the Go Breakfast Protein Drink Strawberry & Raspberry 275ml,1.75,unit,64p,100ml
Batchelors Super Noodles Pot BBQ Beef 75g,50p,unit,6.67,kg
Napolina Chopped Tomatoes with Herbs 400g,1.25,unit,3.13,kg
Sainsbury's Sauce Flour 500g,65p,unit,1.30,kg
Urban Fruit Gently Baked Coconut Chips 25g,1.00,unit,4.00,100g
Sainsbury's Brazil Nuts SO Organic 100g,2.50,unit,2.50,100g
Rude Health Brown Rice Drink 1L,2.00,unit,2.00,ltr
Quaker Oats Oat Granola Honey & Almond 500g,2.70,unit,54p,100g
Sainsbury's Deliciously Free From Assorted Jam Tarts x6,2.00,unit,77p,100g
Merchant Gourmet Smoky Spanish-Style Grains & Rice 250g,2.00,unit,8.00,kg
Patak's Pasanda Sauce 450g,1.50,unit,33p,100g
Walkers Ready Salted Crisps 175g,1.00,unit,57p,100g
Dunn's River All Purpose Seasoning 100g,75p,unit,75p,100g
Sainsbury's Tikka Curry Powder 90g,1.00,unit,11p,10g
Sainsbury's Minced Beef & Onion 198g,1.10,unit,5.50,kg
KTC Pure Butter Ghee 500g,5.50,unit,1.10,100g
Ritter Sport Rum Raisin & Hazelnut 100g,1.00,unit,1.00,100g
PG tips Original Tea Granules x80 Cups,3.00,unit,7.50,100g
Branston Spaghetti Loops 395g,50p,unit,1.27,kg
Nakd Blueberry Muffin Fruit & Nut Bar 35g,75p,unit,2.14,100g
Kinder Chocolate Medium Bars 5x21g,1.00,unit,95p,100g
Sainsbury's Dill 13g,1.00,unit,77p,10g
Sainsbury's Curry Leaves 3g,85p,unit,4.25,10g
Dr. Oetker Lettered Happy Birthday Candles,1.50,unit,1.50,ea
Schar Gluten Free White Rolls 6x58g,2.50,unit,7.18,kg
Maltesers Chocolate Bag 37g,65p,unit,1.76,100g
Old Jamaica Pineapple Soda 330ml,35p,unit,11p,100ml
Osem Bamba Snacks 25g,45p,unit,1.80,100g
Sainsbury's Deliciously Free From Macaroni 500g,1.20,unit,24p,100g
Baxters Super Good Root Vegetable & Turmeric 400g,1.25,unit,31p,100g
Loyd Grossman Pour Over Sauce Peppercorn & Brandy 170g,1.25,unit,73p,100g
Sainsbury's Dates 40g,50p,unit,1.25,100g
Sainsbury's Pimento Stuffed Olives 907g,1.90,unit,35p,100g
Cadbury Dairy Milk Oreo Bites Bag 110g,1.00,unit,91p,100g
Quaker Oat So Simple Strawberry Jam Porridge Pot 53g,90p,unit,1.70,100g
Twinings Lady Grey Tea 100 Tea Bags,5.30,unit,2.12,100g
Sainsbury's Whole Baby Pickled Beetroot in Vinegar 710g,1.10,unit,27p,100g
Tassimo L'OR Latte Macchiato Caramel Coffee Pods x8,3.50,unit,3.37,100g
Skippy Peanut Butter Crunchy 340g,2.25,unit,66p,100g
Sainsbury's Dried Red Kidney Beans 500g,1.15,unit,2.30,kg
Sainsbury's Ceylon Tea Bags Taste the Difference x80,2.75,unit,1.10,100g
Knorr Stock Cubes Fish 8x10g,1.50,unit,1.88,100g
Sainsbury's Green Chilli Peppers 310g (150g*),1.65,unit,1.10,100g
Eat Natural For Breakfast Gluten Free Buckwheat Toasted Muesli 500g,3.00,unit,60p,100g
Sainsbury's Aromatic Korma Curry Paste 200g,1.35,unit,68p,100g
Dr. Oetker White Chocolate Chip Chunks 100g,1.00,unit,1.00,100g
Sainsbury's Asparagus Cup Soup 4x25g,65p,unit,65p,100g
Twinings Lapsang Souchong Tea 50 Tea Bags,3.50,unit,2.80,100g
Old El Paso Squeezy Chunky Salsa 238g,2.00,unit,84p,100g
Sainsbury's Fairtrade x80 Tea Bags SO Organic 250g,1.50,unit,60p,100g
Sainsbury's Darjeeling Tea Bags Taste the Difference x50,1.75,unit,1.40,100g
Parsons Pickled Mussels 155g,1.30,unit,84p,100g
PomeGreat Chilled Pomegranate Juice Drink 1L,1.50,unit,15p,100ml
Heinz Beanz & Sausages 3x415g,3.00,unit,2.41,kg
Sainsbury's BBQ Popped Potato Chips 88g,1.20,unit,1.36,100g
Amoy Straight to Wok Udon Thick Noodles 2x150g,1.50,unit,50p,100g
Wright's Ciabatta Bread Mix 500g,1.00,unit,2.00,kg
Sainsbury's Goose Fat 320g,3.00,unit,94p,100g
Encona West Indian Original Hot Pepper Sauce 220ml,1.00,unit,45p,100ml
Nairn's Gluten Free Super Seeded Wholegrain Crackers 137g,1.75,unit,1.28,100g
itsu Katsu Rice'Noodles 63g,1.75,unit,27.78,kg
Lotus Biscoff Caramelised Biscuit Spread Crunchy 380g,2.30,unit,61p,100g
Alpro Soya No Sugars UHT Drink 6x1L,8.50,unit,1.42,ltr
Nature's Path Gluten Free Maple Sunrise 332g,3.00,unit,90p,100g
Cofresh Coconut Bar 30g,40p,unit,1.33,100g
Sainsbury's Granola Berries 500g,2.00,unit,40p,100g
Sainsbury's Fairtrade French Style Coffee Strength 4 227g,2.30,unit,1.01,100g
Loacker Napolitaner Wafer 90g,1.00,unit,1.11,100g
Polish Specialities Pickled Gherkins 850g (450g*),1.20,unit,26p,100g
Ferrero Rocher Collection 172.2g,5.00,unit,2.91,100g
Tetley Extra Strong Tea Bags x75,2.60,unit,1.10,100g
Merchant Gourmet Chestnut Puree 200g,1.25,unit,6.25,kg
Nissin Soba Yakitori Chicken Noodles with Yakisoba Sauce 89g,1.25,unit,14.04,kg
Bare Naked Rice 250g,2.00,unit,8.00,kg
St. Dalfour Wild Blueberry Fruit Spread 284g,1.70,unit,60p,100g
Lavazza A Modo Mio Passionale Coffee Capsules x16,4.40,unit,3.67,100g
Rolo Chocolate 4x41.6g,1.00,unit,56p,100g
Fudco Cashew Nuts 250g,3.80,unit,1.52,100g
Sainsbury's Long Grain Rice 2kg,2.30,unit,1.15,kg
Sainsbury's Gherkins in Sweet Vinegar 340g (180g*),1.00,unit,56p,100g
Sainsbury's Sweetcorn Relish 320g,1.20,unit,38p,100g
itsu Crispy Seaweed Thins Sweet Soy & Sea Salt 3x5g,2.00,unit,13.33,100g
Cadbury Fudge Treat Size Chocolate Bars 15x 202g,2.50,unit,1.24,100g
Nature's Store Hazelnut & Chocolate Spread 350g,2.25,unit,64p,100g
Ryvita Protein Crunchy Rye Bread Red Quinoa & Sesame 5x40g,1.60,unit,80p,100g
Nurishment The Original Vanilla Flavour Drink 400g,1.00,unit,25p,100g
Polo Spearmint Mints 4x34g,1.00,unit,74p,100g
Sainsbury's Fruit & Nut Milk Chocolate 200g,1.25,unit,63p,100g
Genius Gluten Free Steak Pies x2,3.25,unit,10.16,kg
Napolina 50/50 Fusilli Pasta 500g,1.00,unit,2.00,kg
Capri-Sun No Added Sugar Orange 8 x 200ml,2.00,unit,13p,100ml
Montezumas Organic 73% Cocoa Dark Chocolate Buttons Bag 90g,2.50,unit,2.78,100g
Cerebos Iodised Salt 400g,1.00,unit,2.50,kg
Mackays Seedless Bramble Preserve 340g,1.00,unit,30p,100g
Quaker Oat So Simple Cuppa Porridge Golden Syrup 5x55.7g,2.60,unit,93p,100g
Sainsbury's Meaty Variety Assorted Crisps 12x25g,1.50,unit,50p,100g
Batchelors Super Noodles Peri Peri Chicken 90g,50p,unit,5.56,kg
Belazu Preserved Lemons 350g (220g*),3.00,unit,1.36,100g
Green & Blacks Velvet Edition Mint Dark Chocolate Bar 90g,1.50,unit,1.67,100g
Sainsbury's Thick Soft Multiseed Farmhouse 800g,85p,unit,11p,100g
Off the Eaten Path Salted Rice & Pea Chips 120g,2.25,unit,1.88,100g
Nando's Peri-Peri Sauce Lemon and Herb Extra Mild 125g,2.00,unit,1.60,100g
Sainsbury's Camomile Tea Bags x80 160g,2.20,unit,1.83,100g
Whip Vanilla Chocolate Multipack x3 27.8g,1.50,unit,1.80,100g
Monin Vanilla Syrup 250ml,3.00,unit,1.20,100g
Cadbury Wispa Bar,70p,unit,1.94,100g
Spam Bacon 200g,2.20,unit,1.10,100g
Kallo Very Low Salt Beef Stock Cubes 6x8g,1.20,unit,2.50,100g
L'OR Nespresso Compatible Espresso Supremo x10 Aluminium Coffee Capsules Intensity 10,3.00,unit,5.77,100g
Newman's Own Balsamic Dressing 250ml,1.75,unit,70p,100ml
Princes Tuna Chunks in Sunflower Oil 3x80g (3x56g),2.50,unit,1.49,100g
Fibre One 90 Calorie Carrot Cake Bars 4x25g,2.90,unit,2.90,100g
Askeys Treat Toffee Dessert Sauce 325g,1.30,unit,40p,100g
Flora Spray Oil 200ml,1.50,unit,75p,100ml
Frylight Rapeseed Oil Spray 190ml,2.30,unit,1.21,100ml
Taylors of Harrogate Rich Italian Ground Coffee 454g,6.50,unit,1.43,100g
Natco Coriander Ground 100g,80p,unit,8p,10g
Heinz Tomato Ketchup Less Sugar 550g,2.00,unit,36p,100g
Sainsbury's Blackcurrants In Juice 290g,1.05,unit,91p,100g
La Boulangere Vegan Pain Au Chocolat x6,2.50,unit,42p,ea
Sainsbury's Cream of Tartar 160g,1.25,unit,7.81,kg
Sainsbury's Papua New Guinea Coffee SO Organic 227g,3.50,unit,1.54,100g
Sainsbury's Spanish Forest Honey Taste the Difference 340g,3.60,unit,1.06,100g
Twinings Camomile Team 80 Tea Bags,4.00,unit,3.33,100g
Sainsbury's Apple & Herb Stuffing Mix 130g,75p,unit,5.77,kg
Jamie Oliver Black Peppercorn Grinder 50g,3.00,unit,60p,10g
Sainsbury's All Butter Shortbread Petticoat Tails 360g,1.75,unit,49p,100g
Sainsbury's Taste the Difference Moroccan Almond Extract 38ml,1.50,unit,39p,10ml
Illy Espresso Dark Roast Ground Coffee 250g,7.00,unit,2.80,100g
Sainsbury's Wholegrain Fruit & Fibre 750g,1.60,unit,21p,100g
Schar Gluten Free Panini Rolls x3,1.50,unit,67p,100g
Jutrzenka Be-be Biscuits 16g,15p,unit,94p,100g
McDougalls Premium Plain Flour 1kg,1.85,unit,1.85,kg
Sharwood's Mango Spreadable Chutney 360g,1.80,unit,50p,100g
Laciate 3.2% UHT Milk 1L,1.00,unit,1.00,ltr
Sainsbury's Orange Blossom Honey Taste the Difference 340g,3.60,unit,1.06,100g
Sainsbury's Nutty Muesli 750g,2.00,unit,27p,100g
Kikkoman Naturally Brewed Soy Sauce 250ml,2.70,unit,1.08,100ml
Sainsbury's Greek Kalamata Extra Virgin Olive Oil Taste the Difference 500ml,4.75,unit,95p,100ml
L'OR Classique Instant Coffee 165g,6.00,unit,3.64,100g
Napolina Gluten Free Red Lentil Penne 250g,1.75,unit,7.00,kg
Sainsbury's Chocolate Chunk Cookies 200g,90p,unit,45p,100g
Candyland Chewy Nougat 35g,35p,unit,1.00,100g
Options Mint Madness Powder 220g,4.00,unit,1.82,100g
Nescafe Gold Cinnamon Bun Latte Instant Coffee Sachets x8,1.50,unit,1.04,100g
Haywards Hot & Spicy Pickled Onions 400g,1.00,unit,47p,100g
Lizi's High Protein Granola 350g,3.70,unit,1.06,100g
Sainsbury's Chilli Paste 80g,1.45,unit,1.81,100g
Sainsbury's Beef Curry Mild 400g,1.50,unit,3.75,kg
Hartley's Jelly Black Cherry 135g,65p,unit,48p,100g
Sainsbury's Stir Fry Oil 250ml,1.65,unit,66p,100ml
Pukka Chamomile Vanilla & Manuka Honey Tea Bags x20,3.00,unit,6.25,100g
Heinz Garlic Sauce 225g,1.00,unit,45p,100g
Samlip Fresh Udon 200g,60p,unit,30p,100g
Mrs. Crimble's Gluten Free Jam Coconut Rings x6 240g,1.50,unit,63p,100g
Schwartz Shepherds Pie Mix 38g,70p,unit,1.84,100g
Sainsbury's Malt Vinegar 284ml,40p,unit,1.41,ltr
Schwartz Chicken Chasseur Mix 40g,70p,unit,1.75,100g
Grace Mighty Malt Can 330ml (Sugar levy applied),70p,unit,21p,100ml
Walkers Wotsits GIANTS Flamin' Hot Snacks 130g,1.00,unit,77p,100g
Starbucks Doubleshot Espresso No Added Sugar 200ml,1.75,unit,8.75,ltr
Odysea Baked Gigantes Beans 355g,2.50,unit,70p,100g
Starbucks by Nespresso House Blend Coffee x10 Pods 10 Drinks,2.80,unit,4.91,100g
Clipper Fairtrade Tea x100 Tea Bags 312g,3.00,unit,96p,100g
Nando's Coat 'n Cook Lemon & Herb 120g,1.00,unit,83p,100g
Sainsbury's Tuna Drained & Ready Oil 120g,1.40,unit,1.17,100g
KIND Caramel Almond & Sea Salt Snack Bar 40g,1.30,unit,3.25,100g
Metcalfe's Cinema Sweet Popcorn Multipack 6x11g,1.80,unit,2.73,100g
Pizza Express Gluten Free Margherita Pizza 265g,4.50,unit,16.98,kg
Uncle Ben's Sweet & Sour Sauce Original 675g,2.40,unit,36p,100g
Plenish Organic Cashew Dairy Free Drink 1L,2.50,unit,2.50,ltr
Yutaka Sushi Nori Half-Cut x10 14g,1.80,unit,12.86,100g
Hula Hoops Big Hoops Original Potato Rings Crisps 50g,90p,unit,1.80,100g
Heinz Classic Pea & Ham Soup 400g,80p,unit,20p,100g
Tick Tock Rooibos Earl Grey Tea Bags x40 100g,2.15,unit,2.39,100g
Sainsbury's Toasted Sunflower & Pumpkin Seed Mix 30g,50p,unit,1.67,100g
Sarson's Brown Malt Vinegar 568ml,1.15,unit,2.02,ltr
La Doria Ratatouille 390g,70p,unit,1.79,kg
Angel Delight Dessert Pot Strawberry 70g,50p,unit,71p,100g
Nature's Finest Peach in Juice 220g,1.10,unit,82p,100g
Sainsbury's Fusilli 3kg,2.85,unit,95p,kg
Sainsbury's Beef Bolognese 400g,1.50,unit,3.75,kg
Twix White Chocolate Biscuit Fingers 9x23g,1.25,unit,61p,100g
Sainsbury's Thai Basil 20g,90p,unit,45p,10g
Clipper Organic Decaf Everyday Tea x80 Tea Bags 250g,5.00,unit,2.00,100g
Propercorn Peanut Butter & Almond Popcorn 90g,1.00,unit,1.11,100g
Quaker Oat So Simple Big Bowl Original Porridge 6x38.5g,1.25,unit,54p,100g
Yutaka Korean Kimchi 215g,2.75,unit,1.28,100g
Ricola Sugar Free Mountain Mint Drops 45g,1.30,unit,2.89,100g
Sainsbury's Celery Salt 78g,85p,unit,11p,10g
Nando's Peri-Peri Salt 70g,2.00,unit,29p,10g
Walkers Max Crisps Paprika 150g,1.00,unit,67p,100g
Maggi So Juicy Italian Chicken Recipe Mix 37g,1.00,unit,2.70,100g
Whole Earth Organic Crunchy Palm Oil Free Peanut Butter 227g,2.75,unit,1.21,100g
Bovril Beef Stock Cubes 12x10g,1.25,unit,1.04,100g
Sainsbury's Californian Prunes in Fruit Juice 410g,1.00,unit,43p,100g
Sainsbury's Walnut Oil 250ml,1.90,unit,76p,100ml
Bisto Gluten Free Gravy Granules 175g,3.00,unit,1.71,100g
Sainsbury's Crinkle Gherkins in Vinegar 340g,1.00,unit,56p,100g
Rude Health Bircher Muesli 450g,3.00,unit,67p,100g
Finn Crisp Original Rye 250g,1.30,unit,52p,100g
Sula Sugar Free Mint Humbugs Boiled Sweets 42g,1.10,unit,2.62,100g
Nature's Finest Tropical Fruits in Juice 200g,1.10,unit,1.02,100g
Sainsbury's Belgian Almond Florentines Taste the Difference 100g,2.00,unit,2.00,100g
Sainsbury's Casarecce Taste the Difference 500g,1.70,unit,3.40,kg
BEAR Fruit Yoyos Super Sour Blackcurrant & Apple Multipack x5 20g,2.40,unit,2.40,100g
Ambrosia My Mini Custard 30% Reduced Sugar 6x55g,1.80,unit,55p,100g
Sainsbury's Seafood Sauce 525ml,1.50,unit,29p,100ml
Sainsbury's SO Cranberries Organic 100g,2.20,unit,22.00,kg
Fridge Raiders Southern Style Chicken Snack Bites 6x 22.5g,2.60,unit,1.93,100g
Extra Peppermint Chewing Gum Sugar Free Multipack 6x10 Pieces,2.00,unit,2.38,100g
Haywards Traditional Onions 400g,1.50,unit,71p,100g
Siro Sugar Free Digestive Biscuits 400g,1.00,unit,33p,100g
Oreo Birthday Party Sandwich Biscuit 154g,1.00,unit,65p,100g
Sainsbury's Deliciously Free From Haddock Fishcakes 270g,2.40,unit,89p,100g
Sainsbury's Reduced Sodium Salt 350g,1.00,unit,2.86,kg
Sharpham Park Spelt Bran Flakes 375g,3.15,unit,84p,100g
Lindt Swiss Luxury Selection Chocolate Box 195g,6.00,unit,3.08,100g
Munchy Seeds Honey Seeds 25g,70p,unit,2.80,100g
Oomf! Protein Porridge Oats Golden Syrup 75g,1.10,unit,1.47,100g
Bute Island Foods Ltd Grated Sheese Vegan Mozzarella Style 200g,2.50,unit,1.25,100g
Hermesetas Mini Sweeteners x400 Tablets,2.00,unit,2.00,ea
Nature's Finest Tropical Fruits in Juice 700g,2.50,unit,67p,100g
Encona Original Hot Pepper Sauce Squeezy 285g,2.00,unit,70p,100ml
Haribo Jelly Babies Double Trouble Sweets Bag 190g,1.35,unit,71p,100g
McVitie's Digestives Dark Chocolate x2 Biscuits 316g,2.00,unit,31p,100g
Schwartz Creamy Parsley Sauce Mix 35g,80p,unit,3.08,100g
Tick Tock Organic Rooibos Green Tea x42 Tea Bags 72g,2.15,unit,2.99,100g
BFree Sweet Potato Wraps x6,2.75,unit,1.09,100g
Oreo Thins Original Sandwich Biscuit 192g,1.00,unit,52p,100g
Lavazza Qualita Rossa Coffee Beans 250g,3.70,unit,1.48,100g
Weetabix On the Go Breakfast Protein Drink Vanilla 275ml,1.75,unit,64p,100ml
Cadbury Dairy Milk Big Taste Triple Chocolate Bar 300g,3.00,unit,1.00,100g
Seeds of Change Organic Curry Sauce Korma 350g,1.50,unit,43p,100g
Suempol Smoked Salmon 100g,2.40,unit,2.40,100g
Patak's Tandoori Spice Marinade 312g,2.20,unit,71p,100g
Colman's Sauce Mix Pepper Sauce 40g,50p,unit,1.25,100g
Doves Farm Gluten Free Quick Yeast 125g,1.25,unit,1.00,100g
Eat Natural Simply Vegan Peanuts Coconut and Chocolate Fruit & Nut Bars 3 x 45g,2.00,unit,1.48,100g
Sainsbury's Christmas Fruit & Nut Mix 250g,2.50,unit,1.00,100g
Sainsbury's Mixed Peppercorns 43g,1.00,unit,23p,10g
Sensations Mexico City Streetmix Nuts 115g,1.25,unit,1.09,100g
Kellogg's Coco Pops Cereal 375g,2.00,unit,53p,100g
Oxo Beef with Onion & Rosemary Stock Pots x4 80g,1.00,unit,1.25,100g
Sainsbury's Scone Mix 320g,70p,unit,2.19,kg
Sainsbury's Green Olive Tapenade With Herbs 100g,1.65,unit,1.65,100g
Batchelors Pasta 'n' Sauce Spicy Arrabbiata 110g,75p,unit,7.58,kg
Oxo Chicken with Garlic & Thyme Stock Pots x4 80g,1.00,unit,1.25,100g
Sainsbury's Quinoa 500g,3.20,unit,6.40,kg
Angel Delight Dessert Pot Butterscotch 70g,50p,unit,50p,100g
Sainsbury's Hot Lime Pickle 200g,1.10,unit,58p,100g
Whole Earth Organic Smooth Peanut Butter 340g,3.30,unit,97p,100g
Dorset Cereals Simply Delicious Muesli 650g,3.00,unit,46p,100g
Glenryck Pilchards in Brine 155g (93g*),70p,unit,75p,100g
Jamie Oliver Microwave Ready to eat Moroccan Bulgur Wheat 250g,2.30,unit,9.20,kg
Fruit Bowl Strawberry Peelers 5x16g,2.25,unit,2.81,100g
BFree Multigrain Wraps 6 x 46g (276g),3.50,unit,1.39,100g
Schwartz Chicken & Leek Bake Mix 35g,70p,unit,2.00,100g
Princes Ox Tongue 184g,3.35,unit,1.82,100g
Sainsbury's British Cold Pressed Rapeseed Oil Taste the Difference 500ml,3.10,unit,62p,100ml
John West Sild in Tomato Sauce 110g,1.40,unit,1.27,100g
Nature's Finest Pear in Juice 400g,1.70,unit,77p,100g
Whitworths Shots Single Toffee Pecan 25g,50p,unit,2.00,100g
Cadbury Bitsa Wispa Chocolate Big Share Bag 222g,2.50,unit,1.13,100g
Sainsbury's Thick Soft White Farmhouse 800g,75p,unit,9p,100g
Walkers Mint Toffees Bag 150g,1.00,unit,67p,100g
John West No Drain Fridge Pot Tuna Steak with a Little Spring Water 3 x 110g,3.50,unit,1.06,100g
Heinz No Added Sugar Spaghetti Hoops 205g,55p,unit,2.68,kg
Green & Blacks Velvet Edition Salted Caramel Dark Chocolate Bar 90g,1.50,unit,1.67,100g
Sainsbury's Cream Of Tartar 6x5g 30g,1.20,unit,40.00,kg
Extra Peppermint Chewing Gum Sugar Free 10 pieces,60p,unit,4.29,100g
Blue Dragon Reduced Sugar Thai Sweet Chilli Sauce 350g,2.00,unit,57p,100g
Sainsbury's Brown Linseed 100g,90p,unit,9.00,kg
Hellmann's Fat Free Salad Dressing 210ml,1.65,unit,79p,100ml
Bahlsen Choco Moments Crunchy Mint Biscuits 120g,1.25,unit,1.04,100g
Sainsbury's Madras Sauce 500g,80p,unit,16p,100g
Kabuto Rice Noodles Chicken Pho Gluten Free 65g,2.00,unit,30.77,kg
Copella Cloudy Apple Juice 300ml,1.50,unit,50p,100ml
Sainsbury's Black Bean Stir Fry Sauce 120g,50p,unit,42p,100g
Nairn's Gluten Free Super Seeded Oatcakes 180g,1.80,unit,1.00,100g
Dorset Cereals Simply Nutty Muesli 560g,3.00,unit,54p,100g
Sainsbury's Mixed Marinated Greek Olives Taste the Difference 200g,3.15,unit,1.58,100g
Deliciously Ella Original Granola 500g,4.00,unit,80p,100g
Natco Garlic Powder 100g,1.00,unit,1.00,100g
Dolmio Bolognese Pasta Sauce Smooth Tomato 750g,2.00,unit,27p,100g
Loyd Grossman Pour Over Sauce Parmesan & Cheddar 170g,1.25,unit,73p,100g
Quaker Oat So Simple Original Porridge Big Pot 60.3g,1.00,unit,1.67,100g
Danio Vanilla Fromage Frais 150g,55p,unit,39p,100g
Sainsbury's Ploughmans Plum Chutney 300g,1.15,unit,37p,100g
Sainsbury's Red Plums In Light Syrup 567g,1.00,unit,33p,100g
Silver Spoon Truvia Pouch 150g,3.00,unit,20.00,kg
Bonne Maman Fig Conserve 370g,2.60,unit,70p,100g
Sainsbury's Fruit & Nut Medley 200g,1.55,unit,78p,100g
Sainsbury's Earl Grey Loose Tea Taste the Difference 125g,1.50,unit,1.20,100g
Haywards Sweet Silverskins 400g,1.00,unit,46p,100g
Manomasa Manchego & Olive Tortillas 160g,2.00,unit,1.25,100g
Lavazza Qualita Oro Ground Coffee 250g,4.10,unit,1.64,100g
Sainsbury's Fairtrade Decaff Coffee Filters x10 75g,2.20,unit,2.93,100g
Mrs. Crimble's Gluten Free Sage & Onion Stuffing Mix 150g,2.00,unit,1.33,100g
Sharwood's Chinese Curry Cooking Sauce 425g,1.85,unit,44p,100g
Humzingers Strawberry 130g,2.00,unit,1.54,100g
Sharwood's Chow Mein Stir Fry 195g,1.45,unit,74p,100g
Homepride Chasseur Cooking Sauce 400g,1.60,unit,40p,100g
La Boulangere Vegan Croissants x6,2.50,unit,42p,ea
Sainsbury's Duo Chocolate Swirl Spread 400g,1.65,unit,41p,100g
Bisto Best Beef Gravy 390g,3.70,unit,95p,100g
Propercorn Lightly Sea Salted Popcorn Multipack 6 x 10g,1.80,unit,3.00,100g
Sainsbury's Fairtrade Brazil Nuts 100g,2.25,unit,2.25,100g
Tilda Firecracker Hot Spicy Basmati Rice 250g,1.50,unit,6.00,kg
Freedom Mallows Vegetarian Mini Pink & White Vanilla Marshmallow Bites 75g,2.00,unit,2.67,100g
Nandos Peri-Peri Marinade Lemon and Herb Extra Mild 260g,2.00,unit,77p,100g
Ambrosia Strawberry Devon Custard Pot 150g,50p,unit,33p,100g
Sainsbury's Raspberry Coulis Taste the Difference 250g,2.00,unit,80p,100g
Green's Supreme Golden Ale (Gluten Free) 330ml,1.85,unit,5.61,ltr
Belazu Ingredient Co. Italian Basil Pesto 165g,2.85,unit,1.73,100g
Sainsbury's Whole Chestnuts 400g,2.00,unit,5.00,kg
Grace Aloe Vera Drink Original 500ml,90p,unit,18p,100ml
Sainsbury's Hazelnut Chocolate Spread 200g,1.25,unit,63p,100g
Double Dipped Chocolate Toffees 135g,1.00,unit,74p,100g
Granose Falafel Mix 120g,1.20,unit,10.00,kg
Rowntree's Fruit Pastilles Sweets Tube 52.5g,65p,unit,1.24,100g
McVitie's Jaffa Cakes Snack Pack 40g,60p,unit,1.50,100g
Quaker Oat So Simple Gluten Free Original Porridge 10x35g,3.20,unit,91p,100g
Elizabeth Shaw Famous Names The Signature Collection Finest Liqueur Chocolates 185g,4.50,unit,2.73,100g
Sainsbury's Ready Salted Potato Fries 120g,1.00,unit,83p,100g
CafePod Nespresso Compatible Supercharger Espresso Aluminium Capsules x10,3.00,unit,5.45,100g
Sainsbury's Hedgerow Conserve Taste The Difference 340g,1.60,unit,47p,100g
Old Jamaica Cream Soda 330ml,35p,unit,11p,100g
Mornflake Superfast Oats 2kg,2.55,unit,1.28,kg
Swizzels Chew Crew Sweets 180g,1.00,unit,56p,100g
Very Lazy Chopped Red Chillies 190g,1.55,unit,8p,10g
KP Peanuts Salt and Vinegar Flavour 225g,2.50,unit,1.11,100g
Bisto Parsley Sauce Mix 190g,1.85,unit,97p,100g
Hartley's 10 Cal Lemon Cheesecake Jelly Pot 175g,80p,unit,46p,100g
Sainsbury's Goji Berries 100g,2.00,unit,2.00,100g
Sainsbury's Deliciously Free From Fruity Hot Cross Buns x4 280g,2.00,unit,71p,100g
Jack Daniel's Original Barbecue Sauce 260g,2.00,unit,77p,100g
Snack a Jacks Rice and Corn Cakes Sweet Chilli 23g,75p,unit,3.26,100g
Betty Crocker Tempting Chocolate Icing 400g,2.50,unit,63p,100g
Cadbury Dairy Milk Freddo Treasures Chocolate with Toy 14g,90p,unit,6.25,100g
Doves Farm Organic Fine Plain Wholemeal Flour 1kg,1.75,unit,1.75,kg
Haywards Mixed Pickle 400g,1.00,unit,50p,100g
Heinz No Added Sugar Spaghetti Hoops 400g,75p,unit,1.88,kg
Batchelors Pasta 'n' Sauce Pesto 110g,75p,unit,7.58,kg
Taylors of Harrogate Brasilia Ground Coffee 227g,3.75,unit,1.65,100g
Cadbury Flake 32g,70p,unit,2.19,100g
Innocent Dairy Free Hazelnut 750ml,2.00,unit,2.67,ltr
Urban Fruit Gently Baked Pineapple 100g,2.10,unit,2.10,100g
HP Honey Woodsmoke BBQ Sauce 465g,2.00,unit,43p,100g
Yorkshire Gold Loose Tea 250g,2.75,unit,1.10,100g
Sainsbury's Green Lentils & Kidney Beans 250g,1.35,unit,5.40,kg
Percol Fairtrade Smooth Colombia Ground Coffee 200g,3.00,unit,1.50,100g
Naked Noodle The Big One Egg Noodles Thai Green Curry 104g,1.30,unit,12.50,kg
itsu Satay Rice'Noodles 64g,1.75,unit,27.34,kg
Lavazza A Modo Mio Lungo Dolce Coffee Capsules x16,4.40,unit,3.44,100g
Walkers Meaty Variety Crisps 24x25g,3.00,unit,50p,100g
Border Milk Chocolate Vienese 150g,1.00,unit,67p,100g
BFree Stone Baked Pizza Bases 2x180g,2.80,unit,78p,100g
Nissin Demae Ramen Spicy Japanese Noodlesoup 100g,55p,unit,55p,100g
Sainsbury's Fairtrade Peanuts & Raisins 100g,90p,unit,90p,100g
Henry Goode's Soft Strawberry Liquorice 200g,1.00,unit,50p,100g
Sainsbury's Marjoram 10g,85p,unit,85p,10g
Walkers Cheese & Onion Sharing Bag Crisps 175g,1.00,unit,57p,100g
Blue Dragon Thai Massaman Curry Paste Pot 50g,50p,unit,1.00,100g
Heinz Cup Soup Minestrone 72g,1.20,unit,1.67,100g
Sainsbury's Deliciously Free From Cherry & Almond Slices x4,2.00,unit,1.60,100g
Cadbury Highlights Milk Hot Chocolate 220g,4.00,unit,1.82,100g
Stagg Dynamite Hot Chilli 400g,1.80,unit,4.50,kg
Genius Gluten Free Sausage Rolls x2,2.00,unit,10.00,kg
