Description,Price/Unit,Unit,Price/Measure,MeasureCrisp 'N' Dry Vegetable Oil 2L,2.50,unit,13p,100ml
Nairn's Wheat Free Ginger Biscuits 200g,1.40,unit,70p,100g
Sainsbury's Chia Seeds 150g,1.50,unit,1.00,100g
Ambrosia Custard Mini Pots 6x55g,1.80,unit,55p,100g
Jacob's Krackawheat Crackers 200g,1.50,unit,75p,100g
Kingfisher Bamboo Shoots In Water 225g,1.10,unit,49p,100g
Sainsbury's Danish Pastry Apricot & Almond Flavour Scrolls x2,1.30,unit,65p,ea
Sainsbury's Classic Variety Assorted Crisps 12x25g,1.50,unit,50p,100g
Heinz Macaroni Cheese 200g,80p,unit,4.00,kg
Sainsbury's Olive Oil Extra Virgin 2L,6.75,unit,34p,100ml
Homepride Tuna Pasta Bake Sauce 485g,1.70,unit,35p,100g
Sainsbury's Black Peppercorn Grinder 50g,2.00,unit,40p,10g
Quaker Oat So Simple Porridge Pot Sweet Cinnamon 57g,90p,unit,1.58,100g
Sainsbury's Beef Paste 75g,45p,unit,60p,100g
Go Ahead! Crispy Slices Forest Fruit Bars 5x43.6g,1.00,unit,46p,100g
Tilda Microwave Steamed Basmati Coconut & Chilli Rice 250g,1.50,unit,6.00,kg
Loyd Grossman Pasta Sauce Tomato & Sweet Red Pepper 350g,1.00,unit,28p,100g
Alpro Greek Style Passionfruit Yoghurt Alternative 150g,1.00,unit,67p,100g
Hartley's Sugar Free Orange Jelly Twin Pack 23g,1.30,unit,5.65,100g
Nairn's Chocolate Biscuit Breaks 160g,1.80,unit,1.13,100g
Swizzels Bumper Bag Sweets 180g,1.00,unit,48p,100g
Sainsbury's Jelly Babies Sweets 225g,90p,unit,40p,100g
Sainsbury's Crumble Mix 225g,55p,unit,2.44,kg
Kellogg's Rice Krispies Squares Caramel & Chocolate x4,1.75,unit,1.22,100g
Sainsbury's Lemon Curd 411g,65p,unit,16p,100g
Sacla Free From Basil Pesto 190g,2.60,unit,1.37,100g
Dole Peaches In Juice 4x113g,2.00,unit,77p,100g
Sainsbury's Custard Pots 4x150g,1.40,unit,23p,100g
Dr. Oetker Gluten Free Baking Powder 170g,1.40,unit,8.24,kg
Butterkist Popcorn Sweet & Salted 100g,1.00,unit,1.00,100g
Heinz Classic Scotch Broth 400g,80p,unit,20p,100g
Oreo Ice Cream Sandwich x6 330ml,2.00,unit,61p,100ml
Quorn Vegetarian Smoky Bacon Rashers 150g,1.70,unit,11.33,kg
Sainsbury's Gold Roast Decaffeinated Instant Coffee Granules 100g,2.00,unit,2.00,100g
M&M's Chocolate Pouch Bag 125g,1.50,unit,1.20,100g
Colman's Sauce Mix White Sauce 25g,50p,unit,2.00,100g
Jus-Rol Shortcrust Pastry Sheets 320g,1.00,unit,31p,100g
Heinz Tomato Ketchup Top Down 570g,2.00,unit,35p,100g
Sainsbury's Fairtrade After Dinner Ground Coffee 227g,2.30,unit,1.01,100g
The Fruit Factory Strawberry Apple & Orange Fruit Stars 5x20g,2.20,unit,2.20,100g
Sainsbury's Roasted Red Pepper Pesto 190g,90p,unit,47p,100g
Baxters Vegetarian Country Garden Soup 400g,1.20,unit,30p,100g
Jacob's Crispbreads Mixed Seed Crackers 5x190g,1.00,unit,53p,100g
Sainsbury's Parsley 6g,85p,unit,1.42,10g
Billington's Natural Golden Caster Unrefined Cane Sugar 1kg,2.20,unit,2.20,kg
Jordans Crunchy Oat Granola Fruit & Nut 750g,3.00,unit,40p,100g
Sainsbury's Milk Bottle Sweets 70g,45p,unit,64p,100g
Sainsbury's Lemon Curd Taste the Difference 320g,1.85,unit,58p,100g
Jordans Country Crisp With Tangy Raspberry Cereal 500g,3.00,unit,60p,100g
Yutaka Panko Breadcrumbs 180g,1.80,unit,1.00,100g
Colman's Tartare Sauce 144g,1.00,unit,69p,100g
Quality Street Matchmakers Zingy Orange Chocolate Box 120g,1.00,unit,83p,100g
Metcalfe's Sea Salt Charity Popcorn Sharing Bag 70g,1.60,unit,2.29,100g
Cadbury Dairy Milk Caramel Chocolate Bar 200g,1.50,unit,75p,100g
Sainsbury's Unsalted Jumbo Peanuts & Raisins 200g,1.25,unit,63p,100g
Napolina Farfalle 500g,1.30,unit,2.60,kg
Seeds of Change Organic Bolognese Pasta Sauce 500g,1.50,unit,30p,100g
Sainsbury's Peeled Cherry Tomatoes Taste the Difference 400g,1.00,unit,2.50,kg
Sainsbury's Potato Rings 185g,1.00,unit,54p,100g
Nescafe Gold Caramel Latte Instant Coffee Sachets x8,1.50,unit,1.10,100g
Sainsbury's Cocoa 250g,2.00,unit,80p,100g
Mcvitie's Light Rich Tea Biscuits 300g,1.20,unit,40p,100g
Sainsbury's Roasted & Salted Almonds 100g,1.50,unit,1.50,100g
M&M's Peanut Chocolate More to Share Pouch Bag 268g,2.50,unit,93p,100g
Sainsbury's Bramley Apple Sauce 420ml,95p,unit,23p,100ml
Sainsbury's Frosted Flakes Cereal 500g,1.00,unit,20p,100g
Sainsbury's Tender Broad Beans In Water 300g (195g*),55p,unit,2.82,kg
Sainsbury's Belgian Waffles Taste the Difference x7 175g,1.75,unit,25p,ea
Organix Farm Animal Biscuits 100g,1.60,unit,1.60,100g
Organix Carrot Stix 4x15g,1.50,unit,2.50,100g
Sainsbury's Instant Noodles Vegetable 90g,30p,unit,33p,100g
Nutella B-Ready Cereal Bar 6x22g,2.00,unit,1.52,100g
Branston Reduced Sugar & Salt Baked Beans 410g,50p,unit,1.22,kg
Tassimo Kenco 100% Colombian Coffee Pods x16,3.50,unit,2.57,100g
Cadbury Drinking Chocolate 250g,2.00,unit,80p,100g
Penn State Sea Salted Sharing Pretzels 175g,1.00,unit,57p,100g
Maltesers Chocolate Multipack Full Size Bags 3x37g,1.25,unit,1.12,100g
Sainsbury's Raspberry Jam 454g,75p,unit,17p,100g
Ovaltine Malt Drink Original Light 300g,3.40,unit,1.13,100g
Princes Mackerel Fillets in Spicy Tomato Sauce 125g,1.00,unit,80p,100g
Del Monte Sliced Pineapple in Juice 435g (260g Drained),1.00,unit,38p,100g
Hagen-Dazs Ice Cream Pralines & Cream 460ml,3.00,unit,65p,100ml
Mars Chocolate Fun Size Bars Multipack 13 x 18g,3.00,unit,1.20,100g
Tilda Microwave Steamed Basmati Wholegrain Pilau Rice 250g,1.30,unit,5.20,kg
Heinz Thomas The Tank Engine Pasta Shapes In Tomato Sauce 205g,55p,unit,2.68,kg
Ryvita Crunchy Rye Bread Fruit Crunch 8x25g,1.60,unit,80p,100g
Kinder Bueno Twin Bars 4x43g,2.00,unit,1.16,100g
BelVita Breakfast Biscuits Bars Soft Bakes Chocolate Filled 5x50g,2.50,unit,1.00,100g
Nescaf Gold Cappuccino Unsweetened Instant Coffee Sachets x8,1.50,unit,1.32,100g
Sainsbury's White Chocolate 200g,1.00,unit,50p,100g
Hula Hoops Original Crisps 12x24g,3.00,unit,1.04,100g
Popchips Sea Salt & Vinegar Sharing Crisps 85g,1.80,unit,2.12,100g
Sainsbury's Italian Herb Seasoning 14g,85p,unit,61p,10g
Kinder Surprise Chocolate Egg x3 60g,2.05,unit,3.42,100g
Sainsbury's Puffed Wheat Cereal 160g,70p,unit,44p,100g
Pom-Bear Original Multipack Crisps 12x13g,3.00,unit,1.92,100g
Uncle Ben's Microwave Rice Wholegrain Spicy Mexican 250g,1.55,unit,6.20,kg
Sainsbury's Chewy Caramel Chocolate Bars 5x36g,65p,unit,36p,100g
Sainsbury's Sweet Pickle 285g,65p,unit,22p,100g
Glenryck Pilchards in Tomato Sauce 400g,1.15,unit,29p,100g
Loyd Grossman Pasta Sauce Puttanesca 350g,1.00,unit,28p,100g
Swizzels Drumstick Squashies Sweets 160g,1.30,unit,81p,100g
Sainsbury's Petit Pois & Baby Carrots 400g,1.00,unit,2.50,kg
Sainsbury's Penne SO Organic 500g,1.00,unit,2.00,kg
Hartley's Lime Jelly 135g,65p,unit,48p,100g
Sarson's Brown Malt Vinegar 400ml,1.15,unit,2.88,ltr
Yorkie Raisin & Biscuit Milk Chocolate Bar Multipack x3 46g,1.00,unit,76p,100g
Horlicks Light Malt 500g,3.50,unit,70p,100g
Sainsbury's Signature Chicken Stock 500g,1.70,unit,34p,100ml
Sainsbury's Pimento Stuffed Olives 350g (200g*),1.00,unit,50p,100g
Sainsbury's Tomato Red Pepper & Lentil Soup 400g,45p,unit,11p,100g
Doria Doriano Italian Crackers 240g,1.40,unit,58p,100g
Sainsbury's Cod Loins Taste the Difference (approx. 300g),19.00,kg,1.90,100g
Loyd Grossman Korma Sauce 350g,1.80,unit,51p,100g
Sainsbury's Deliciously Free From Chocolate Chip Cookies 150g,1.20,unit,80p,100g
Terry's Chocolate Orange Minis Sharing Bag 125g,1.50,unit,1.20,100g
Sainsbury's Satay Stir Fry Sauce 120g,50p,unit,42p,100g
Sainsbury's Thai Fragrant Rice 500g,1.25,unit,2.50,kg
Tassimo Costa Cappuccino Coffee Pods x8,4.00,unit,1.43,100g
Paxo Sage & Onion Stuffing for Chicken 340g,2.60,unit,7.65,kg
Ryvita Crackerbread Wholegrain 125g,1.25,unit,1.00,100g
Sainsbury's Peppermint Cremes 175g,95p,unit,54p,100g
Sainsbury's Crispbakes 125g,1.00,unit,80p,100g
Popchips Original Chips Sharing Crisps 85g,1.80,unit,2.12,100g
Sainsbury's Groundnut Oil 500ml,1.90,unit,38p,100ml
Milky Way Chocolate Bar Multipack 6 x 21.5g,1.25,unit,97p,100g
Sainsbury's Peanut Butter Smooth 700g,2.35,unit,34p,100g
Ambrosia Devon Custard Pot 150g,50p,unit,33p,100g
Aero Milk Chocolate  4x27g,1.00,unit,93p,100g
Sainsbury's Pitted Green Olives 907g (440g*),2.00,unit,45p,100g
Sainsbury's Golden Syrup 700g,1.25,unit,18p,100g
Sainsbury's French Dressing Be Good To Yourself 250ml,90p,unit,36p,100ml
Sainsbury's Roasted Chopped Hazelnuts 100g,2.00,unit,2.00,100g
Sainsbury's Seafood Sauce 250ml,1.00,unit,40p,100ml
Sainsbury's Roasted & Salted Pistachios 150g,2.00,unit,1.33,100g
Chicken Tonight Spanish Chicken 500g,1.70,unit,34p,100g
Sainsbury's Tuna Steak in Spring Water 3x120g,3.70,unit,1.03,100g
Sainsbury's Breadsticks Toasted Wheat Bran 125g,90p,unit,72p,100g
Sainsbury's Cut Mixed Peel 200g,1.00,unit,5.00,kg
Heinz Tomato Ketchup Squeezy 250g,1.20,unit,48p,100g
Twix Chocolate Biscuit Snack Size Twin Bars Multipack 4 x 40g,1.25,unit,78p,100g
Heinz No Added Sugar Beans in a Rich Tomato Sauce 200g,65p,unit,3.25,kg
Pure Dairy Free Vegan Olive Spread 500g,1.60,unit,3.20,kg
Twinings Camomile Tea 20 Tea Bags,1.70,unit,5.67,100g
Sainsbury's Pasta Sauce Tomato & Herb Light 500g,65p,unit,13p,100g
Canderel Original Sweetener Tablets x300,3.00,unit,10p,10tblt
Sainsbury's Popping Corn 500g,1.10,unit,2.20,kg
Tassimo Kenco Americano Smooth Coffee Pods x16,3.50,unit,2.73,100g
Cadbury Family Heroes Chocolate Treatsize Bag 222g,2.50,unit,1.13,100g
Ryvita Thins Sweet Chilli Flatbreads 125g,1.00,unit,80p,100g
Sainsbury's Quick Cook Penne 500g,55p,unit,1.10,kg
Baxters Baby Pickled Beetroot 567g (410g*),1.25,unit,30p,100g
Jordans Super Nutty Granola 550g,4.00,unit,73p,100g
Blue Dragon Teriyaki Stir Fry Sauce 120g,70p,unit,58p,100g
Green & Black's Organic Milk Almond Chocolate Bar 90g,2.00,unit,2.22,100g
Sainsbury's Sage Roast Onion & Shallot Stuffing Taste the Difference 110g,1.25,unit,11.36,kg
Nescafe Dolce Gusto Americano Coffee x16 Pods 16 Drinks,3.50,unit,2.19,100g
Del Monte Pineapple Chunks in Juice 435g (260g Drained),1.00,unit,38p,100g
Douwe Egberts Pure Gold Instant Coffee Refill 150g,4.50,unit,3.00,100g
Dr. Oetker Bicarbonate of Soda 200g,1.40,unit,7.00,kg
Clarks Maple Syrup Pure Canadian 180ml,3.60,unit,2.00,100ml
KP Dry Roasted Peanuts 415g,3.00,unit,72p,100g
Sainsbury's Shortcake 200g,55p,unit,28p,100g
Kellogg's All-Bran Golden Crunch Cereal 390g,3.00,unit,77p,100g
Sainsbury's Wine Vinegar Red Wine 500ml,1.20,unit,2.40,ltr
Irish Yogurts Diet Fat Free 4x125g,1.00,unit,20p,100g
Sainsbury's Artichoke Hearts In Water 400g (240g*),1.75,unit,7.29,kg
Organix Mini Gingerbread Men Biscuits 5x25g,2.30,unit,1.84,100g
BEAR Fruit Yoyos Apple 20g,55p,unit,2.75,100g
Meridian Cashew Nut Butter 170g,3.00,unit,1.76,100g
Batchelors Cup a Soup Chicken x4 81g,80p,unit,99p,100g
Colman's Mint Sauce 165g,1.00,unit,61p,100g
Quaker Oat So Simple Golden Syrup Porridge 18x36g,3.00,unit,46p,100g
Knorr Stock Pot Rich Beef 4x28g,1.45,unit,1.29,100g
Sainsbury's Pitted Black Cherries In Light Syrup 425g,1.15,unit,54p,100g
Horlicks Instant Malt Stick 32g,35p,unit,1.09,100g
Sainsbury's Spaghetti In Tomato Sauce 4x400g,1.10,unit,69p,kg
North Staffordshire Oatcakes x6,1.00,unit,17p,ea
Sainsbury's Toffees Assorted 200g,95p,unit,48p,100g
Warburtons Seeded Protein Thin Bagels x4,1.50,unit,38p,ea
Sainsbury's Pitted Black Olives 185g (85g*),60p,unit,71p,100g
Sainsbury's My Goodness! Katsu Chicken Curry & Lemongrass Rice 380g (Serves 1),3.25,unit,8.55,kg
Sainsbury's Lean Cooked Ham 200g,1.20,unit,60p,100g
Nescaf Dolce Gusto Latte Macchiato Coffee x16 Pods 8 Drinks,3.50,unit,1.91,100g
Maynards Bassetts Sports Mix Sweets Bag 190g,1.50,unit,79p,100g
Sainsbury's Cashew Nuts SO Organic 200g,4.00,unit,2.00,100g
Sainsbury's Aduki Beans 400g (235g*),55p,unit,2.34,kg
Nando's Peri Peri Rub Medium 25g,1.00,unit,4.00,100g
Lyle's Treacle Black 454g,1.40,unit,31p,100g
Gia Sun Dried Tomato Puree 70g,80p,unit,10.00,kg
Urban Fruit Gently Baked Mango 100g,2.10,unit,2.10,100g
Milky Way Magic Stars Chocolate Pouch Bag 100g,1.50,unit,1.50,100g
Sainsbury's Porridge Original 10x27g,1.00,unit,37p,100g
Hellmann's Lighter than Light Squeezy Mayonnaise 430ml,2.10,unit,47p,100g
Sainsbury's Rosemary 22g,85p,unit,39p,10g
Mug Shot Noodles Macaroni Cheese 68g,50p,unit,7.35,kg
Sainsbury's Wild Pacific Pink Salmon Skinless & Boneless 170g,2.30,unit,1.35,100g
Heinz Salad Cream Light 415g,2.00,unit,48p,100g
Billington's Demerara Sugar Cubes 500g,1.75,unit,3.50,kg
Nature Valley Crunchy Variety Pack Cereal Bars 5x42g,1.50,unit,71p,100g
Sainsbury's Medium Curry Powder 80g,1.00,unit,13p,10g
Alpro Plain No Sugars Yoghurt Alternative 500g,1.75,unit,35p,100g
Twinings Earl Grey Tea 50 Tea Bags,3.50,unit,2.80,100g
Menier Swiss Dark Chocolate 100g,1.40,unit,14.00,kg
Rowntree's Jelly Tots Bag 150g,1.00,unit,67p,100g
Weetabix Cereal Organic x24,3.40,unit,14p,bisc
Sainsbury's Yeast Extract Reduced Salt 225g,2.00,unit,89p,100g
TREK Cocoa Oat Protein Flapjacks 3 x 50g,2.50,unit,1.67,100g
Sainsbury's Fairtrade House Blend Original Coffee Beans Strength 3 227g,2.30,unit,1.01,100g
Off the Eaten Path Caramelised Onion & Balsamic Vinegar Pea & Pinto Bean Stick Crisps 100g,2.25,unit,2.25,100g
Organix Saucy Tomato Noughts & Crosses 4x15g,1.50,unit,2.50,100g
Jordans Muesli Natural 1kg,3.00,unit,30p,100g
Whitworths Shots Single Berry & White Chocolate 25g,50p,unit,2.00,100g
Sainsbury's Dumpling Mix 142g,65p,unit,4.58,kg
Haribo Mega Party Mini Bag Multipack Sweets Bag 22x16g,2.50,unit,71p,100g
Heinz Salad Cream Extra Light 435g,2.00,unit,46p,100g
Doves Farm Organic Strong White Flour 1.5kg,2.00,unit,1.33,kg
Organix Mini Cheese Crackers 4x20g,1.75,unit,2.19,100g
Sainsbury's Honey Roast Cashew & Peanuts 200g,2.50,unit,1.25,100g
Kellogg's Strawberry & Blackcurrant Fruit Winders 6x17g,2.00,unit,1.96,100g
Sainsbury's Tortilla Chips Tangy Cheese 200g,95p,unit,48p,100g
Heinz Spaghetti Hoops Snap Pots 4x190g,2.50,unit,3.29,kg
Sainsbury's Sorbet Raspberry 500ml,2.25,unit,45p,100ml
Sainsbury's Chilli Con Carne 400g,1.50,unit,3.75,kg
Dolmio Pasta Sauce Pouch Tomato & Basil 170g,1.55,unit,91p,100g
Butterkist Microwave Popcorn Sweet & Salted 3x60g,2.00,unit,1.11,100g
Campbell's Condensed Cream Of Tomato Soup 294g,1.05,unit,36p,100g
Tetley Pure Green Tea x50 Tea Bags 100g,2.00,unit,2.00,100g
Cafedirect Fairtrade Smooth Roast Instant Coffee 100g,3.75,unit,3.75,100g
Sainsbury's Peanuts Raisins & Milk Chocolate Chips 200g,1.35,unit,68p,100g
Dorset Cereals Simply Oat Granola 500G,3.30,unit,60p,100g
Sainsbury's Garam Masala 38g,85p,unit,22p,10g
Old El Paso Oven Baked Crispy Chicken Fajita Kit 555g,3.00,unit,54p,100g
Green Giant Sweet Corn & Peppers 198g (165g*),75p,unit,4.55,kg
Lizi's Low Sugar Granola 500g,3.70,unit,74p,100g
Oxo Reduced Salt Chicken Stock Cubes x12 71g,1.00,unit,1.41,100g
Sainsbury's Blackcurrant Jam 454g,75p,unit,17p,100g
Kenco Decaff Instant Coffee 100g,3.50,unit,3.50,100g
Indo Mie Instant Noodles Special Chicken Flavour 75g,45p,unit,60p,100g
Carnation Cook with Caramel 397g,1.50,unit,38p,100g
Jordans Country Crisp With Flame Raisins Cereal 500g,3.00,unit,60p,100g
Sainsbury's Blackcurrant Conserve Taste the Difference 340g,1.60,unit,47p,100g
Batchelors Pasta 'n' Sauce Macaroni Cheese 108g,75p,unit,7.58,kg
Sainsbury's Scotch Broth Soup 400g,45p,unit,11p,100g
Weetabix On The Go Breakfast Drink Vanilla 250ml,1.50,unit,60p,100ml
Sainsbury's Honey & Mustard Dressing Be Good To Yourself 260g,90p,unit,36p,100ml
Patak's Korma Spice Paste 290g,2.30,unit,81p,100g
John West Tuna Chunks in Spring Water 4x145g,3.50,unit,86p,100g
Sainsbury's Orange Juice Drink SO Organic 3x200ml,1.20,unit,20p,100ml
Napolina Passata With Basil 390g,1.00,unit,2.56,kg
Sainsbury's Porridge Golden Syrup 8x36g,1.00,unit,35p,100g
Skips Prawn Cocktail 14x13.1g,2.00,unit,1.09,100g
Sainsbury's Balsamic Glaze 250ml,1.75,unit,7.00,ltr
Taylors of Harrogate Rich Italian Coffee Beans 227g,3.75,unit,1.65,100g
Alpro Plain with Almond Yoghurt Alternative 500g,1.75,unit,35p,100g
Sainsbury's Petits Pois In Water 400g (280g*),55p,unit,1.96,kg
Batchelors Super Noodles Pot Chicken 75g,50p,unit,6.67,kg
Yorkshire Hard Water Blend Tea Bags x80,2.00,unit,80p,100g
Peperami Original Minis 10 x 10g,2.50,unit,2.50,100g
Napolina Olive Oil 500ml,4.15,unit,83p,100ml
Sainsbury's Sardines in Brine 120g (90g*),40p,unit,44p,100g
Baxters Favourites Cream Of Chicken Soup 400g,1.20,unit,30p,100g
Propercorn Sweet & Salty Popcorn 90g,1.00,unit,1.11,100g
Daddies Brown Sauce 400g,1.45,unit,36p,100g
Bonne Maman Bitter Orange Marmalade 370g,2.60,unit,70p,100g
Sainsbury's Pasta Sauce Carbonara 430g,75p,unit,17p,100g
Doves Farm Organic White Flour 1kg,1.80,unit,1.80,kg
Nescaf Gold Mocha Instant Coffee Sachets x8,1.50,unit,86p,100g
Sainsbury's Pitted Queen Olives 350g (160g*),1.30,unit,81p,100g
Alpro Oat Chilled Drink 1L,1.70,unit,1.70,ltr
Sainsbury's Chipotle Chilli Paste 90g,1.65,unit,1.83,100g
Napolina Pasta Sauce Tomato & Chilli 350g,1.00,unit,29p,100g
Sainsbury's Cheddar Cheese Twists 125g,1.30,unit,1.04,100g
Sainsbury's Olive Oil Flavoured With Garlic Extra Virgin 250ml,2.10,unit,84p,100ml
De Cecco Tortiglioni Pasta 500g,1.65,unit,3.30,kg
Sainsbury's Gruyere Poppy Seed Twists Taste the Difference 125g,1.50,unit,1.20,100g
Sainsbury's Brazil Nuts 200g,3.00,unit,1.50,100g
Cadbury Fabulous Fingers 110g,1.00,unit,91p,100g
Sainsbury's Pasta Bake Sauce Macaroni Cheese 475g,1.00,unit,21p,100g
Heinz Weight Watchers Lentil & Carrot Soup 295g,85p,unit,29p,100g
Guinness Draught Stout 4x440ml,4.75,unit,2.70,ltr
Sainsbury's Sponge Fingers 175g,85p,unit,49p,100g
Sainsbury's Wild Pacific Pink Salmon Skinless & Boneless 105g,2.00,unit,1.90,100g
Rombouts Coffee Filter Papers 4 Cups x40,1.20,unit,1.20,g
Sainsbury's Diced Lamb 400g,5.25,unit,13.13,kg
Twinings Camomile & Honey Tea 20 Tea Bags,1.70,unit,5.67,100g
Bisto Vegetable Gravy Granules 170g,1.00,unit,59p,100g
Sainsbury's Tuna Chunks In Olive Oil 160g,1.10,unit,92p,100g
Sainsbury's Mayonnaise Thick & Creamy 750ml,1.20,unit,16p,100ml
Sainsbury's Italian Artichoke Antipasto 280g (180g*),2.10,unit,1.17,100g
Scott's Old Fashioned Porage Oats 1kg,2.00,unit,20p,100g
Uncle Ben's Rice & Grains Wholegrain & Quinoa 220g,1.85,unit,8.41,kg
Patak's Butter Chicken Sauce 450g,1.25,unit,28p,100g
Ainsley Harriott Spice Sensation Cous Cous 100g,75p,unit,7.50,kg
Walkers Max Paprika Crisps 6x27g,1.25,unit,77p,100g
Sainsbury's Garlic Paste 75g,1.45,unit,1.71,100g
Kettle Chips Lightly Salted Multipack Crisps 5x30g,1.80,unit,1.20,100g
Sainsbury's Polar Bar Orange x9,1.10,unit,48p,100g
Fry's Chocolate Cream x3 147g,1.00,unit,68p,100g
Sainsbury's Chopped Tomatoes With Herbs 227g,30p,unit,1.32,kg
Sharwood's Black Bean Stir-Fry Sauce 195g,1.45,unit,74p,100g
Bahlsen Choco Leibniz Orange 125g,1.60,unit,1.28,100g
Grape Nuts Cereal 580g,3.30,unit,57p,100g
Colman's Recipe Mix Chicken Chasseur 43g,50p,unit,1.16,100g
BEAR Fruit Yoyos Pineapple 20g,55p,unit,2.75,100g
Sainsbury's Block Puff Pastry 500g,1.30,unit,26p,100g
Aero Bubbles Peppermint Mint Chocolate Pouch 102g,1.50,unit,1.47,100g
St. Dalfour Strawberry Fruit Spread 284g,1.70,unit,60p,100g
Nairn's Gluten Free Scottish Porridge Oats 450g,2.00,unit,44p,100g
Sainsbury's Fairtrade Decaff House Blend Coffee Strength 3 227g,2.30,unit,1.01,100g
Sainsbury's Demerera Shortbread Rounds Taste the Difference 200g,2.00,unit,1.00,100g
Billington's Dark Muscovado Sugar 500g,1.70,unit,3.40,kg
Jacob's Choice Grain Savoury Biscuits 200g,1.25,unit,63p,100g
Sainsbury's Pickled Gherkins in Vinegar 600g,90p,unit,25p,100g
Hula Hoops Puft Salt & Vinegar Crisps 6x15g,1.70,unit,1.89,100g
Sainsbury's Chutney Apple & Pear Taste the Difference 300g,1.30,unit,43p,100g
Nescaf Gold Blend Instant Coffee Refill 275g,7.80,unit,2.84,100g
Hartley's Blackcurrant Jelly 135g,65p,unit,48p,100g
Uncle Ben's Microwave Rice Wholegrain & Mediterranean Veg 250g,1.55,unit,6.20,kg
Sainsbury's Squeezy Honey SO Organic 340g,3.00,unit,88p,100g
Sainsbury's Peanut Cookies 200g,1.00,unit,50p,100g
Sainsbury's Scotch Bonnet Hot Chilli 30g,70p,unit,2.33,100g
Cadbury Milk Tray Chocolate Box 360g,3.00,unit,84p,100g
Tunnock's Dark Chocolate Caramel Wafers x8,1.75,unit,73p,100g
Sainsbury's Rice Pudding Low Fat Be Good To Yourself 400g,55p,unit,14p,100g
Sainsbury's Apricot Conserve Taste the Difference 340g,1.60,unit,47p,100g
Sainsbury's Rock Salt Grinder 100g,2.00,unit,20.00,kg
Sainsbury's Mulligatawny Soup 400g,45p,unit,11p,100g
KP Jumbo Salted Peanuts 200g,2.30,unit,1.15,100g
Sainsbury's Baked Beans With Meatfree Sausages 400g,70p,unit,1.75,kg
Sainsbury's Stewed Steak In Gravy 400g,2.15,unit,5.38,kg
Sainsbury's Garlic & Coriander Poppadoms 80g,1.40,unit,1.75,100g
Sainsbury's Simply Granola 1kg,2.10,unit,21p,100g
Green & Black's Organic Butterscotch Milk Chocolate Bar 90g,2.00,unit,2.22,100g
Green & Black's Organic White Chocolate Bar 90g,2.00,unit,2.22,100g
Weetabix Protein Cereal x24,3.20,unit,13p,bisc
Angel Delight Strawberry No Added Sugar Dessert 47g,60p,unit,1.28,100g
Sainsbury's Blanched Hazelnuts 100g,2.00,unit,2.00,100g
Graze Snack Box Punchy Protein Nuts 35g,1.20,unit,3.43,100g
Alpro Soya Strawberry Long Life Drink x3 250ml,1.60,unit,2.13,ltr
Maggi So Juicy BBQ Chicken Recipe Mix 47g,1.00,unit,2.13,100g
Sainsbury's Fairtrade Dark Soft Brown Sugar 1kg,2.50,unit,2.50,kg
Sainsbury's Sage & Onion Stuffing Mix 85g,35p,unit,4.12,kg
The Jolly Hog Proper Porker Sausages 400g,3.00,unit,7.50,kg
Sacla Organic Basil Pesto 190g,2.70,unit,1.42,100g
Coffee Mate Light Coffee Whitener 500g,2.60,unit,52p,100g
Nakd Bakewell Tart Fruit & Nut Bar 35g,75p,unit,2.14,100g
Old Jamaica Ginger Beer Can 330ml,35p,unit,11p,100ml
Tassimo Cadbury Hot Chocolate Pods x8,3.50,unit,1.46,100g
Sainsbury's Chestnut Baby Button Mushrooms 200g,1.10,unit,5.50,kg
Bird's Custard Powder 350g,1.55,unit,44p,100g
Sainsbury's Choco Hoops Cereal 375g,1.00,unit,27p,100g
Dolmio Stir In Pasta Sauce Bacon & Tomato 150g,1.95,unit,1.30,100g
Nescafe Gold Blend Decaff Instant Coffee Refill 150g,3.50,unit,2.33,100g
Whitworths Shots Single Fruity Biscuit 25g,50p,unit,2.00,100g
Sainsbury's Brazil Nuts 100g,1.65,unit,1.65,100g
Dolmio Stir In Pasta Sauce Carbonara 150g,1.95,unit,1.30,100g
Good Hemp Seed Milk 1L,2.00,unit,2.00,ltr
Rowntree's Randoms Gummy Sweets Pouch 150g,1.00,unit,67p,100g
Heinz Weight Watchers Chicken Noodle Soup 295g,85p,unit,29p,100g
HP Original Woodsmoke Barbecue Sauce 465g,2.00,unit,43p,100g
Quality Street Assorted Chocolate Box 240g,2.00,unit,83p,100g
Fibre One 90 Calorie Salted Caramel Bars 5x24g,2.90,unit,2.42,100g
M&M's Crispy Chocolate Pouch Bag 107g,1.50,unit,1.40,100g
Sainsbury's Milk Chocolate Rice Cakes 4x35.75g,1.30,unit,87p,100g
Sainsbury's Chow Mein Stir Fry Sauce 120g,50p,unit,42p,100g
Dolmio Pasta Sauce Pouch Creamy Tomato 150g,1.55,unit,1.03,100g
Tilda Microwave Tomato and Basil Basmati Rice 250g,1.50,unit,6.00,kg
Sainsbury's Green Pesto Light 190g,90p,unit,47p,100g
Cadbury Dairy Milk with Daim Chocolate Bar 120g,1.50,unit,1.25,100g
Lindt Lindor Milk Chocolate Bar 100g,2.00,unit,2.00,100g
Walkers Classic Variety Crisps 12x25g,2.00,unit,67p,100g
Twinings Peppermint Tea 80 Tea Bags,4.00,unit,2.50,100g
Sainsbury's Mild Chilli Powder 44g,85p,unit,19p,10g
Sainsbury's Tomato & Red Pepper Soup 400g,45p,unit,11p,100g
Kellogg's Crunchy Nut Hazelnuts & Chocolate Granola Cereal 380g,3.00,unit,79p,100g
Uncle Ben's Sweet & Sour Sauce with Extra Pineapple 450g,1.50,unit,34p,100g
Maryland Chocolate Chip Cookies 2x230g,2.00,unit,43p,100g
Lotus Biscoff Caramelised Biscuits Pack 180g,1.25,unit,67p,100g
Galaxy Instant Hot Chocolate Jar 370g,2.00,unit,54p,100g
Sainsbury's Vegetable Crisps Taste the Difference 100g,1.25,unit,1.25,100g
Sainsbury's Classic Variety Assorted Crisps 22x25g,2.50,unit,45p,100g
Nakd Blueberry Muffin Fruit & Nut Bars 4x35g,2.50,unit,1.79,100g
Dolmio Bolognese Pasta Sauce  Smooth Vegetable 500g,1.85,unit,37p,100g
Horlicks Original Malt 500g,3.50,unit,70p,100g
Sainsbury's Milk Chocolate Eclairs 200g,95p,unit,48p,100g
Lo Salt Reduced Sodium Salt Alternative 350g,1.70,unit,4.86,kg
BEAR Fruit Yoyos Strawberry 20g,55p,unit,2.75,100g
Baxters Hearty Country Vegetable Soup 400g,1.55,unit,39p,100g
Douwe Egberts Decaff Instant Coffee 95g,3.20,unit,3.37,100g
Sainsbury's Milk Chocolate Mini Rice Cakes 4x30g,1.30,unit,1.08,100g
Baxters Favourites Cock-a-leekie Soup 400g,1.20,unit,30p,100g
Sainsbury's Spaghetti SO Organic 500g,1.00,unit,2.00,kg
Uncle Ben's Long Grain Rice 1kg,3.95,unit,3.95,kg
Organix Cheese & Herb Puffs 4x15g,1.50,unit,2.50,100g
Dolmio Bolognese Pasta Sauce Intense Chilli 500g,1.85,unit,37p,100g
Sainsbury's Fairtrade Demerara Cane Sugar 2kg,2.50,unit,1.25,kg
Nando's Peri Peri Sauce Medium 125g,2.00,unit,1.60,100g
Spam Chopped Pork & Ham 200g,2.20,unit,1.10,100g
Homepride Curry Sauce 400g,1.60,unit,40p,100g
Costa Coffee Mocha Italia Signature Blend Ground for Cafetiere & Filter 200g,2.50,unit,1.25,100g
Galaxy Smooth Milk Chocolate More to Share Bar 200g,2.00,unit,1.00,100g
Sainsbury's Tuna Drained & Ready Water 120g,1.40,unit,1.17,100g
KTC Coconut Oil 500ml,2.45,unit,49p,100ml
Sainsbury's Wholewheat Tagliatelle 500g,60p,unit,1.20,kg
Clipper Everyday Organic Tea x100 Unbleached Bags 312g,3.00,unit,96p,100g
Batchelors Cup a Soup Chicken Noodle x4 94g,80p,unit,85p,100g
Mug Shot Noodles Thai Style 55g,50p,unit,9.09,kg
Bird's Instant Custard Powder Sachets 3x75g,1.60,unit,71p,100g
Yorkshire Loose Leaf Tea 250g,2.60,unit,1.04,100g
Jacob's Cracker Crisps Salt & Vinegar 150g,1.00,unit,67p,100g
Heinz Tomato Ketchup 342g,1.45,unit,42p,100g
