Description,Price/Unit,Unit,Price/Measure,Measure"Sainsbury's Washing Up Liquid, Cherry Blossom & Petal 740ml",80p,unit,1.08,ltr
Mr Muscle Shower Shine Cleaner Advanced Power 750ml,1.50,unit,2.00,ltr
"Method Handwash, Botanical Garden 354ml",2.50,unit,71p,100ml
Finish Quantum Ultimate Dishwasher Tablets x65,10.00,unit,15p,ea
Cillit Bang Power Cleaner Black Mould Remover 750ml,2.00,unit,2.67,ltr
Royal Mail First Class Stamps x6,4.56,unit,76p,ea
Silk Cut Purple King Size x20,13.40,unit,67p,cig
Bold 2in1 Washing Liquid Lavender and Camomile 840ml (24 Washes),4.00,unit,4.76,ltr
"Duck Liquid Rim Block, Cool Mist 55ml",1.00,unit,1.00,ea
1001 Carpet Fresh Exotic Flowers & Pink Grapefruit 300ml,2.80,unit,9.33,ltr
Fairy Non Bio 3in1 Pods for Sensitive Skin Washing Liquid Capsules (51 Washes),9.00,unit,7.32,kg
"Finish Powerball Dishwasher Powder, Lemon 1kg",3.50,unit,3.50,kg
"Wood Silk Wood Furniture Polish, Non-Silicone 250ml",1.50,unit,6.00,ltr
Lenor Unstoppables Fresh In Wash Scent Booster Beads 264g,7.00,unit,26.52,kg
Dishmatic Handle With Head,1.50,unit,1.50,ea
Sainsbury's Roasting Bags 28x30cm x10,1.35,unit,14p,ea
Persil Bio Laundry Liquid Colour 648ml,4.00,unit,6.17,ltr
"Surf Washing Liquid, 5 Herbal Extracts 875ml (25 washes)",3.00,unit,3.43,ltr
Finish Dishwasher Salt 2kg,2.25,unit,1.13,kg
Method Granite & Marble Spray 354ml,3.00,unit,8.48,ltr
"Glade Touch 'n' Fresh Refill, Clean Linen 10ml",2.70,unit,2.70,ea
"Neutradol Air Freshner Spray, Odour Destroyer 300ml",1.80,unit,6.00,ltr
Ace Gentle Stain Remover 1L,2.00,unit,2.00,ltr
Flash Cotton Fresh All Purpose Liquid Cleaner 1.3L,2.00,unit,1.54,ltr
"Sainsbury's Non-Latex Household Gloves, Medium",2.15,unit,2.15,ea
Benson & Hedges Gold King Size x20,13.35,unit,67p,cig
Brita Maxtra+ 3pk Cartridges,17.00,unit,17.00,ea
"Duracell Plus Alkaline AA Batteries, pack of 8",7.00,unit,88p,batt
Sainsbury's Ultra Absorbent Kitchen Towel 2 Rolls,2.50,unit,1.25,100sht
Royal Mail First Class Large Stamps x4,4.60,unit,1.15,ea
Lenor Fabric Conditioner Gold Orchid Scent 1.05L (30 Washes),3.00,unit,2.86,ltr
Ecover All In One Dishwasher Tablets x22,7.00,unit,32p,ea
Sainsbury's Laundry Cleanser 1.5L,2.80,unit,1.87,ltr
Sainsbury's Turkey Foil 3m,1.00,unit,33p,mtr
Persil Bio Laundry Liquid 648ml,4.00,unit,6.17,ltr
Comfort Pure Ultra Concentrated Fabric Conditioner Liquid 540 ML (36 Washes),2.00,unit,3.71,ltr
"Sainsbury's Super Soft Toilet Tissue Box, White x65 Sheets",95p,unit,1.46,100sht
Dr. Oetker Party Candles x18,75p,unit,75p,ea
"Method Bathroom Cleaner, Eucalyptus Mint, 828ml",3.00,unit,3.00,ea
Shout Stain Removing Spray 500ml,2.00,unit,4.00,ltr
Flash Cleaning Wipes Blossom Antibacterial x120,2.80,unit,2p,wipe
Method Sweet Water Gel Handwash 354ml,2.50,unit,71p,100ml
Fairy Non Bio Washing Liquid for Sensitive Skin 2.45L (70 Washes),9.00,unit,3.67,ltr
"Duracell Ultra Alkaline AAA Batteries, pack of 4",5.00,unit,1.25,batt
"Duracell Plus Alkaline AAA Batteries, pack of 4",4.00,unit,1.00,batt
Bold 2in1 Washing Liquid Lavender and Camomile 1.33L (38 Washes),5.00,unit,3.76,ltr
Sainsbury's Soap Filled Pads x10,80p,unit,8p,ea
"Surf Washing Powder, Tropical Lily & Ylang Ylang 1.495kg (23 Washes)",3.50,unit,2.34,kg
"Swan Menthol Filter Tips Cigarettes, Extra Slim x120",1.30,unit,1p,ea
"Persil Washing Powder, Colour 1.495kg (23 Washes)",4.50,unit,3.01,kg
Pledge 5 in 1 Wood Floor Cleaner 750ml,3.00,unit,4.00,ltr
Fairy Original Lemon Washing Up Liquid Green with LiftAction 433ml,1.00,unit,2.31,ltr
Radio Times Magazine Christmas Special,5.00,unit,5.00,ea
"Sainsbury's Stain Remover Powder, Colour 500g",2.00,unit,4.00,kg
Surf Tropical Lily Duo Capsules x18 485g,4.50,unit,9.83,kg
Lenor Fabric Conditioner Summer Breeze Scent 2.905L (83 Washes),4.00,unit,1.38,ltr
"Sainsbury's Tumble Dryer Sheets, Gentle x40",1.80,unit,5p,ea
Sainsbury's Tie Top Large Refuse Sacks x20,4.00,unit,20p,ea
Rizla Silver Slim King Size x32,84p,unit,3p,ea
Silk Cut Silver King Size 5x20,66.25,unit,66p,cig
Sainsbury's Ultimate Washing Up Liquid 450ml,85p,unit,1.89,ltr
House 247 Kitchen Towel x1,99p,unit,41p,100sht
Surf Tropical Lily Capsules X30 723g,7.00,unit,9.68,kg
Sainsbury's Washing Machine Cleaner 250ml,2.50,unit,10.00,ltr
Febreze Pet Odour Eliminator Fabric Refresher Spray 500ml,3.00,unit,6.00,ltr
Sainsbury's Dishwasher Liquid 720ml,4.00,unit,5.56,ltr
Lambert & Butler King Size x20,10.49,unit,52p,cig
Ecover Rinse Aid 500ml,4.50,unit,9.00,ltr
Dr. Beckmann Colour & Dirt Collector x30,3.10,unit,10p,ea
Spontex Sponge Cloths x5,2.00,unit,40p,ea
Bloo Powercore Cistern Blocks 2x40g,2.50,unit,1.25,ea
Closer Magazine,1.99,unit,1.99,ea
"Sainsbury's Light Weight Gloves, Medium",1.50,unit,1.50,ea
"Sainsbury's Extra-Wear Household Cleaning Gloves, Small",1.80,unit,1.80,ea
Cricket Original Simplicity Various Colours x1,1.40,unit,1.40,ea
Sainsbury's Ultra Soft Mansize Tissues Compact 1x54 Sheets,1.50,unit,2.78,100sht
"Persil 3in1 Non Bio Washing Capsules 50 Washes, 1350g",11.00,unit,7.97,kg
Rizla Silver x50,40p,unit,1p,ea
Sainsbury's Washing Up Liquid Winter Spice 450ml,50p,unit,1.11,ltr
Spontex Tough Scourer x4,1.50,unit,38p,ea
Mr Muscle Window and Glass Cleaner Advance Power 750ml,1.50,unit,2.00,ltr
Febreze Ambi Pur 3Volution Air Freshener Plug in Refill Vanilla Latte,2.75,unit,2.75,ea
Bacofoil Non-Stick Foil 20m,4.75,unit,24p,mtr
"Oust Odour Eliminator, Clean Scent 300ml",1.75,unit,5.83,ltr
"Comfort Intense Fabric Conditioner, Luxurious 900ml (60 Washes)",4.50,unit,5.00,ltr
Harpic Lavender Toilet Rim Block 39g,1.25,unit,63p,ea
Ariel All-in-1 Pods Original Washing Liquid Capsules (51 Washes),9.00,unit,7.00,kg
Sainsbury's Non Bio Concentrated Laundry Liquid 1500ml,3.50,unit,2.33,ltr
Parazone Bleach Block x2,2.00,unit,1.00,ea
Ecover All Purpose Cleaner 1L,2.00,unit,2.00,ltr
Silk Cut Silver King Size x20,13.40,unit,67p,cig
Sainsbury's Home Tealights x100,4.00,unit,4.00,ea
Benson & Hedges Sky Blue Superkings x20,9.30,unit,47p,cig
Sainsbury's 20 Large Drawstring Refuse Sacks,4.00,unit,20p,ea
Mr Sheen Leather Wipes x30,2.50,unit,8p,wipe
Croc Odor Fridge Deoderiser 140g,3.00,unit,21.43,kg
Spontex Long Lasting Kitchen Cloth x2,2.00,unit,1.00,ea
Sainsbury's Daily Shower Cleaner 750ml,80p,unit,1.07,ltr
Dylon Ultra Whitener & Stain Remover x5,2.00,unit,40p,ea
Daz 3in1 Pods for Whites and Colours Washing Liquid Capsules (12 Washes),3.00,unit,11.45,kg
Sainsbury's Super Soft Coconut Toilet Roll x9,3.75,unit,25p,100sht
Dr. Beckmann Carpet Cleaning Brush 650ml,3.50,unit,5.38,ltr
Fairy Clean & Fresh Washing Up Liquid Pomegranate 520ml,1.00,unit,1.92,ltr
"Duracell Specialty 2032 Lithium Coin Battery 3V, pack of 2",5.00,unit,2.50,batt
Dettol Antibacterial Disinfectant Surface Cleaning Spray Refill 1.2L,3.00,unit,2.50,ltr
Finish All in 1 Max Dishwasher Tablets x30,5.00,unit,17p,ea
Sainsbury's Scented Waste Basket Bags x25,1.50,unit,6p,ea
Sainsbury's Mansize Compact Tissues 2x50 Sheets,1.65,unit,1.65,100sht
Napisan Powder 800g,4.00,unit,4.00,ea
Players Real Red Superkings x20,9.30,unit,47p,cig
Air Wick Plug In Crisp Linen & Lilac Air Freshener Refill 19ml,4.00,unit,4.00,ea
Sainsbury's Ice Cube Bags x20,2.50,unit,13p,ea
House 24/7 Sponge Scourer x6,30p,unit,5p,ea
MediKills Floor Disinfecting and Cleaning Wipes x20,1.00,unit,1.00,ea
Bacofoil Non-Stick Foil 450mmx5m,3.00,unit,60p,mtr
Spontex Washups Sponge Scourers x4,1.30,unit,33p,ea
Ecover Non-Bio Washing Powder 3kg (40 Washes),9.00,unit,3.00,kg
Sainsbury's Super Soft Recycled 90 Tissue Sheets,1.40,unit,1.56,100sht
Kleenex Ultra Soft Tissues Cube Single Box,1.50,unit,2.68,100sht
MediKills Surface Disinfecting and Cleaning Wipes x50,1.00,unit,1.00,ea
Spontex Bathroom Sponge Scourer,1.20,unit,1.20,ea
Plenty Decorated Kitchen Roll x2,3.00,unit,1.50,100sht
Sainsbury's Home 50pk White Plastic Cups,1.00,unit,1.00,ea
House 247 Superior Toilet Tissue 3 Ply 18 Rolls,4.50,unit,16p,100sht
"Ecover Laundry Liquid, Delicate 750ml (16 Washes)",4.00,unit,5.33,ltr
"Method Wood Floor Cleaner, Almond, 739ml",4.00,unit,5.41,ltr
Flash Multi Purpose Cleaning Spray Lemon 469ml,1.00,unit,2.13,ltr
Sainsbury's Ultra Absorbent Decorated Kitchen Towel 2 Rolls,2.50,unit,1.25,100sht
Lenor Fabric Conditioner Summer Breeze Scent 1.19L (34 Washes),2.00,unit,1.68,ltr
Sainsbury's Microfibre Window & Glass Cloth,1.50,unit,1.50,ea
Royal Mail Second Class Large Stamps x4,3.52,unit,88p,ea
Air Wick Pure Cherry Blossom Air Freshener 250ml,2.00,unit,8.00,ltr
Febreze Vanilla Blossom Air Freshener 300ml,2.00,unit,6.67,ltr
Sainsbury's Plastic Containers x8,2.40,unit,30p,ea
Marlboro Gold King Size 5x20,59.50,unit,60p,cig
"Sainsbury's Super Soft Toilet Tissue, Pure White x24 Rolls",7.50,unit,14p,100sht
Ecover Fabric Softener Apple Blossom & Almond 750ml (25 Washes),1.50,unit,2.00,ltr
Golden Virginia Yellow Tobacco 50g,23.40,unit,46.80,100g
Surcare Sensitive Washing Powder 1.62kg (25 Washes),6.00,unit,3.69,kg
"Glade Sense & Spray Refill, Clean Linen 18ml",4.00,unit,4.00,ea
Comfort Pure Ultra Concentrated Fabric Conditioner Liquid 900 ML (60 Washes),4.50,unit,5.00,ltr
"Duracell Ultra Alkaline AAA Batteries, pack of 8",6.00,unit,75p,batt
"Duck Fresh Discs, Lime Zest 12x36ml",3.00,unit,3.00,ea
Bloo Rim Block Blue Water Flowers 50g,2.50,unit,5.00,100g
Surcare Sensitive Fabric Conditioner 750ml,1.25,unit,1.67,ltr
Benson & Hedges Silver Flip Top x20,11.40,unit,57p,cig
Sainsbury's Antiseptic Disinfectant 500ml,1.50,unit,3.00,ltr
Sainsbury's Home Napkins Cream 33cm 2ply x50,1.50,unit,1.50,ea
Rizla Blue Slim King Size x32,80p,unit,3p,ea
Spontex Handy Hygienic Sponge,1.50,unit,1.50,ea
"Raid Fly, Wasp & Mosquito Killer 300ml",3.00,unit,10.00,ltr
Fairy Platinum Plus Dishwasher Tabs Lemon x55,10.00,unit,18p,ea
House 247 Refuse Sacks x40,95p,unit,2p,ea
Bold 2in1 Washing Liquid Gel Spring Awakening 888ml (24 Washes),4.00,unit,4.50,ltr
Sainsbury's Limescale Preventer 1kg,2.20,unit,2.20,kg
Cricket Firepower Lighter,3.30,unit,3.30,ea
Wiggles The Caterpillar Cake 627g (Serves 14),6.00,unit,96p,100g
Surcare Superconcentrated Liquid 980ml,5.25,unit,5.36,ltr
Fairy Non Bio Washing Powder for Sensitive Skin 1.75Kg (27 Washes),5.00,unit,2.85,kg
House 247 Pedal Bin Liners x80,80p,unit,1p,ea
"Mr Sheen Wipes, Spring Meadow x30",2.50,unit,8p,wipe
My Weekly Magazine,2.60,unit,2.60,ea
Flash Ultra Power Spray Cleaner Fresh 500ml,3.00,unit,6.00,ltr
Plenty Handy Towels 75 sheets,2.00,unit,2.67,100sht
"Method Floor Cleaner, Lemon & Ginger 739ml",4.00,unit,5.41,ltr
Persil Capsules Bio X15 405g,5.50,unit,13.58,kg
Benson & Hedges Gold King Size 5x20,63.75,unit,64p,cig
"Comfort Fabric Conditioner, Intense Sunburst 900ml (60 Washes)",4.50,unit,5.00,ltr
Spontex Washups Non Scratch Sponge Scourer x4,1.30,unit,33p,ea
"Glade Sense & Spray Refill, Bali Sandalwood & Jasmine 18ml",4.00,unit,4.00,ea
"Sainsbury's Ultimate Washing Up Liquid, Lemon 450ml",85p,unit,1.89,ltr
Sainsbury's Microfibre Cloths x2,2.00,unit,1.00,ea
Sovereign Blue Superkings x20,9.25,unit,46p,cig
Duck Deep Action Gel Toilet Liquid Cleaner Pine 750ml,1.00,unit,1.33,ltr
Rizla Green x50.,30p,unit,1p,ea
Dettol Antibacterial Disinfectant Cleaning Citrus Zest Wipes x105,3.00,unit,3p,wipe
Sainsbury's Turkey Tray,1.50,unit,1.50,ea
Air Wick Freshmatic Compact Linen & Lilac Air Freshener Refill 2x250ml,5.00,unit,10.00,ltr
Embassy Filter x20,12.75,unit,64p,cig
"Method Multi-Surface Cleaner, Pink Grapefruit, 828ml",3.00,unit,3.62,ltr
Air Wick Pure Spring Delight Air Freshener 250ml,2.00,unit,8.00,ltr
Spontex Style Dishbrush,2.50,unit,2.50,ea
Sterling Blue Superkings x20,10.15,unit,51p,cig
Mayfair White King Size x20,10.45,unit,52p,cig
Persil Capsules Colour X15 405g,5.50,unit,13.58,kg
Rothmans Silver King Size x20,9.50,unit,48p,cig
Comfort Perfume Deluxe Heavenly Nectar Fabric Conditioner 870ml (58 washes),3.00,unit,3.45,ltr
Sainsbury's Concentrated Bio Laundry Liquid 750ml,1.75,unit,2.33,ltr
That's Life Magazine,1.70,unit,1.70,ea
Sainsbury's Roasting Tray,1.00,unit,1.00,ea
"Duck Fresh Discs, Marine 12x36ml",3.00,unit,3.00,ea
Fairy Washing up Power Spray 375ml,3.00,unit,8.00,ltr
Dettol Power & Pure Antibacterial Disinfectant Kitchen Cleaning Spray 750ml,2.50,unit,3.33,ltr
House 247 Swing Bin Liners x40,70p,unit,2p,ea
Daz Washing Powder Whites and Colours 4.225Kg (65 Washes),8.00,unit,1.89,kg
Silk Cut Purple King Size 5x20,66.25,unit,66p,cig
"Sainsbury's Fabric Conditioner, Sunshine 1.26L",1.35,unit,1.07,ltr
Duck Deep Action Gel Toilet Liquid Cleaner Marine 750ml,1.00,unit,1.33,ltr
Ambi Pur 3Volution Plug In Air Freshener Diffuser,4.00,unit,4.00,ea
Sainsbury's Window & Glass Cleaner 750ml,80p,unit,1.07,ltr
Vileda Magic Mop Refill,3.00,unit,3.00,ea
Sainsbury's Small Seriously Chocolate Cake 550g (Serves 10),6.50,unit,1.18,100g
Lenor Fabric Conditioner Fresh Meadow Scent 1.19L (34 Washes),2.00,unit,1.68,ltr
The People's Friend Magazine,2.80,unit,2.80,ea
Fairy Platinum Quickwash Original Washing Up Liquid 1050ml,3.00,unit,2.86,ltr
Players Bright Blue Superkings x20,9.30,unit,47p,cig
Sainsbury's Fresh Linen Gel Air Freshener 150g,80p,unit,80p,ea
Bold All-in-1 Pods Lavender and Camomile Washing Liquid Capsules (36 Washes),7.00,unit,10.20,kg
Dettol 2in1 Anti-Bacterial Wipes x15 Wipes,1.50,unit,10p,wipe
Carlton Red Superkings x20,8.60,unit,43p,cig
Amber Leaf Original Tobacco 30g,15.75,unit,53p,g
Rothmans Blue King Size x20,8.60,unit,43p,cig
Dr. Oetker Lettered Happy Birthday Candles,1.50,unit,1.50,ea
Benson & Hedges Sky Blue King Size x20,9.30,unit,47p,cig
Persil Capsules Bio X38 999g,6.00,unit,6.01,kg
Air Wick Pure Soft Cotton Air Freshener 250ml,2.00,unit,8.00,ltr
"Glade Touch 'n' Fresh Refill, Relaxing Zen 10ml",2.70,unit,2.70,ea
Lenor Fabric Conditioner Ocean Escape Scent 1.05L (30 Washes),3.00,unit,2.86,ltr
Lenor Fabric Conditioner Lavender and Camomile Scent 1.19L (34 Washes),3.00,unit,2.52,ltr
Benson & Hedges Gold x20,13.40,unit,67p,cig
Kleenex Ultra Soft Extra Large Tissues Compact Box 2 Pack,3.50,unit,3.98,100sht
Sainsbury's Colour Bio Concentrated Laundry Liquid 50 Washes 1500ml,3.50,unit,2.33,ltr
Marlboro Gold Touch x20,10.10,unit,51p,cig
"Duracell Plus 9V Alkaline Batteries, pack of 2",6.50,unit,3.25,ea
Duck Fresh Strips Pine x3,1.00,unit,1.00,ea
Chesterfield Blue King Size x20,8.60,unit,43p,cig
"Vanish Pre-Treat Stain Remover Power Gel, Colour 200ml",4.50,unit,22.50,ltr
Sainsbury's Air Freshener Aerosol 300ml,60p,unit,2.00,ltr
Marlboro Red King Size x20,11.90,unit,60p,cig
Marlboro Gold Superkings x20,11.95,unit,60p,cig
Sainsbury's Roasting Tray,1.00,unit,1.00,ea
Dettol Antibacterial Disinfectant Cleaning Citrus Zest Wipes x70,3.50,unit,5p,ea
"Duck Fresh Discs, Floral Oasis 6x36ml",1.75,unit,1.75,ea
Ariel All-in-1 Pods Colour Washing Liquid Capsules (51 Washes),9.00,unit,7.41,kg
Marlboro Gold King Size x200,119.00,unit,60p,cig
"Kiwi Instant Shoe Wax Shine, Black 75ml",2.75,unit,36.67,ltr
Air Wick Plug In Crisp Linen & Lilac Air Freshener Refill 2x19ml,5.00,unit,2.50,ea
Pledge Floor Wipes x12,3.00,unit,25p,ea
Halo Sports Laundry Liquid 1L (25 Washes),4.00,unit,4.00,ltr
Sainsbury's Limescale Remover 500ml,1.50,unit,3.00,ltr
Lambert & Butler King Size 5x20,51.75,unit,52p,cig
Air Wick Essential Oils Infusion White Vanilla Bean Candle,3.00,unit,3.00,ea
Dunhill Red King Size x20,13.00,unit,65p,cig
Ten Motives Electronic Cigarette Refills x4,8.00,unit,2.00,ea
Pritt Stick 43g,2.50,unit,2.50,ea
Sainsbury's 2in1 Bio Concentrated Laundry Liquid Lavender & Jasmine 50 Washes 1500ml,3.50,unit,2.33,ltr
Air Wick Freshmatic Compact Smooth Satin Air Freshener Refill 250ml,4.00,unit,4.00,ea
Flash Cleaning Wipes Lemon Antibacterial x120,2.80,unit,2p,wipe
Kleenex Collection Tissues Cube Single Box,1.50,unit,2.68,100sht
JS Antibacterial Bathroom Cleaner Spray 750ml,80p,unit,1.07,ltr
Febreze with Ambi Pur Air Freshener Plug In Refill Cotton Fresh,4.00,unit,4.00,ea
Ecover Power Toilet Cleaner Lemon & Orange 750ml,1.50,unit,2.00,ltr
Fairy Non Bio Washing Liquid Gel for Sensitive Skin 1.295L (35 Washes),6.00,unit,4.63,ltr
"Duracell Plus Alkaline C Batteries, pack of 2",4.00,unit,2.00,batt
Spontex Handy Tough Scourer,1.50,unit,1.50,ea
Stergene Handwash Laundry Liquid 500ml (15 Washes),2.50,unit,5.00,ltr
Sainsbury's Fresh Breeze Laundry Fragrance Pearls 275g,2.80,unit,10.18,kg
Bold 2in1 Washing Liquid Bloom and Yellow Poppy 1L (38 Washes),5.00,unit,3.76,ltr
"Sainsbury's Tough Gloves, Medium",2.25,unit,2.25,ea
Heat Magazine,1.99,unit,1.99,ea
Sainsbury's Travel Tissues 1x72 Sheets,1.50,unit,2.08,100sht
Ecover Bio Concentrated Laundry Liquid 1.5L (42 washes),6.50,unit,4.33,ltr
Fairy Snuggly Soft Fabric Conditioner for Sensitive Skin 1.05L (30 Washes),3.00,unit,2.86,ltr
Spontex Multi-Purpose Cloth x2,1.50,unit,75p,ea
Bold All-in-1 Pods Lavender and Camomile Washing Liquid Capsules (25 Washes),7.00,unit,11.63,kg
Carlton Red King Size x20,8.60,unit,43p,cig
Ecover Washing-Up Liquid Pomegranate & Fig 450ml,1.75,unit,3.89,ltr
"Kiwi Parade Gloss Leather Paste Polish, Black 50ml",2.10,unit,42.00,ltr
Lenor Fabric Conditioner Ruby Jasmine Scent 1.05L (30 Washes),3.00,unit,2.86,ltr
10m Wrap - LWC - Nordic - Red Trees,3.00,unit,3.00,ea
Sarah Smith Ultra Absorbent Cloth x4,2.00,unit,50p,ea
Royal Red King Size x23,13.00,unit,57p,cig
Lord Sheraton Caretaker Polish 300ml,2.00,unit,6.67,ltr
Sainsbury's Carpet & Upholstery Cleaner with Active Oxygen 500ml,2.00,unit,4.00,ltr
Kleenex Balsam Extra Large Tissues Compact Box 2 Pack,3.50,unit,3.98,100sht
Superkings x20,12.75,unit,64p,cig
Marlboro Gold King Size x40,23.80,unit,60p,cig
Lenor Fabric Conditioner Ruby Jasmine 1.925L (55 Washes),3.00,unit,1.64,ltr
Energizer Max Plus AA Batteries 10-Pack,8.50,unit,85p,batt
Dettol Antibacterial Disinfectant Multi Surface Spray Lemon & Lime 1L,1.50,unit,1.50,ltr
Bold All-in-1 Pods Sparkling Bloom and Yellow Poppy Washing Liquid Capsules (15 Washes),3.50,unit,9.67,kg
"Kiwi Shoe Polish, Black 50ml",1.10,unit,1.10,ea
Comfort Perfume Deluxe Lavish Blossom Fabric Conditioner 870ml (58 washes),3.00,unit,3.45,ltr
JS Antibacterial Kitchen with Bleach Spray 750ml,80p,unit,1.07,ltr
Febreze Ambi Pur 3Volution Air Freshener Plug in Refill Blossom & Breeze,2.75,unit,2.75,ea
Chesterfield Red King Size x20,8.60,unit,43p,cig
Mr Sheen Express Mist Spring Meadow Polish 345ml,1.35,unit,3.92,ltr
Sainsbury's Chocolate Party Traybake 730g (Serves 15),5.00,unit,69p,100g
Dr. Beckmann Service-it Washing Machine Cleaner 250ml,2.30,unit,9.20,ltr
Ariel Original Washing Liquid 2.45L (70 Washes),9.00,unit,3.67,ltr
L&b Blue Real Blue King Size x20,9.30,unit,47p,cig
Windsor John Player Special Real Blue Superkings x20,10.14,unit,51p,cig
Sainsbury's Home 25Pk Strong White Paper Plate,2.00,unit,2.00,ea
Benson & Hedges Gold King Size 10x20,133.00,unit,67p,cig
Camel Blue King Size x20,13.00,unit,65p,cig
"Sainsbury's Fabric Freshener, Lavender & Jasmine 500ml",1.50,unit,3.00,ltr
Golden Virginia Yellow Tobacco 30g,14.15,unit,47p,g
Vanish Gold Oxi Action Fabric Stain Remover Powder - Colours & Whites 1 kg,6.00,unit,6.00,kg
Finish All-in-1 Max Lemon X80,10.00,unit,13p,ea
Febreze with Ambi Pur Air Freshener Plug In Refill Vanilla Latte,4.00,unit,4.00,ea
Sainsbury's Home 3pk Oval Aluminium Foil Tray Platters 35cm,2.50,unit,2.50,ea
Cutters Choice Extra 30g,14.15,unit,47p,g
Poppell Lighter x3,1.75,unit,58p,ea
Air Wick Pink Sweet Pea Reed Diffuser 25ml,4.00,unit,4.00,ea
Yours Magazine,1.65,unit,1.65,ea
Sainsbury's Home Clear Plastic Tumbler 380ml x10,2.00,unit,2.00,ea
Comfort Intense Limited Edition Lavender Fabric Conditioner 900ml (60washes),4.50,unit,5.00,ltr
House 247 Wrapping Foil 290mm x 20m,65p,unit,3p,mtr
Sainsbury's Mighty Multi-Use Towel 2 Rolls,2.50,unit,1.79,100sht
Persil Capsules Non Bio X15 405g,5.50,unit,13.58,kg
Surf Herbal Extracts Capsules X30 723g,7.00,unit,9.68,kg
John Player Special Black King Size x20,11.60,unit,58p,cig
"Duracell Plus Alkaline D Batteries, pack of 2",4.00,unit,2.00,batt
Air Wick Freshmatic Compact Pink Sweet Pea Air Freshener Refill 250ml,4.00,unit,4.00,ea
Old Holborn Tobacco 50g,28.20,unit,56.40,100g
8m Extra Wide Wrap - LWC - Dear Santa - Characters Asst,2.50,unit,2.50,ea
Dettol 5-in-1 Antibacterial Washing Machine Cleaner Lemon Breeze 250ml,3.50,unit,14.00,ltr
Players Real Red King Size x20,9.30,unit,47p,cig
Lambert & Butler Gold x20,10.45,unit,52p,cig
Embassy Signature Gold King Size 20,8.60,unit,43p,cig
Sainsbury's Home Red Lunch Napkins x50,2.50,unit,2.50,ea
Sainsbury's Home Brown Paper Roll 5m,1.00,unit,1.00,ea
Pledge Duster Starter Kit,2.00,unit,2.00,ea
"Sainsbury's Light Weight Gloves, Small",1.50,unit,1.50,ea
"Sainsbury's Light Weight Gloves, Large",1.50,unit,1.50,ea
Best Magazine,1.25,unit,1.25,ea
Benson & Hedges Silver 5x20,56.75,unit,57p,cig
Stardrops The Pink Stuff The Miracle Cleaning Paste 500g,1.00,unit,2.00,kg
"Method Daily Shower Cleaner, Passion Fruit, 828ml",3.00,unit,3.62,ltr
Whats On TV Magazine Christmas Special,1.40,unit,1.40,ea
Ambi Pur 3Volution Air Freshener Plug-In Refill Pet 20ml,2.75,unit,2.75,ea
Marlboro Red King Size 5x20,59.50,unit,60p,cig
Mayfair Superkings x20,10.45,unit,52p,cig
Rothmans Blue Original King Size x20,13.00,unit,65p,cig
Swan Filter Tips Ultra Slim x126,1.20,unit,1.20,cig
Fairy Non Bio Pods Washing Liquid Capsules 25 Washes,7.00,unit,11.61,kg
"Duracell Ultra Alkaline AA Batteries, pack of 12",12.00,unit,1.00,unit
Hello! Magazine,2.30,unit,2.30,ea
Ariel Original Washing Powder 1.75Kg (27 Washes),5.00,unit,2.85,kg
Sainsbury's Pink Blossom Laundry Fragrance Pearls 275g,2.80,unit,10.18,kg
Dishmatic General Purpose Refills x6,3.00,unit,50p,ea
Bold All-in-1 Pods Lavender and Camomile Washing Liquid Capsules (15 Washes),3.50,unit,9.67,kg
"Glade Sense & Spray Refill, Relaxing Zen 18ml",4.00,unit,4.00,ea
"Kiwi Express Shoe Shine, Black",2.60,unit,2.60,ea
Lenor Unstoppables Fresh In-Wash Scent Booster 570g,8.00,unit,14.04,kg
"Sainsbury's Tough Gloves, Large",2.25,unit,2.25,ea
Sainsbury's Home Dinner Napkins White 40cm 3ply x20,2.25,unit,2.25,ea
Sellotape Super Clear 50m,2.00,unit,2.00,ea
Jeyes Fluid 300ml,4.00,unit,13.33,ltr
Comfort Perfume Deluxe Luscious Bouquet Fabric Conditioner 870ml (58 washes),3.00,unit,3.45,ltr
"Method Wood Polish, Almond, 354ml",3.00,unit,8.48,ltr
Large Seriously Chocolate Cake 1.28kg (Serves 20),9.00,unit,70p,100g
Sainsbury's Fresh Linen Candle 175g,2.00,unit,2.00,ea
Fairy Platinum Plus Dishwasher Tabs Lemon x21,7.00,unit,33p,ea
Sainsbury's Home 10pk Clear Plastic Wine Glasses,2.00,unit,2.00,ea
Players Red Volume Tobacco 50g,23.90,unit,47.80,100g
Flash Ultra Power Liquid Gel Cotton Fresh 600ml,3.00,unit,5.00,ltr
Lenor Fabric Conditioner Parfum Des Secrets Dazzle Scent 900ml,3.00,unit,3.34,ltr
BRITA Maxtra+ Water Filter Cartridge Single,6.50,unit,6.50,ea
Sainsbury's Blossom Petals Gel Air Freshener 150g,80p,unit,80p,ea
Vanish Oxi Action Fabric Stain Remover Powder - Colours & Whites 1.5 kg,12.00,unit,8.00,kg
New! Magazine,1.75,unit,1.75,ea
Brasso Metal Polish 175ml,2.50,unit,14.29,ltr
Sterling Tobacco 50g,19.50,unit,39.00,100g
Surf  Tropical Lily Washing Liquid 47 Wash1.645 L,5.00,unit,3.03,ltr
Sainsbury's Accompaniments Trays x2,1.00,unit,50p,ea
Energizer Max AA x12,5.00,unit,42p,batt
Brasso Wadding 75g,2.50,unit,3.33,100g
Surf Coconut Bliss Laundry Liquids 875ml,3.00,unit,3.43,ltr
Sainsbury's Home 25pk Plastic Bowls,2.00,unit,2.00,ea
Finish Dishwasher Protector 30g,5.00,unit,16.67,100g
Sainsbury's Non-Bio Liquid Laundry Capsules x19,2.75,unit,5.98,kg
Sainsbury's Home Plastic Plates White x25,2.00,unit,2.00,ea
Sainsbury's Super Soft Coconut Toilet Roll x4,1.90,unit,28p,100sht
John Player Special Real Blue Superkings 20s,10.14,unit,51p,cig
Benson & Hedges Blue King Size x100,47.25,unit,47p,cig
"Duracell Plus 9V Alkaline Batteries, pack of 1",4.00,unit,4.00,batt
Ecover Zero Sensitive Washing-Up Liquid 450ml,1.75,unit,3.89,ltr
Sainsbury's Non Bio Laundry Powder 4.55kg (70 Washes),6.25,unit,1.37,kg
Golden Virginia Original Tobacco 30g,15.75,unit,52.50,100g
Superkings Blue x20,12.75,unit,64p,cig
Embassy Signature Gold King Size 100,42.75,unit,43p,cig
Raid Ant & Cockroach Killer 300ml,3.00,unit,10.00,ltr
E-cloth Wash & Wipe Kitchen Cloths x2,3.00,unit,1.50,ea
Bold All-in-1 Pods Spring Awakening Washing Liquid Capsules (25 Washes),7.00,unit,11.63,kg
Vileda Supermocio Compact Mop,6.75,unit,6.75,ea
OK! Magazine,2.40,unit,2.40,ea
Bio Tex Stain Removing Powder 500g,1.10,unit,1p,ea
Swan Slimline Filters Pop-a-tip x102,1.10,unit,1p,ea
Tiger Tim Wood Wool Firelighters 400g,3.00,unit,3.00,ea
4m Wrap - LWC - Nordic - Trad Santa,2.00,unit,2.00,ea
Ambi Pur Plug In Blossom & Breeze Air Freshener Refill 20ml,4.00,unit,4.00,ea
Sainsbury's Chocolate Party Cake 930g (Serves 12),6.00,unit,65p,100g
Vanish Gold Oxi Action Powder Fabric Stain Remover 470g,5.75,unit,12.23,kg
Prism All in 1 Dishwasher Tablets Citrus x50,6.00,unit,12p,ea
Method All Floor Cleaner Wild Rhubarb 739ml,4.00,unit,5.33,ltr
Superkings x100,63.50,unit,64p,cig
Sainsbury's Happy Birthday Madeira Cake 1.26kg (Serves 18),10.00,unit,83p,100g
Sainsbury's Limescale Preventer Tablets x15,2.80,unit,19p,ea
Mayfair King Size x20,10.45,unit,52p,cig
Method Concentrated Laundry Detergent Peony Blush 1.56L (39 Washes),10.00,unit,6.41,ltr
Silk Cut Purple King Size x200,133.00,unit,67p,cig
Sainsbury's Seasonal Super Absorbent Kitchen Towels x2,2.00,unit,1.00,100sht
