Description,Price/Unit,Unit,Price/Measure,MeasureNational Enquirer Magazine,2.10,unit,2.10,ea
Ambi Pur 3Volution Plug-In Air Freshener Starter Kit Spiced Apple 20ml,9.00,unit,9.00,ea
"Air Wick Electrical Plug In Kit, White Vanilla Bean - Holder & 1 Refill 19 mL",6.00,unit,6.00,ea
Get Creative child safe scissors,1.00,unit,1.00,ea
Sainsbury's Pop Up Laundry Bin Blue & White Stripes,10.00,unit,10.00,ea
Febreze 3Volution Plug-In Air Freshener Refill White Jasmine 20ml,2.75,unit,2.75,ea
Duni Biodegradable 10pk Bagasse Pebble Plates,3.50,unit,3.50,ea
HOME LED GU10 50w Dimmable x2,6.00,unit,6.00,ea
Dentalife Sticks Small Dog Chews x30 490g,4.30,unit,8.78,kg
Sainsbury's Home Laundry Marker Black Ink,2.00,unit,2.00,ea
Four Four Two Magazine,5.99,unit,5.99,ea
Cif Antibacterial & Shine Ecorefill 99.9% Germ Kill Multipurpose Disinfectant Cleaner 70ml,1.50,unit,21.43,ltr
Ecover Zero Sensitive Non-Bio Laundry Liquid 42 Washes 1.5L,9.00,unit,6.00,ltr
Amscan Canap Serving Platter Rectangle Small,2.00,unit,2.00,ea
Air Wick VIPoo Fruity Pin-Up Toilet Freshener Spray 55ml,6.50,unit,6.50,ea
Spontex Microfibre Mosaik Cloth x3,3.00,unit,1.00,ea
Sainsbury's Home Ice Fountain x3,2.00,unit,2.00,ea
Sainsbury's Home 50pk Mixed Blue Paper Straws,2.50,unit,2.50,ea
Aqua Vape Blueberry E-Liquid 10ml,3.25,unit,33p,ml
Home Led G9 4 Pack,8.00,unit,8.00,ea
Sainsbury's Home Frosted Cedar Mini Boxed Candle,3.00,unit,3.00,ea
Addis Wave Kitchen Bowl White,6.00,unit,6.00,ea
Botanica by Air Wick Room Spray Island Rose & African Geranium 236ml,4.00,unit,4.00,ea
Sainsbury's Home Gel Pens x6,2.00,unit,2.00,ea
Country Living Magazine,4.99,unit,4.99,ea
Marlboro Bright Kingsize x20,11.90,unit,11.90,ea
Kiwi Leather Insole,5.00,unit,2.50,ea
Energizer Maxi Charger 4xAA 2000 mAH,18.00,unit,18.00,unit
Sainsbury's Home Microfibre Duster,2.50,unit,2.50,ea
Aqua Vape Strawberry Delight E-Liquid 10ml,3.25,unit,33p,ml
Heets Green Selection x20,5.00,unit,5.00,ea
Unstoppables Plug In Lavish Refill 20ml,5.00,unit,5.00,ea
Sainsbury's Home Squeegee,2.50,unit,2.50,ea
"Air Wick Limited Edition Freshmatic Autospray Refill, Warm Amber Rose  1 Refill 250ml",3.00,unit,12.00,ltr
Dentalife Sticks Large Dog Chews x18 636g,4.30,unit,6.76,kg
Bold Two-in-One Washing Liquid Summer Breeze 1.9L 57 Washes,7.00,unit,3.29,kg
Prism 3in1 Non-bio Caps 15wash 367.5g,3.50,unit,9.52,kg
FreshX Tissue Spritz Coconut Oil 100ml,3.00,unit,3.00,100ml
Glade Large Candle Nordic Crisp Pine 224g,4.00,unit,4.00,ea
Duni Biodegradable Ecoecho Tumbler 35cl x12,2.00,unit,2.00,ea
AromaWorks Balance Natural Home Fragrance Candle 220g,9.00,unit,30.00,ltr
JUULpods Glacier Mint (Pack of 4) 9mg/ml,11.00,unit,3.93,ml
"Air Wick Limited Edition Freshmatic Autospray Refill, Mulled Wine  1 Refill 250ml",3.00,unit,12.00,ltr
Sainsbury's Home Peg Basket & Pegs x100,6.00,unit,6.00,ea
Yankee Large Jar Cherry Vanilla Candle,14.00,unit,14.00,ea
HOME LED Frosted Candle 25w BC x2,5.00,unit,5.00,ea
Sainsbury's Home Moorlands Gold Spring Tablecover,3.50,unit,3.50,ea
Energizer Max C x2,3.75,unit,1.88,batt
Sainsbury's Home Compact Black Wire Dish Drainer,5.00,unit,5.00,ea
Railway Modeller Magazine,4.80,unit,4.80,ea
Lambert & Butler Original Rolling Tobacco 30g,12.80,unit,42.67,100g
12pk 2TV - Community,3.00,unit,3.00,ea
Kilrock Blast Away Mould Brush On Gel 250ml,4.00,unit,4.00,ea
illoom Mix Colour Light Up Balloon x5,3.50,unit,3.50,ea
Seventh Generation Patchouli Ultra-Concentrated Washing Liquid 924ml (42 Washes),6.00,unit,6.49,ltr
"Energizer Intelligent Pro Charger, AA x4",22.00,unit,22.00,unit
Lambert & Butler Original Rolling Tobacco 50g,19.50,unit,19.50,ea
Sainsbury's Home 10pk Rainbow Balloon Design Plate,1.50,unit,1.50,ea
Girl Talk Magazine,4.99,unit,4.99,ea
Toastabags 7'' Cake Tin Liners x2,2.00,unit,1.00,ea
Boofle Happy Christmas Card,2.00,unit,2.00,ea
Rizla Polar Blast Extra Slim Tips x60,99p,unit,99p,ea
Duni Biodegradable 10pk Bagasse Pebble Bowls,3.50,unit,3.50,ea
Seventh Generation Bathroom Cleaning Spray 500ml,2.50,unit,5.00,ltr
Sainsbury's Home Frosted Cedar Lit Gel Candle Large,12.00,unit,12.00,ea
Sainsbury's Home Red Christmas Tablecover,2.62,unit,2.62,ea
Vax Steam Detergent Pet 1L,10.00,unit,10.00,ea
Sainsbury's Home Wooden Pegs x24,2.25,unit,2.25,ea
Yankee Small Jar Exotic Fruits Candle,5.00,unit,5.00,ea
Seventh Generation Ultra-Concentrated Washing Liquid 924ml (42 Washes),6.00,unit,6.49,ltr
"Botanica by Air Wick Candle, Vanilla & Himalaya Magnolia",7.00,unit,7.00,ea
Cirro 3 Regular Tobacco eLiquid Bottles 18mg 10ml,10.00,unit,1.00,ml
Unstoppables Car Air Freshener Fresh,3.00,unit,3.00,ea
Sainsbury's Home Diffuser 40ml Patchouli & Amber,3.50,unit,3.50,ea
Glade Automatic Spray Relaxing Zen Air Freshener 269ml,6.00,unit,22.31,ltr
"Botanica by Air Wick Reed Diffuser, Island Rose & African Geraneum",9.00,unit,9.00,ea
"Duracell High Power Lithium 123 Batteries 3V, pack of 2",10.00,unit,5.00,batt
HOME LED GU5.3 35w Dimmable x4,14.00,unit,14.00,ea
Habitat Scented Candles 3x50g,12.00,unit,12.00,ea
4m Wrap - LWC - Rhapsody - Assorted Leopard / Zebra,2.00,unit,2.00,ea
Masterplug UK to USA Travel Adaptor,2.99,unit,2.99,ea
Sainsbury's Home Black Permanent Markers x5,3.00,unit,3.00,ea
Real Homes Magazine,3.99,unit,3.99,ea
"Air Wick Essential Mist Diffuser Refill, Fresh Water Breeze - 1 Refill 20 mL",5.00,unit,5.00,ea
Sainsbury's Home Replacement Washing Line 20m,2.00,unit,2.00,ea
Yankee Wax Melts White Linen And Lace,3.50,unit,3.50,ea
JUULpods Menthol 18mg/ml (Pack of 4),11.00,unit,3.93,ml
illoom Faces Light Up Balloon x5,3.50,unit,3.50,ea
Blu E-liquid Strawberry Mint,3.95,unit,40p,ml
HOME LED Standard 75w ES x2,5.00,unit,5.00,ea
Swan Crushball Fresh Burst Extra Slim Capsule Filter Tips x54,1.25,unit,1.25,ea
Sainsbury's Home Frosted Cedar Pot Pourri,7.00,unit,7.00,ea
AromaWorks Balance Natural Home Fragrance Candle 220g,9.00,unit,30.00,ltr
One I love Mistletoe Christmas Card,3.00,unit,3.00,ea
Sainsbury's Home Heart Votive Candles x3,4.00,unit,4.00,ea
Love It Magazine,76p,unit,76p,ea
Sainsbury's Home 20pk Navy Spot Lunch Napkin,2.00,unit,2.00,ea
Aquavape Black Jack 6mg,3.25,unit,33p,ml
Ambi Pur Plug-In Air Freshener Refill White Jasmine 20ml,4.00,unit,4.00,ea
Unibond double sided tape 50 x 5mm,4.50,unit,4.50,ea
Sainsbury's Ultra Soft Pure White,1.50,unit,1.88,100sht
Relax & Unwind Candle,4.50,unit,4.50,ea
"Air Wick Limited Edition Freshmatic Autospray Kit, Mulled Wine  Holder & 1 Refill 250ml",8.00,unit,32.00,ltr
Sainsbury's Home Grout Brush,2.00,unit,2.00,ea
Brita Fill & Go Vital  Lime,15.00,unit,15.00,ea
Sainsbury's Home Room Spray Patchouli & Amber,3.00,unit,3.00,ea
Puzzlelife Pad Codewords Magazine,2.85,unit,2.85,ea
Prism Laundry 3 in 1 Colour Bio Liquid Capsules Washes (15 Washes),3.50,unit,9.52,kg
Sainsbury's Home Birthday Boy Rosette Badge,1.50,unit,1.50,ea
Glade Touch & Fresh Air Freshener Tropical Blossoms 10ml,3.00,unit,3.00,ea
Aquavape Ice Mint 6mg,3.25,unit,33p,ml
"Botanica by Air Wick Reed Diffuser, Fresh Pineapple and Tunisian Rosemary",9.00,unit,9.00,ea
Heets Sienna Caps Selection x20,5.00,unit,5.00,ea
Seventh Generation Pine & Sage Toilet Cleaner 500ml,2.50,unit,5.00,ltr
"Air Wick Limited Edition Electrical Plug In Kit, Warm Amber Rose - Holder & 1 Refill",6.00,unit,6.00,ea
Kiwi Sneaker Protector 200ml,3.50,unit,3.50,ea
Sainsbury's Home 20pk Pink Spot Lunch Napkin,2.00,unit,2.00,ea
HP 364 Yellow Inkjet Cartridge,10.00,unit,10.00,ea
Energizer Max 9V x2,6.00,unit,3.00,batt
RAC 120 Lumen Heavy Duty Lantern,9.99,unit,9.99,ea
Prism 3in1 Colour Caps 38w,5.00,unit,5.37,kg
Sainsbury's Home Sparkler Number 1,1.00,unit,1.00,ea
Sainsbury's Home Dutch Glam Large Gel Candle (Gold),12.00,unit,12.00,ea
Take A Break Monthly,2.10,unit,2.10,ea
Sainsbury's Home White Twist Candles x24,1.50,unit,1.50,ea
Kiwi Show Passion Gel Cushion Insole x1 Pair,5.10,unit,5.10,ea
Swan Crushball Cool Burst Extra Slim Capsule Filter Tips x54,1.25,unit,1.25,ea
"Botanica by Air Wick Electrical Plug In Kit, Island Rose & African Geraneum - Holder & 1 Refill 19 mL",8.00,unit,8.00,ea
JUULpods Golden Tobacco (Pack of 4) 9mg/ml,11.00,unit,3.93,ml
Glade Sense & Spray Automatic Air Freshener Starter Kit Clean Linen 18ml,8.00,unit,8.00,ea
Energizer Max D x2,3.75,unit,1.88,batt
Home Led G9 Twin Pack,5.00,unit,5.00,ea
Air Wick Plug-In Air Freshener Kit Mulled Wine 19ml,6.00,unit,6.00,ea
New Statesman Magazine,6.50,unit,6.50,ea
Sainsbury's Home 10pk Mixed Rainbow Plain Plates,1.50,unit,1.50,ea
Sainsbury's Home Diffuser 90ml Jasmine & Pineapple Flower,8.00,unit,8.00,ea
Cif Citrus Burst large wipes x80,2.00,unit,3p,ea
Sainsbury's Home Diffuser 90ml Rhubarb & Elderflower,8.00,unit,8.00,ea
Sainsbury's Home Diffuser 40ml Lavender & Geranium,3.50,unit,3.50,ea
Sainsbury's Home Bulb LED GU5.3 35w Dimmable x2,8.00,unit,8.00,ea
Country Life Magazine,6.50,unit,6.50,ea
Puzzlelife Pad Sudoku Magazine,2.85,unit,2.85,ea
blu myblu Liquidpod Green Apple 0.8%,6.00,unit,2.00,ml
Vileda Supermocio Soft Refill Microfibre,3.00,unit,3.00,ea
"Botanica by Air Wick Candle, Island Rose & African Geraneum",7.00,unit,7.00,ea
Sainsbury's Home Gold Tree Tablecover,2.62,unit,2.62,ea
Grazia,2.75,unit,2.75,ea
Fun To Learn Friends,3.99,unit,3.99,ea
Tobar Touchable Bubbles,2.00,unit,2.00,ea
Puzzler Pocket Crosswords Collection,2.50,unit,2.50,ea
Masterplug 13a Fused Plug White,1.99,unit,1.99,ea
Airwick Plug-In Air Freshener Refill Pink Sweet Pea 19ml,4.00,unit,4.00,ea
Sainsbury's Home Diffuser 40ml Jasmine & Pineapple Flower,3.50,unit,3.50,ea
Duni Biodegradable Ecoecho Tumbler 53cl x12,2.50,unit,2.50,ea
Sainsbury's Home Diffuser 40ml Seasalt & Cedar,3.50,unit,3.50,ea
Sainsbury's Home Sparkler Number 9,1.00,unit,1.00,ea
JUULpods Mango Nectar (Pack of 4) 9mg/ml,11.00,unit,3.93,ml
Sainsbury's Home Slim Permanent Markers x6,2.50,unit,2.50,ea
Sainsbury's Home 50pk Mixed Pink Paper Straws,2.50,unit,2.50,ea
Energizer Max Plus C Batteries 2-Pack,4.75,unit,2.38,batt
Parker Vector Black Fountain Pen,10.00,unit,10.00,ea
Parker Jotter Stainless Steel Ball Pen,12.00,unit,12.00,ea
"Air Wick Freshmatic Autospray Kit, Spring Delight - Holder & 1 Refill 250 mL",5.00,unit,20.00,ltr
Sainsbury's Home Pink Wipeable Tablecover,3.00,unit,3.00,ea
Sainsbury's Home Diffuser 90ml Lavender & Geranium,8.00,unit,8.00,ea
Mojo Magazine,5.85,unit,5.85,ea
Prism 3in1 Bio Caps 38wash 931g,5.00,unit,13p,ea
Home Led G4 1.5w 4 Pack,6.00,unit,6.00,ea
Yankee Wax Melts Sugared Blossom,3.50,unit,3.50,ea
Prism 3in1 Bio Caps 15 Washes 367.5g,3.50,unit,9.52,kg
Sainsbury's Home Plunger,3.50,unit,3.50,ea
Brita Style Jug Blue,27.00,unit,27.00,ea
Flypast Magazine,4.99,unit,4.99,ea
Yankee Small Jar Stoney Cove,5.00,unit,5.00,ea
Pick Me Up Magazine,76p,unit,76p,ea
Cycling Plus Magazine,6.99,unit,6.99,ea
Yankee Med Jar White Linen And Lace Candle,10.00,unit,10.00,ea
Glade Sense & Spray Air Freshener Merry Berry & Bright 18ml,8.00,unit,8.00,ea
Puzzlelife Pad Crossword Magazine,2.85,unit,2.85,ea
Woolite Dark Fabrics & Denim 750ml,4.75,unit,6.33,ltr
Yankee Wax Melts Exotic Fruits,3.50,unit,3.50,ea
BRITA Maxtra+ Annual Pack,58.00,unit,58.00,ea
Sainsbury's Home Diffuser 40ml Rhubarb & Elderflower,3.50,unit,3.50,ea
Glade Automatic Spray Air Freshener Artic Apple Pie 269ml,6.00,unit,6.00,ea
HOME LED Filament Globe 40W SESx2,5.00,unit,5.00,ea
Sainsbury's Home Deep Cake Tin,3.00,unit,3.00,ea
Bold All-in-One Pods Washing Liquid Capsules Summer Breeze 36 Washes,8.50,unit,9.80,kg
Vype Epod Vpro Chilled Mint 18mg,6.00,unit,1.58,ml
Richmond Green Filter Superkings x100,56.00,unit,56p,cig
Brita Fill & Go Active  Lime,12.00,unit,12.00,ea
Energizer Max Plus D Batteries 2-Pack,4.75,unit,2.38,batt
Sainsbury's Home Personalised Banner 270cm,3.00,unit,3.00,ea
Sainsbury's Home Room Spray Lavender & Geranium,3.00,unit,3.00,ea
Sainsbury's Home Microfibre Blind Cleaner/Duster,2.50,unit,2.50,ea
Energizer Max 9V x1,3.75,unit,3.75,batt
Sh 20pk Rainbow Balloon Lunch Napkin,2.00,unit,2.00,ea
Kiwi Sneaker Cleaner 75ml,3.50,unit,3.50,ea
Seventh Generation Palmarosa Ultra-Concentrated Washing Liquid 924ml (42 Washes),6.00,unit,6.49,ltr
Kiwi Sneaker Deo 100ml,3.85,unit,3.85,ea
Puzzler Pocket Wordsearch Magazine,2.50,unit,2.50,ea
Kidde 5 Year Optical Smoke Alarm,12.50,unit,12.50,ea
Sainsbury's Home 10pk Happy Birthday Blue Plate,1.50,unit,1.50,ea
Sainsbury's Home Diffuser 40ml Ginger & White Pomelo,3.50,unit,3.50,ea
Vanish Oxi Action Crystal White Gold Standard Gel Fabric Whitener + Stain Remover 750ml,5.75,unit,7.67,ltr
Bold All-in-One Pods Capsules Ruby Jasmine 25 Washes,7.00,unit,11.67,kg
Lets Knit Magazine,6.99,unit,6.99,ea
Sainsbury's Home Gold Spot Tablecover 120x180cm,3.50,unit,3.50,ea
Vype ePen3 vPro Starter Kit- Black,7.00,unit,7.00,ea
Air Wick Freshmatic Max Refill Pure Cherry Blossom 250ml,4.00,unit,4.00,ea
Sainsbury's Home Room Spray Rhubarb & Elderflower,3.00,unit,3.00,ea
Nicky Defend Multipurpose Towel,2.00,unit,2.00,100sht
Unicorn Piata,12.00,unit,12.00,ea
Yankee Small Jar Sugared Blossom Candle,5.00,unit,5.00,ea
"Ariel All-in-One PODs Washing Liquid Capsules + Active Odour Defence, 43 Washes",12.00,unit,11.12,kg
Logic Compact 2 E-Liquid Pods Intense Amber Tobacco 18mg,5.00,unit,1.47,ml
Sainsbury's Home Sparkler Number 0,1.00,unit,1.00,ea
Masterplug Dusk til Dawn LED Night Light Twin,11.00,unit,11.00,ea
Sainsbury's Home Happy Birthday Rainbow Fabric Bunting,10.00,unit,10.00,ea
Sainsbury's Home Penguin Print Tablecover,2.62,unit,2.62,ea
"Air Wick Essential Mist Diffuser 2 Refills, Peony & Jasmine 2x20 mL",9.00,unit,9.00,ea
Mini Sudoku Coll By Sains Magazine,2.60,unit,2.60,ea
Crayola Scented Mini Twistable Crayons 12pk,3.00,unit,3.00,ea
Ariel All-in-One Pods Washing Capsules +Oxi 22 Washes,7.00,unit,11.29,kg
Yankee Diffuser White Linen And Lace,13.00,unit,13.00,ea
Puzzler Sudoku Puzzles,2.85,unit,2.85,ea
Yankee Med Jar Sugared Blossom Candle,10.00,unit,10.00,ea
Yankee Large Jar Exotic Fruits Candle,14.00,unit,14.00,ea
Swan Cool Menthol Extra Slim Filter Tips x120,1.07,unit,1.07,ea
Seventh Generation All Purpose Cleaning Spray 500ml,2.50,unit,5.00,ltr
PC Pro Magazine,5.99,unit,5.99,ea
blu myblu Intense Liquidpod Blueberry 18mg,6.00,unit,2.00,ml
Puzzler Magazine,2.40,unit,2.40,ea
V5 Rollerball Black,4.00,unit,4.00,ea
AromaWorks Essential Oil Diffuser,14.00,unit,14.00,ea
Sainsbury's Home Mini Dustpan And Brush,3.00,unit,3.00,ea
Logic Compact 2 E-Liquid Pods Intense Berry Ripple 18mg,5.00,unit,1.47,ml
Logic Compact Charcoal Starter Kit Electronic Cigarette,4.00,unit,4.00,ea
Sainsbury's Home 10pk Pink Spot Paper Cups,2.00,unit,2.00,ea
Family Wordsearch Jumbo Magazine,2.15,unit,2.15,ea
Minky Board Buddy,4.00,unit,4.00,ea
Nimble Sticky Stopper Refill Antibacterial Cleaner Spray 500ml,4.00,unit,80p,100ml
Pokemon Magazine,3.99,unit,3.99,ea
Sainsbury's Home 10pk Mixed Blue Party Bags,3.00,unit,3.00,ea
Nicky Soft Touch Toilet Tissue 2 Ply 32 Rolls,6.75,unit,3p,sht
Sainsbury's Home 12pk Coloured Twin Tip Fineliners,4.00,unit,4.00,ea
"Botanica by Air Wick Electrical Plug In 1 Refill, Fresh Pineapple and Tunisian Rosemary 19 mL",4.00,unit,4.00,ea
Sainsbury's Home 10pk Happy Birthday Pink Plate,1.50,unit,1.50,ea
Sainsbury's Home Room Spray Jasmine & Pineapple Flower,3.00,unit,3.00,ea
Sainsbury's Home Sparkler Number 4,1.00,unit,1.00,ea
Match Of The Day Weekly Magazine,2.75,unit,2.75,ea
Sainsbury's Home 12 Reusable Brights Cutlery Set,3.00,unit,3.00,ea
Sainsbury's Home Diffuser 90ml Patchouli & Amber,8.00,unit,8.00,ea
Sainsbury's Home Refill Jasmine & Pineapple Flower,9.50,unit,9.50,ea
Glade Sense & Spray Air Freshener Artic Apple Pie 18ml,8.00,unit,8.00,ea
Sainsbury's Home Gold Long Candles x12,2.50,unit,2.50,ea
Sainsbury's Home Sparkler Number 5,1.00,unit,1.00,ea
Sainsbury's Home 10pk Balloon Party Bags,2.00,unit,2.00,ea
Logic Compact 2 E-Liquid Pods Intense Peppermint 18mg,5.00,unit,1.47,ml
Illoom 5pk Blue Balloons,3.50,unit,3.50,ea
Motorcycle News,3.49,unit,3.49,ea
Sainsbury's Home Sparkler Number 6,1.00,unit,1.00,ea
Horrible Histories Magazine,4.10,unit,4.10,ea
Sainsbury's Home New Calming Candle,8.00,unit,8.00,ea
Richmond Real Blue Superkings x100,56.00,unit,56p,cig
Kiwi Shoe Passion Heel Cushions,4.10,unit,4.10,ea
"Botanica by Air Wick Electrical Plug In 2 Refills, French Lavender and Honey Blossom 2x19 mL",8.00,unit,8.00,ea
Sainsbury's Home Room Spray Seasalt & Cedar,3.00,unit,3.00,ea
Vype ePen 3 Cartridges Crisp Mint x2 6mg/ml,6.00,unit,1.50,ml
Energizer Max Plus 9V Battery 1-Pack,4.75,unit,4.75,batt
Sainsbury's Home 20pk Hip Hip Hooray Foil Napkin,3.25,unit,3.25,ea
Ariel All-in-1 PODs Washing Liquid Capsules + OXI Stain Removers Effect 43 Washes,12.00,unit,28p,ea
AromaWorks Balance Natural Aromatheraphy Duo Range,9.00,unit,450.00,ltr
Crayola Twistable Pencils 10pk,2.25,unit,2.25,ea
Lego Special Edition Magazine,4.99,unit,4.99,ea
"Logic Compact E-Liquid Pods Intense Polar Menthol 2x1.7ml, 18mg",5.00,unit,1.47,ml
Classic Rock Magazine,6.99,unit,6.99,ea
Sainsbury's Home Sparkler Number 7,1.00,unit,1.00,ea
Glitter Spray,3.00,unit,3.00,ea
Air Wick Essential Mist Aroma Comforting Cherry & Vanilla 20ml,5.00,unit,5.00,ea
Sainsbury's Home Sparkler Number 3,1.00,unit,1.00,ea
Sainsbury's Home Diffuser 90ml Ginger & White Pomelo,8.00,unit,8.00,ea
Lego Super Hero Legends Magazine,3.99,unit,3.99,ea
Sainsbury's Home Sparkler Number 8,1.00,unit,1.00,ea
Landscape Magazine,4.70,unit,4.70,ea
Sainsbury's Home Cedar Rings x10,2.00,unit,2.00,ea
Logic Compact 2 E-Liquid Pods Intense Banoffee 18mg,5.00,unit,1.47,ml
Sainsbury's Home Flat Mop Microfibre Refill,2.50,unit,2.50,ea
"Duracell Powerbank 6700 mAh, Fast Charge External Battery Pack",20.00,unit,20.00,ea
Yankee Diffuser Cherry Vanilla,13.00,unit,13.00,ea
Sainsbury's Home Room Spray Ginger & White Pomelo,3.00,unit,3.00,ea
Womans Own Lifestyle Magazine,2.10,unit,2.10,ea
Sainsbury's Home Strip Mop Microfibre Refill,2.50,unit,2.50,ea
Jps Player's Ks New Crush x20,9.30,unit,47p,cig
Sainsbury's Home 10pk Mixed Pink Party Bags,3.00,unit,3.00,ea
Womens Health Magazine,4.50,unit,4.50,ea
Aqua Vape Raspberry Menthol E-Liquid 3mg 10ml,3.25,unit,33p,ml
"Botanica by Air Wick Electrical Plug In 1 Refill, Island Rose & African Geraneum 19 mL",4.00,unit,4.00,ea
Tab Take A Crossword Collection,2.80,unit,2.80,ea
Sainsbury's Home Forest Dawn Tapered Candle Holder Small,5.00,unit,5.00,ea
L&b Blue Ks New Crush x20,9.30,unit,47p,cig
Spontex Protect Disposable Gloves Large x100,8.00,unit,8p,ea
Sainsbury's Home Refill Patchouli & Amber,9.50,unit,9.50,ea
Sainsbury's Home New Restorative Candle,8.00,unit,8.00,ea
Tab Mini Arrowwords Collection,2.40,unit,2.40,ea
Yankee Diffuser Exotic Fruits,13.00,unit,13.00,ea
Aqua Vape Smok Vape Pen V2 Silver,22.00,unit,22.00,ea
Mini Crosswords Coll Sain Magazine,2.60,unit,2.60,ea
Nordic Spirit Mint 9mg,6.50,unit,6.50,ea
Vype Epod Vpro Tropical Mango 18mg,6.00,unit,1.58,ml
Puzzlelife Pad Wordsearc Magazine,2.85,unit,2.85,ea
The Kitchen Garden Magazine,5.99,unit,5.99,ea
Period Living Magazine,4.50,unit,4.50,ea
Rainbow squishy ball,2.00,unit,2.00,ea
Home Filament G9 200lm 2 Pack,4.00,unit,4.00,ea
Andys Amazing Adventures Magazine,4.99,unit,4.99,ea
Mini Mixed Puzzle Collection,2.60,unit,2.60,ea
Vype Epod Vpro Golden Tobacco 18mg,6.00,unit,1.58,ml
Glade Automatic Spray Sandalwood & Jasmine Air Freshener 269ml,6.00,unit,6.00,ea
Lego Friends,4.99,unit,4.99,ea
JUULpods Rich Tobacco 18mg/ml x4,11.00,unit,3.93,ml
Rail Magazine,3.90,unit,3.90,ea
Kilner Sloe Gin Set,21.99,unit,21.99,ea
Mens Health Magazine,4.50,unit,4.50,ea
"Botanica by Air Wick Candle, Pineapple & Tunisian Rosemary",7.00,unit,7.00,ea
Sainsbury's Home New Calming Large Candle,16.00,unit,16.00,ea
Classic & Sportscar Magazine,5.70,unit,5.70,ea
"Botanica by Air Wick Electrical Plug In Kit, French Lavender and Honey Blossom - Holder & 1 Refill 19 mL",8.00,unit,8.00,ea
Don't Miss Out Magazine,7.50,unit,7.50,ea
Addis Fruit Bags,3.00,unit,3.00,ea
Sainsbury's Home Sponge Mop Refill,2.50,unit,2.50,ea
Ariel All-in-One Pods Washing Capsules +Fibre Protection 22 Washes,7.00,unit,12.11,kg
Sainsbury's Home Refill Seasalt & Cedar,9.50,unit,9.50,ea
Juul Uk Usb Charger,4.00,unit,4.00,ea
Sainsbury's Home Frosted Cedar Ribbed Glass Candle Large,10.00,unit,10.00,ea
Natural Health & Beauty Magazine,4.25,unit,4.25,ea
Sainsbury's Home Dutch Glam Shaped Boxed Candles 3 X Fruit,6.00,unit,6.00,ea
Pukka Pad Duplicate Book,5.00,unit,5.00,ea
First News,2.25,unit,2.25,ea
Ariel All-in-1 PODs Washing Liquid Capsules + Fibre Care Protection 43 Washes,12.00,unit,9.84,kg
Vype ePod Cartridges Chilled Mint x2 6mg/ml,6.00,unit,1.58,ml
Minky Sleeve Board,12.00,unit,12.00,ea
"Logic Compact E-Liquid Pods Intense Berry Mint 2x1.7ml, 18mg",5.00,unit,1.47,ml
Sainsbury's Home Rainbow Text Confetti Balloon,2.00,unit,2.00,ea
Dinosaur Action Magazine,4.99,unit,4.99,ea
Minky Express Ironing Board  Cover 122x38,13.00,unit,13.00,ea
Puzzler Pocket Puzzles Collection,2.99,unit,2.99,ea
House & Garden Magazine,4.95,unit,4.95,ea
Sainsbury's Home Rainbow Spot Wipeable Tablecover 120X180cm,1.50,unit,1.50,ea
Kick Magazine,3.99,unit,3.99,ea
Modern Gardens Magazine,3.99,unit,3.99,ea
Platinum Magazine,4.75,unit,4.75,ea
Lego Disney Princess Magazine,3.99,unit,3.99,ea
Sainsbury's Home New Mini Candle Set,12.00,unit,12.00,ea
Illoom Balloon Mixed Party Time x15,8.00,unit,8.00,ea
Sainsbury's Home Grey Tablecover,3.00,unit,3.00,ea
Simply Sewing Magazine,7.99,unit,7.99,ea
Knit Now Magazine,6.99,unit,6.99,ea
Tab Mini Crossword Collection,2.40,unit,2.40,ea
JUUL Device Kit,10.00,unit,10.00,ea
Elle Magazine,4.80,unit,4.80,ea
Woman Home Feel Good You Magazine,3.99,unit,3.99,ea
Snazaroo Face Paint Sticks Rainbow,5.00,unit,5.00,ea
Tab Mini Codebreakers Collection,2.40,unit,2.40,ea
Home Filament G80 Small Globe 4w Bc,3.00,unit,3.00,ea
Viz Magazine,3.80,unit,3.80,ea
Sainsbury's Home New Essential Oil Set,9.00,unit,9.00,ea
"Logic Compact E-Liquid Pods Intense Spearmint 2x1.7ml, 18mg",5.00,unit,1.47,ml
Aqua Vape Wild Berry E-Liquid 3mg 10ml,3.25,unit,33p,ml
Garden Answers Magazine,4.25,unit,4.25,ea
Sainsbury's Home Refill Ginger & White Pomelo,9.50,unit,9.50,ea
"Great Reads, Good House Keeping & Prima Magazines",6.49,unit,6.49,ea
Hornby Magazine Magazine,4.99,unit,4.99,ea
Sainsbury's Home New Restorative Large Candle,16.00,unit,16.00,ea
Yours Retro Magazine,3.99,unit,3.99,ea
Sainsbury's Home New Energising Candle,8.00,unit,8.00,ea
Juul C1 Device Kit,10.00,unit,10.00,ea
Sainsbury's Home Duster Refill,2.50,unit,2.50,ea
Tab Mini Wordsearch Lite Magazine,1.75,unit,1.75,ea
Vype Epod Vpro Very Berry 18mg,6.00,unit,1.58,ml
Sainsbury's Home New Calming Diffuser,15.00,unit,15.00,ea
Fun To Learn Favourites,3.99,unit,3.99,ea
"Logic Compact Multi Menthol Full Kit x4, 18mg",10.00,unit,10.00,ea
Morphy Richards Turbo Steam Iron 303128,65.00,unit,65.00,ea
Sainsbury's Home New Energising Diffuser,15.00,unit,15.00,ea
Best & Real People & Pack Magazine,3.49,unit,3.49,ea
Sainsbury's Home Bright fabric flag bunting,5.00,unit,5.00,ea
Sainsbury's Home Leopard Print Lunch Napkin,3.25,unit,3.25,ea
MyBlu Starter Kit Bundle 18mg/ml 2 x 1.5ml Intense Golden Tob & Menthol,10.00,unit,10.00,ea
Empire Magazine,4.99,unit,4.99,ea
Masterplug 6 Socket Surge Protected Extension Lead Black 1.5m,11.99,unit,11.99,ea
Tab Mini Sudoku Collection,2.60,unit,2.60,ea
Nordic Spirit Mint 6mg,6.50,unit,6.50,ea
Breathe Magazine,5.99,unit,5.99,ea
Pets 2 Collect Magazine,4.25,unit,4.25,ea
Velo Nicotine Pouches Ice Cool Strong 10mg x20,7.00,unit,7.00,ea
Vype Eliquid Strawberry Smsh 6mg,4.00,unit,40p,ml
"Duracell Powerbank 3350 mAh, Universal Portable Battery Charger",17.00,unit,17.00,ea
PF Pocket Novel Magazine,3.99,unit,3.99,ea
Aqua Vape Menthol E-Liquid 3mg 10ml,3.25,unit,33p,ml
Ideal Home Woman Magazine Bigger Pack,5.99,unit,5.99,ea
White Dwarf Magazine,5.99,unit,5.99,ea
Get Creative Painting Apron,3.00,unit,3.00,ea
Snazaroo Face Paint Kit Rainbow,12.00,unit,12.00,ea
Top Of The Pops Magazine,4.99,unit,4.99,ea
Vype Eliquid Tropical Punch 6mg,4.00,unit,40p,ml
ZYN Nicotine Pouch Citrus 3mg,6.50,unit,6.50,ea
Sainsbury's Home 4pk Reuseable Small Square Bowls,2.00,unit,2.00,ea
Grow Your Own Magazine,5.99,unit,5.99,ea
National Geographic Special Magazine,8.99,unit,8.99,ea
Sh 10pk Rainbow Confetti Design Cups,1.50,unit,1.50,ea
PJ Masks Magazine,2.99,unit,2.99,ea
Good Homes Magazine,4.10,unit,4.10,ea
My Weekly Special,3.99,unit,3.99,ea
Love Sewing Magazine,9.99,unit,9.99,ea
Lol! Surprise,4.99,unit,4.99,ea
Home Filament G120 Globe 4w Bc,5.00,unit,5.00,ea
My Weekly Pocket Novel Magazine,3.99,unit,3.99,ea
ZYN Nicotine Pouch Cool Mint Strong 6mg,6.50,unit,6.50,ea
Tab Mini Puzzle Mix Collection,2.40,unit,2.40,ea
RAC 3w Cob Led Area Light,6.99,unit,6.99,ea
Sainsbury's Home New Energising Large Candle,16.00,unit,16.00,ea
Digital Camera Magazine Magazine,5.60,unit,5.60,ea
BBC Home Cooking Series Magazine,5.99,unit,5.99,ea
Unicorns Universe Magazine,5.99,unit,5.99,ea
Practical Classics Magazine,4.70,unit,4.70,ea
Fun To Learn Bag of Fun,4.99,unit,4.99,ea
Squidgy Bears,1.50,unit,1.50,ea
Vype Epod Starter Kit Black 18mg,10.00,unit,10.00,ea
Frozen Funtime Magazine,3.99,unit,3.99,ea
Totally Wicked Nic Salt E-Liquid Apple & Raspberry Sour 10ml (16mg),4.95,unit,50p,ml
Totally Wicked Red Label Premium E-Liquid Blackcurrant 10ml (6mg),4.75,unit,48p,ml
