Description,Price/Unit,Unit,Price/Measure,MeasureBloo Foam Aroma Fragranced Powder Ocean Mist 500g,2.50,unit,5.00,kg
Sainsbury's Limescale Preventer Gel 750ml,3.30,unit,4.40,ltr
John Player Special Real Blue King Size x20,10.14,unit,51p,cig
Febreze Car Cotton Fresh Car Clip Air Freshener,3.00,unit,3.00,ea
Sainsbury's Non Bio Laundry Powder 1.625kg,2.50,unit,1.54,kg
Henri Winterman's Half Coronas Cigars x5,11.85,unit,2.37,cig
Spontex 40 Handy Latex Disposable Gloves,5.50,unit,14p,ea
Ten Motives Electronic Cigarette Menthol Refill x4,8.00,unit,2.00,ea
Duck Fresh Brush Starter Kit,4.00,unit,4.00,ea
Lenor Fabric Conditioner Parfum Des Secrets Kiss 1L,3.00,unit,3.34,ltr
Mayfair Sky Blue King Size x20,10.45,unit,52p,cig
Silvo Tarnish Guard Wadding 75g,2.50,unit,3.33,100g
Surcare Sensitive Non Bio Laundry Capsules 20 x 24.5ml (490ml),5.25,unit,10.71,ltr
Silk Cut Blue King Size x20,13.40,unit,67p,cig
Superkings Blue x100,63.50,unit,64p,cig
Domestos Power 5 Frosted Pine Limited Edition Toilet Rim Block 55 g,1.00,unit,1.00,ea
Sainsbury's Home Red Plastic Cups Large 500ml x10,2.50,unit,2.50,ea
Lenor Unstoppables Sunkiss In Wash Scent Booster Beads 264g,4.00,unit,15.15,kg
John Player Special Black King Size x100,57.80,unit,58p,cig
Sterling Superkings x20,10.15,unit,51p,cig
4m Wrap - LWC - Nordic - Moorlands Foliage,2.00,unit,2.00,ea
Cif Stainless Steel Specialist Cleaner Spray 435ml,2.50,unit,5.75,ltr
Febreze Fabric Freshener Spray Cotton Fresh 375ml,2.00,unit,5.33,ltr
Marigold Gloves for Sensitive Skin Medium (1 Pair),3.00,unit,1.50,ea
Sainsbury's Home AA Batteries 4 pk,3.00,unit,75p,unit
Sainsbury's Sweetie Traybake 660g (Serves 15),5.00,unit,75p,100g
House 247 Disinfectant 1L,39p,unit,39p,ltr
Bic Cristal Ballpoint Black 10pk,3.00,unit,3.00,ea
Sainsbury's Home White Paper Cups 8oz,1.50,unit,1.50,ea
Prism All in 1 Dishwasher Tablets Citrus x25,4.00,unit,16p,ea
Puzzler Collection Magazine,3.50,unit,3.50,ea
Sainsbury's Bio Concentrated Laundry Liquid 1800ml,3.50,unit,2.33,ltr
"Henri Winterman's Cafe Creme Cigars, Blue x10",6.45,unit,65p,cig
Hamlet Fine Cigars x10,12.55,unit,1.26,cig
Richmond Real Blue Superkings x20,11.25,unit,56p,cig
Ten Motives Electronic Cigarette,6.00,unit,6.00,ea
Wet Ones Be Fresh Original Antibacterial Hand Wipes x40 Wipes,2.00,unit,5.00,100sht
Regal King Size x20.,12.75,unit,64p,cig
Finish In-Wash Dishwasher Cleaner 3x17g,5.50,unit,1.83,ea
Ecover Washing-Up Liquid Lily & Lotus 450ml,1.75,unit,3.89,ltr
"Duracell Plus Alkaline AA Batteries, pack of 24",17.00,unit,71p,batt
Ariel All-in-1 Pods Original Washing Liquid Capsules (25 Washes),7.00,unit,11.11,kg
"Flash Speedmop Starter Kit, Fast Easy & Hygienic Floor Cleaning",10.00,unit,1.67,ea
Sainsbury's Anti-Bacterial Cleaner Zingy Lemon Fragrance 750ml,80p,unit,1.07,ltr
"Duracell Plus Alkaline C Batteries, pack of 6",10.00,unit,1.67,batt
Ariel Washing Liquid Gel Original 1.295L (35 Washes),6.00,unit,4.63,ltr
House 247 Food Bags x100,1.00,unit,1p,ea
"Duracell Plus Alkaline AAA Batteries, pack of 16",11.00,unit,69p,batt
Lenor Fabric Conditioner Parfum Des Secrets Blush Scent 1L,3.00,unit,3.34,ltr
Sainsbury's Aerosol Freshener Linen 250ml,1.25,unit,5.00,ltr
Bold All-in-1 Gold Orchid Washing Liquid Capsules (36 Washes),7.00,unit,10.20,kg
Windsor John Player Special Real Blue King Size x20,10.14,unit,51p,cig
Hamlet Miniatures Cigars x10,6.40,unit,64p,cig
Lenor Unstoppables Sunkiss In Wash Scent Booster Beads 194g,6.00,unit,30.93,kg
Fairy Pure & Clean Original Washing Up Liquid 625ml,1.50,unit,2.40,ltr
Nicky Multi Cloth Paper Towel 2 Rolls,2.20,unit,2.20,100sht
Goddard's Long Term Silver Polish Cloth,2.50,unit,2.50,ea
Take A Break Magazine,2.10,unit,2.10,ea
Spontex Microfibre Multipad x3,2.00,unit,67p,ea
"Glade Touch 'n' Fresh, Clean Linen 10ml",3.00,unit,3.00,ea
Febreze Air Freshener Spray Heavy Duty Crisp Clean 300ml,4.00,unit,13.33,ltr
Sainsbury's Home Parcel Tape 48mm x 60m,2.50,unit,2.50,ea
Lenor Unstoppables Dreams In Wash Scent Booster Beads 210g,3.00,unit,15.47,kg
Sainsbury's Home Sauce Pots 40ml x2,1.50,unit,1.50,ea
Sainsbury's Home Maxi Tealights x12,3.50,unit,3.50,ea
Flash Speedmop Wet Cloth Refills Lemon Multi-Surface x24,6.00,unit,25p,ea
Sainsbury's Honeysuckle & Vanilla Candle 175g,2.00,unit,2.00,ea
Richmond Bright Blue Superkings x20,11.25,unit,56p,cig
"Glade Auto Spray Refill, Clean Linen 269ml",2.50,unit,9.29,ltr
Sainsbury's Home Extra Long Life AAA4 Alk Batteries,3.00,unit,75p,unit
"Glade Auto Spray Refill, Relaxng Zen 269ml",2.50,unit,2.50,ea
Daz Washing Liquid Whites & Colours 875ml (25 Washes),3.50,unit,3.43,ltr
Finish All-in-1 Max Lemon X60,8.00,unit,13p,ea
Ecover Colour Laundry Liquid 1.5L (42 washes),6.50,unit,4.33,ltr
Cif Power & Shine Bathroom Ecorefill 70 ml,1.50,unit,21.43,ltr
Z-Grip Ball Pen Black x10,3.00,unit,3.00,ea
Vanish Gold Oxi Action Fabric Stain Remover Powder - Whites 1 kg,6.00,unit,6.00,kg
Duck Deep Action Gel Toilet Liquid Cleaner Floral Fantasy 750ml,1.00,unit,1.33,ltr
Gold Leaf Tobacco 30g,12.80,unit,42.67,100g
St Bruno Ready Rubbed Pipe Tobacco 50g,16.85,unit,33.70,100g
Sainsbury's Limescale Remover Powder 250g,2.60,unit,10.40,kg
Ariel Washing Liquid Colour and Style 2.45L (70 Washes),9.00,unit,3.67,ltr
Bloo Fragrance Switch Lemon & Ocean Premium Toilet Rim Block 50g,1.50,unit,1.50,ea
Sainsbury's Home General Purpose String 40m,1.50,unit,1.50,ea
"Glade Automatic Refill Spray, Bali & Sandalwood & Jasmine 269ml",2.50,unit,9.29,ltr
Sainsbury's Home Dinner Taper Candles x10,3.50,unit,3.50,ea
Spontex Multipurpose Disposable Gloves x100,8.00,unit,8p,ea
Lenor Unstoppables Spring In Wash Scent Booster Beads 210g,3.00,unit,15.47,kg
Cutters Choice 30g,15.85,unit,52.83,100g
Brabantia Bin Liners H (50-60 L) x10,4.00,unit,40p,ea
"Raid Moth Killing Paper, Floral Scent",3.20,unit,106.67,kg
Marlboro Silver x20,11.90,unit,60p,cig
Sovereign Blue King Size x20,9.25,unit,46p,cig
Lenor Unstoppables Active In Wash Scent Booster Beads 264g,7.00,unit,26.52,kg
Sainsbury's Stainless Steel Cleaner 500ml,2.00,unit,4.00,ltr
Windsor John Player Special Real Blue Superkings 5x20,50.54,unit,51p,cig
Febreze Air Freshener Spray Spring Awakening 300ml,2.00,unit,6.67,ltr
Daz All-in-1 Pods for Whites and Colours Washing Liquid Capsules (25 Washes),4.50,unit,8.26,kg
Sainsbury's Air Freshener Aerosol Vanilla 250ml,1.25,unit,5.00,ltr
Sellotape Super Clear Tape & Dispenser,2.50,unit,2.50,ea
Method Concentrated Laundry Detergent Orchard Fruit 1.56L (39 Washes),10.00,unit,6.41,ltr
Energizer Max Plus AAA Batteries 10-Pack,8.50,unit,85p,batt
Price's Chef's Candle Jar,5.00,unit,5.00,ea
Cushelle White Toilet Tissue x32 Rolls,11.00,unit,0p,sht
"Ritmeester Cigars, Royal Dutch Miniatures x10",4.65,unit,47p,cig
Garden News Magazine,1.99,unit,1.99,ea
E-cloth Glass & Polishing Cloth,4.50,unit,4.50,ea
Rizla Menthol Chill Flavour Infusion Card,39p,unit,39p,ea
Sainsbury's Blossom Petals Reed Diffuser 80ml,3.50,unit,43.75,ltr
Lambert & Butler Blue Bright Air King Size x20,9.30,unit,47p,cig
Fairy Non Bio Pods Washing Liquid Capsules 40 Washes,8.50,unit,8.82,kg
Kleenex Ultra Soft Pocket Tissues 8 Pack,1.50,unit,2.09,100sht
4m Wrap - LWC - Dear Santa - Baubles,1.50,unit,1.50,ea
Persil Handwash Laundry Powder 712g (8 Washes),2.40,unit,3.37,kg
Sainsbury's 2 in 1 Bio Liquid Laundry Capsules Lavender & Jasmine x19,2.75,unit,5.98,kg
Sainsbury's Madeira Party Cake 888g (Serves 14),6.00,unit,68p,100g
Woman's Weekly Magazine,2.60,unit,2.60,ea
Price's Open Window Candle Jar,5.00,unit,5.00,ea
Cutters Choice Original Tobacco 50g,26.20,unit,26.20,cig
Sainsbury's HomeAA Batteries 12 PK,6.00,unit,50p,unit
Sainsbury's Air Freshener Aerosol Floral 250ml,1.25,unit,5.00,ltr
Sainsbury's Lavender Fabric Conditioner 1.26L,1.25,unit,99p,ltr
Energizer Max AAA x12,5.00,unit,42p,batt
Dettol Big & Strong Antibacterial Bathroom Cleaning Wipes x25,2.50,unit,10p,ea
Vanish Oxi Action Fabric Stain Remover Powder - Whites 1.5 kg,12.00,unit,8.00,kg
Method Concentrated Laundry Detergent Wild Lavender 1.56L (39 Washes),10.00,unit,6.41,ltr
Sainsbury's Home Extra Long Life C Battery x2,3.00,unit,1.50,unit
Staedtler Norris 5pk Hb Pencils,1.75,unit,1.75,ea
Sainsbury's Football Crazy Cake 750g (Serves 12),7.00,unit,9.33,kg
Get Creative PVA Glue 250ml,1.00,unit,1.00,ea
Daz Washing Powder Whites and Colours 1.43Kg (22 Washes),4.50,unit,3.15,kg
3m Wrap - Kraft - Hibernation - Kraft Star,2.50,unit,2.50,ea
Woman Magazine,1.40,unit,1.40,ea
Sainsbury's 2 in 1 Bio Liquid Laundry Capsules Rose Petal & Peony x19,2.75,unit,5.98,kg
Sainsbury's Home 10pk Champagne Flutes,2.00,unit,2.00,ea
Sainsbury's Home Klip Lock Dry Food Container,5.50,unit,5.50,ea
Sainsbury's Mould & Mildew Remover 500ml,2.00,unit,4.00,ltr
Sainsbury's Home Dinner Napkins Cream 40cm 3ply x20,2.25,unit,2.25,ea
Sainsbury's DIY Sacks x10,3.00,unit,30p,ea
Sainsbury's Stain Remover Powder for Whites 1kg,3.50,unit,3.50,kg
Surf Perfect Black Washing Liquid 875ml (25 washes),3.00,unit,3.43,ltr
John Player Special Roll Your Own Tobacco 50g,22.20,unit,44.40,100g
Toastabags Slow Cooker Liners x5,1.00,unit,20p,ea
Finish All in 1 Max Dishwasher Detergent Gel Lemon Degreaser 700ml,6.00,unit,8.57,ltr
Superkings x200,127.00,unit,64p,cig
John Player Special Real Blue King Size 5x20,50.50,unit,51p,cig
"Kiwi Parade Gloss Leather Paste Polish, Dark Tan 50ml",2.10,unit,42.00,ltr
"Duracell Specialty 2032 Lithium Coin Battery 3V, pack of 4",8.00,unit,2.00,unit
Sainsbury's Mixed Puzzles Book,2.60,unit,2.60,ea
Sainsbury's Home Extra Long Life 9V2 Alk Batteries,4.50,unit,2.25,unit
Prism All in 1 Dishwasher Tablets Original x25,4.00,unit,16p,ea
Sainsbury's Reed Diffuser Night Lavender 80ml,3.50,unit,43.75,ltr
Raid Ant Powder 250g,3.00,unit,12.00,kg
Lambert & Butler Gold King Size 5x20,51.75,unit,52p,cig
E-Cloth General Purpose Cloth,4.50,unit,4.50,ea
Mayfair Sky Blue Superkings x20,10.45,unit,52p,cig
Mr Muscle Platinum Antibacterial Kitchen Spray Citrus 750ml,1.75,unit,2.33,ltr
"Duracell Specialty LR44 Alkaline Button Battery 1,5V, pack of 2",5.00,unit,2.50,batt
Prism All in 1 Dishwasher Tablets Original x50,6.00,unit,12p,ea
Sainsbury's Home White Tablecover 120x180cm,2.50,unit,2.50,ea
Loctite Super Glue Power Flex Gel Control 3g,3.50,unit,3.50,ea
Glade Solid Gel Clean Linen Air Freshener 150g,1.00,unit,1.00,ea
Rothmans Blue King Size x24,11.20,unit,47p,cig
Mr Muscle Platinum Antibacterial Bathroom Spray Mandarin 750ml,1.75,unit,2.33,ltr
Fairy All In One Dishwasher Tablets Regular x78,10.00,unit,13p,ea
Sainsbury's Granite & Marble Cleaner 500ml,2.00,unit,4.00,ltr
Players Bright Blue King Size x20,9.30,unit,47p,cig
Vanish Gold Oxi Action Powder Fabric Stain Remover 470g,5.75,unit,12.23,kg
Lambert & Butler Silver King Size 10x20,102.50,unit,51p,cig
Fairy Antibacterial Washing Up Liquid Lime & Lemongrass 383ml,1.50,unit,3.92,ltr
Sterling King Size x20,10.15,unit,51p,cig
Richmond Real Blue King Size x20,11.25,unit,56p,cig
Milton Maximum Protection Antibacterial Surface Spray 500ml,2.50,unit,50p,100ml
Ambi Pur Plug In Air Freshener Diffuser,2.00,unit,2.00,ea
Tipp-Ex Rapid,2.00,unit,2.00,ea
Sainsbury's Bio Laundry Powder 2.925kg (45 Washes),4.00,unit,1.37,kg
Sainsbury's Bio Liquid Laundry Capsules x19,2.75,unit,5.98,kg
"Air Wick Limited Edition Candle, Mulled Wine",3.00,unit,3.00,ea
Sainsbury's Non Bio Laundry Gel 900ml,3.00,unit,3.33,ltr
Ten Motives Electronic Cigarette Menthol,6.00,unit,6.00,ea
Sainsbury's Turkey Roasting Bags x2,1.00,unit,50p,ea
Chat Magazine,1.05,unit,1.05,ea
"Henri Winterman's Cafe Creme Cigars, Filter Aromatic x10",6.45,unit,65p,cig
"Lord Sheraton Pure Beeswax, Original Formula 75ml",2.50,unit,33.33,ltr
Sainsbury's Home Labels x250,2.00,unit,2.00,ea
Bostik All Purpose Glue 20ml,1.75,unit,1.75,ea
HOME LED Standard 60w BC x2,5.00,unit,5.00,ea
Private Eye Magazine,2.00,unit,2.00,ea
American Spirit Tobacco 30g,18.60,unit,62p,g
Cadbury Flake Cake 960g (Serves 12),12.50,unit,12.50,ea
"Duracell Specialty 2025 Lithium Coin Battery 3V, pack of 2",5.00,unit,2.50,batt
"Kiwi Parade Gloss Leather Paste Polish, Mid-Tan 50ml",2.10,unit,42.00,ltr
6pk Dinner Cracker - Dear Santa Character Game,5.25,unit,5.25,ea
Sainsbury's Magazine December Issue,3.00,unit,3.00,ea
Dettol Big & Strong Antibacterial Kitchen Cleaning Wipes x25,2.50,unit,10p,wipe
"Air Wick Limited Edition Aerosol Spray Air Freshener, Mulled Wine 250ml",2.00,unit,8.00,ltr
Bacofoil 2 in 1 Parchment & Foil 300mm x 5m,2.50,unit,2.50,ea
Lenor Unstoppables Spring In-Wash Scent Booster 570g,8.00,unit,14.04,kg
Ariel All-in-One Pods Washing Capsules Original 40 Washes,8.50,unit,8.43,kg
Windsor John Player Special Bright Blue Superkings x20,10.14,unit,51p,cig
Sainsbury's Non Bio Laundry Powder 2.925kg (45 Washes),4.00,unit,2.08,kg
House 24/7 All Purpose Clothes x10,35p,unit,4p,ea
Clan Aromatic Pipe Tobacco 50g,16.60,unit,33.20,100g
Sainsbury's Home Clear Tumblers 250ml x20,1.50,unit,1.50,ea
Sainsbury's Crosswords Puzzle Book,2.60,unit,2.60,ea
Domestos Original Thick Bleach 1.25 L,1.60,unit,1.28,ltr
Slimming World Magazine,2.95,unit,2.95,ea
House 24/7 Washing Up Liquid 500ml,35p,unit,70p,ltr
Bold 2in1 Washing Liquid Gel Bloom and Yellow Poppy 1.406L (35 Washes),5.00,unit,3.86,ltr
10pk Cards - Partridge In A Pear Tree,2.50,unit,2.50,ea
John Player Special Bright Silver King Size x20,10.14,unit,51p,cig
Sainsbury's Home Rainbow Party Poppers x50,2.50,unit,2.50,ea
Sainsbury's 2 in 1 Bio Lavender & Jasmine Laundry Powder 4.55kg (70 Washes),6.25,unit,1.37,kg
Febreze Ambi Pur Plug In Air Freshener Starter Kit Cotton Fresh,4.00,unit,4.00,ea
Spontex Easy Sponge Scourers x2,1.30,unit,65p,ea
Woman & Home Magazine,4.99,unit,4.99,ea
Sainsbury's Colour Bio Liquid Laundry Capsules x19,2.75,unit,5.98,kg
Vanish Gold Carpet Care Oxi Action Spray 500ml,6.00,unit,12.00,ltr
Vanish Gold Oxi Action Fabric Stain Remover Gel - Colours & Whites 750 mL,5.75,unit,7.67,ltr
Marigold Latex Disposable Gloves M/L 20's,3.00,unit,3.00,ea
Cif Antibacterial Multi-Purpose Cleaner Spray 700ml,1.75,unit,2.50,ltr
Energizer Max AA x8,6.00,unit,75p,batt
"Duracell Plus Alkaline D Batteries, pack of 6",10.00,unit,1.67,batt
John Player Special Silver  Stream Superkings x20,10.14,unit,51p,cig
Sainsbury's Blossom Petals Candle 175g,2.00,unit,2.00,ea
Amateur Gardening Magazine,2.50,unit,2.50,ea
6pk Luxury Crackers - Silver Pinecones,7.50,unit,7.50,ea
House 24/7 Dishcloths x4,58p,unit,15p,ea
Air Wick Freshmatic Compact Purple Lavender Air Freshener Refill 2x250ml,5.00,unit,5.00,ea
Cif Antibacterial Multi-Purpose Cleaner Spray 450 ml,1.50,unit,3.33,ltr
10m Wrap - LWC - Enchanted - Gold Stars,3.00,unit,3.00,ea
Sainsbury's Black Lever Arch Folder,1.50,unit,1.50,ea
Thorntons Chocolate Celebration Cake 990g (Serves 18),12.00,unit,12.00,ea
Kiwi Rain & Stain Protector 200ml,3.70,unit,18.50,ltr
Sainsbury's Seriously White Chocolate Madeira Cake 839g (Serves 12),10.00,unit,1.19,100g
Vanish Gold Carpet Cleaner Powder 650g,9.00,unit,13.85,kg
"Kiwi Shoe Laces, Black Cord 75cm",1.50,unit,1.50,ea
Sainsbury's Stain Remover Powder for Colours 1kg,3.50,unit,3.50,kg
Bloo Sweet Apple Toilet & Bathroom Multi-Surface Wipes x36,1.75,unit,1.75,ea
Sainsbury's Home Bulb LED Frosted Candle 40w SES x2,5.00,unit,5.00,ea
Kiwi Deofresh Shoe Freshener,3.85,unit,3.85,ea
"Febreze Bathroom, Continuous Air Freshener Odour Elimination & Prevention, Cotton Fresh",3.00,unit,3.00,ea
Febreze Ambi Pur 3Volution Air Freshener Plug in Refills Cotton Fresh,7.00,unit,3.50,ea
Drum Gold Tobacco 30g,16.35,unit,54.50,100g
Sainsbury's Home Extra Long Life D Alk Battery x2,3.00,unit,1.50,unit
Sainsbury's Wordsearch Puzzle Book,2.60,unit,2.60,ea
10pk Cards - Sketchy Scene,2.50,unit,2.50,ea
Brita Marella Maxtra XL White Water Filter 3.5L,20.00,unit,20.00,ea
"Gold Tobacco Block, Pouch 40g",13.50,unit,33.75,100g
HOME LED GU10 50W x4,7.00,unit,7.00,ea
Febreze Car Blossom & Breeze Car Clip Air Freshener,3.00,unit,3.00,ea
BBC Good Food Magazine,5.25,unit,5.25,ea
6pk Luxury Crackers - Gold Textures,7.50,unit,7.50,ea
Marigold Longer Bathroom Gloves Medium,2.75,unit,1.38,ea
TV Choice Magazine Christmas Special,1.40,unit,1.40,ea
Sterling Blue Superkings 5x20,50.50,unit,51p,cig
Mayfair Superkings x100,52.75,unit,53p,cig
Sainsbury's Home Silver Plastic Hangers x6,5.00,unit,5.00,ea
Ideal Home Magazine,4.50,unit,4.50,ea
Marigold Cleaning Me Softly x2,90p,unit,90p,ea
Sainsbury's Ultra Soft Tissues Cube,1.25,unit,2.23,100sht
Take A Break Take A Puzzle,2.80,unit,2.80,ea
Sainsbury's Home Red Tablecover 120x180cm,3.00,unit,3.00,ea
Peppa Pig Celebration Cake 1.1kg (Serves 12),12.50,unit,12.50,ea
Inside Soap Magazine,2.20,unit,2.20,ea
4m Wrap - LWC - Nordic - Cute Dogs,2.00,unit,2.00,ea
Minky M Cloth Antic Bac Pad,2.50,unit,2.50,ea
"Duracell Rechargeable AAA 900mAh Batteries, pack of 4",14.00,unit,3.50,batt
"Kiwi Shoe Laces, Black 60cm",1.50,unit,1.50,ea
Sainsbury's Home Extra Long Life AAA8 pack,4.50,unit,56p,unit
Blu E-liquid Menthol,3.95,unit,40p,ml
Sainsbury's Home 10pk Premium Clear Plastic Plates,3.00,unit,3.00,ea
Sainsbury's Home Wooden Pegs x50,3.50,unit,3.50,ea
"Duracell Rechargeable AA 2500mAh batteries, pack of 4",14.00,unit,3.50,batt
"Bacofoil Foil, Dispenser 5m",4.40,unit,4.40,ea
Sainsbury's 2 in 1 Gentle Non Bio Orange Blossom Concentrated Laundry Liquid 750ml,1.75,unit,2.33,ltr
House 24/7 Dishwasher Tabs x30,1.49,unit,5p,ea
"Duracell Plus 9V Alkaline Batteries, pack of 4",10.50,unit,2.63,batt
Sainsbury's Home Christmas Spice Boxed Candle,5.00,unit,5.00,ea
Sainsbury's Home Ultra Strength Plates 24cm x10,3.00,unit,3.00,ea
"Method Fabric Softener, Tropical Coconut, 45 Wash, 1.575L",5.00,unit,3.17,ltr
Air Wick Freshmatic Compact Linen & Lilac Air Freshener Kit 250ml,5.00,unit,5.00,ea
Vype E-liquid Refill Menthol Crisp Mint,4.00,unit,40p,ml
Method Washing-Up Liquid Peach + Pink Pepper 532ml,3.00,unit,5.64,ltr
Drum Original Blue Tobacco 30g,16.35,unit,54.50,100g
"Febreze Bathroom, Continuous Air Freshener Odour Elimination & Prevention, Cotton Fresh",3.50,unit,3.50,ea
HP 364 Multipack,37.00,unit,37.00,ea
Sovereign Blue King Size 5x20,47.25,unit,47p,cig
Old Holborn Yellow Tobacco 50g,19.99,unit,40p,g
Zoflora 3 in1 Action Concentrated Disinfectant Linen Fresh 500ml,5.00,unit,10.00,ltr
BBC Gardeners' World Magazine,5.45,unit,5.45,ea
"Duracell Specialty LR44 Alkaline Button Battery 1,5V, pack of 4",8.00,unit,2.00,unit
Blu E-liquid Tobacco,3.95,unit,40p,ml
Sterling Green Superkings x20,10.15,unit,10.15,ea
Sovereign Sky Blue King Size x20,9.25,unit,46p,cig
Vileda Supermocio Microfibre Mop Refill,5.00,unit,5.00,ea
Cif Power & Shine Kitchen Ecorefill 70ml,1.50,unit,21.43,ltr
Bic 4 Colour Pen,2.50,unit,2.50,ea
6pk Dinner Cracker - Enchanted Trad,5.25,unit,5.25,ea
Sterling Superkings 5x20,50.50,unit,51p,cig
Cookasheet Reusable Cooking Liner,1.50,unit,1.50,ea
Lenor In-Wash Scent Booster Gold Orchid Beads 264g,4.00,unit,15.15,kg
"Energizer Rechargeable Battery, 2300MAH AA 4 x4",13.00,unit,3.25,batt
Blu Pro Clearomiser,5.50,unit,5.50,ea
Crayola 12 Supertips,2.25,unit,2.25,ea
Bella Magazine,2.30,unit,2.30,ea
TV Times Magazine,4.25,unit,4.25,ea
Sovereign King Size x20,12.20,unit,61p,cig
Lenor In-Wash Scent Booster Spring Awakening Beads 264g,4.00,unit,15.15,kg
Sainsbury's Home Bulb LED Frosted Candle 40w BC x2,5.00,unit,5.00,ea
Benson & Hedges Green Superkings x20,9.30,unit,47p,cig
Ariel 3in1 Pods Colour & Style Washing Liquid Capsules (25 Washes),7.00,unit,11.76,kg
Febreze With Ambi Pur 3Volution Air Freshener Plug-In Refill Spring Awakening with Lenor 20ml,2.75,unit,2.75,ea
Sterling Dual Cigarettes x20,10.25,unit,10.25,ea
Sainsbury's Home C5 White Self Seal Envelopes 50pk,2.00,unit,2.00,ea
Glade Candle Arctic Apple Pie 129g,4.00,unit,4.00,ea
"Kiwi Instant Wax Liquid, Brown 75ml",2.60,unit,2.60,ea
Kiwi Natural Bristle Polishing Brush,2.20,unit,2.20,ea
Fun To Learn Peppa Pig Magazine,3.99,unit,3.99,ea
Sainsbury's Home Extra Long Life AA8 Batteries,4.50,unit,56p,unit
illoom Happy Birthday Light Up Balloon x5,3.50,unit,3.50,ea
Old Holborn Yellow Tobacco 30g,12.00,unit,40.00,100g
Sainsbury's Bio Laundry Powder 1.625kg (25 Washes),2.50,unit,1.54,kg
Prima Magazine,4.25,unit,4.25,ea
Method Washing-Up Liquid Green Tea + Citrus 532ml,3.00,unit,5.64,ltr
6pk Luxury Crackers - Eco Kraft Trees,7.50,unit,7.50,ea
Berol 2 Handwriting Pens Black,3.00,unit,3.00,ea
Glade Candle Honey & Chocolate Air Freshener 129g,4.00,unit,4.00,ea
Benson & Hedges Gold King Size x40,26.20,unit,66p,cig
Good Housekeeping Magazine,4.99,unit,4.99,ea
Dishmatic Glide Brush,2.40,unit,2.40,ea
Sainsbury's 2 in 1 Bio Lavender & Jasmine Concentrated Laundry Liquid 750ml,1.75,unit,2.33,ltr
Sharpie 2pk Black Markers,3.00,unit,3.00,ea
4m Wrap - LWC - Hibernation - Scene Trees,2.00,unit,2.00,ea
Dylon All-in-1 Intense Black Fabric Dye 350g,5.00,unit,5.00,ea
Sainsbury's Home Plastic Pegs x24,2.25,unit,2.25,ea
6pk Dinner Cracker - Gold Foliage,5.25,unit,5.25,ea
Pall Mall Blue Flow Superkings Cigarettes x20,9.50,unit,48p,cig
Vype E-liquid Refill,4.00,unit,40p,ml
Superkings Blue x200,127.00,unit,64p,cig
Pall Mall Red Flow Superkings Cigarettes x20,8.60,unit,43p,cig
Pall Mall Tobacco 30g,11.00,unit,37p,g
Country Homes & Interiors Magazine,4.70,unit,4.70,ea
Old Holborn Tobacco 30g,17.25,unit,58p,g
Rac 9 Led Aluminium Torch,3.49,unit,3.49,ea
Woman's Own Magazine,1.40,unit,1.40,ea
10pk Cards - Trad Santa,2.50,unit,2.50,ea
"Kiwi Express Shoe Shine, Neutral",2.60,unit,2.60,ea
Febreze 3Volution Air Freshener Plug-In Refill Spice Apple 20ml,2.75,unit,2.75,ea
Marigold Squeaky Clean x1,1.50,unit,1.50,ea
Lambert & Butler Bright King Size 10x20,102.50,unit,51p,cig
Ariel All-in-1 Pods Active + Odour Defence Washing Liquid Capsules 22 Washes,7.00,unit,12.15,kg
Stardrops The Pink Stuff The Miracle Cream Cleaner 500ml,1.00,unit,2.00,ltr
Marlboro Gold 30g,11.00,unit,37p,g
House 24/7 Dusters x3,41p,unit,14p,ea
Windsor John Player Special Bright Blue Superkings 5x20,50.45,unit,50p,cig
Berol 2 Handwriting Pens Blue,3.00,unit,3.00,ea
"Duracell Specialty N Alkaline Battery 1,5V, pack of 2 (LR1)",5.00,unit,2.50,unit
Sainsbury's Home Palm Rose Gold Paper Straws x25,2.00,unit,2.00,ea
Method Fabric Softener Pink Freesia 1.58L,5.00,unit,3.17,ltr
Primavera Del Grano Penne Pasta 5kg,4.00,unit,8p,100g
Febreze Air Freshener Spray Pet 300ml,4.00,unit,13.33,ltr
10pk Slim Cards - Dogs,2.50,unit,2.50,ea
Post-It Notes Super Sticky Lined Pads,3.00,unit,3.00,ea
"Duracell Ultra Alkaline AAA Batteries, pack of 12",12.00,unit,1.00,batt
"Air Wick Limited Edition Freshmatic Autospray Refill, Mulled Wine  2 Refills x 250ml",7.00,unit,3.50,ea
Dr. Oetker Celebration Candles x6,1.70,unit,1.70,ea
Chesterfield Bright Superkings x20,8.60,unit,43p,cig
Sainsbury's Home Bulb Oven Bulb 15W SES,2.00,unit,2.00,ea
Players Red Superkings x100,46.25,unit,46p,cig
Lenor Burst of Sunshine Fabric Conditioner 1.05L (30 Washes),3.00,unit,2.86,ltr
Surf Coconut Laundry Capsules x20 482g,4.50,unit,9.83,kg
Febreze Ambi Pur Plug In Air Freshener Starter Kit Blossom & Breeze,4.00,unit,4.00,ea
Febreze Ambi Pur 3Volution Plug In Air Freshener Starter Kit Cotton Fresh,9.00,unit,3.00,ea
Febreze Fabric Freshener Spray Blossom & Breeze 375ml,2.00,unit,5.33,ltr
Febreze Ambi Pur 3Volution Air Freshener Plug in Refills Vanilla Latte,7.00,unit,3.50,ea
Sainsbury's Home Cream Tablecover 120x180cm,2.50,unit,2.50,ea
Mayfair King Size 5x20,52.75,unit,53p,cig
Sterling Blue King Size x20,10.15,unit,51p,cig
Pass The Parcel - Sprout / Robin,3.75,unit,3.75,ea
HOME LED GU10 35W x2,4.00,unit,4.00,ea
Vileda Magic Mop Flat Refill,3.25,unit,3.25,ea
Air Wick Scented Oil Smooth Satin & Moon Lily Air Freshener Refill 2x19ml,5.00,unit,5.00,ea
Paw Patrol Celebration Cake 918g (Serves 18),12.00,unit,1.18,100g
Ecover Zero 25 All-In-One Dishwasher Tablets 0.5kg,7.00,unit,7.00,ea
Uni-Ball Eye Ub-157 Black Pens X2,5.00,unit,5.00,ea
Air Wick Scented Oil Crisp Linen & Lilac Air Freshener Warmer & Refill 19ml,6.00,unit,6.00,ea
John Player Special Real Blue Superkings 5x20,50.50,unit,51p,cig
Finish Quantum Ultimate Lemon x25,7.00,unit,28p,ea
Sellotape Clever Tape Dispenser,2.50,unit,2.50,ea
Glade Sense & Spray Automatic Air Freshener Refill Ocean Adventure 18ml,4.00,unit,4.00,ea
Bic Cristal 10 Asstd Ballpens,3.00,unit,3.00,ea
Crayola Twistable Crayons 12pk,2.25,unit,2.25,ea
Just Love Food Company Vegan Chocolate Cake,6.00,unit,1.24,100g
Flash Antibacterial Kitchen Cleaning Spray For Hard Surfaces 500ml,2.00,unit,4.00,ltr
Persil  Non Bio Washing Liquid 105W 3.675 L,11.00,unit,3.88,ltr
Sainsbury's Home 10pk Clear Tumblers 500ml,1.50,unit,1.50,ea
JPS Players Green Filter Superkings x20,9.30,unit,9.30,ea
Z-grip Ball Pen Black x5,2.50,unit,2.50,ea
Comfort  Pure Fabric Conditioner 166 Wash 5L,6.00,unit,1.20,ltr
Lenor In-Wash Scent Booster Spring Awakening Beads 194g,6.00,unit,30.93,kg
Blu E-liquid Blueberry,3.95,unit,40p,ml
Method Fabric Softener Ocean Violet 1.58L,5.00,unit,3.17,ltr
Glade Candle Merry Berry & Bright 129g,4.00,unit,4.00,ea
Febreze Bathroom Air Freshener White Jasmine,3.00,unit,3.00,ea
Sainsbury's Home Shot Glasses Clear x40,2.00,unit,2.00,ea
Rizla Fresh Mint Flavour Infusion Card,39p,unit,39p,ea
HOME LED Mini Globe 40w SES x2,5.00,unit,5.00,ea
"Kiwi Instant Wax Liquid, Neutral 75ml",2.60,unit,2.60,ea
Stabilo 4 Pack Highlighters,4.00,unit,4.00,ea
